num_debate,canal,username,fecha,comentario,num_likes
3,excelsior,tonchi74,19/05/2024,1:27:47 UN PEZ DE SPONGEBOB??????????????????????????,0
3,excelsior,eusebiohernandezgonzalez858,19/05/2024,"Y la canasta básica también aumentó, o no saben, porque les apuesto a que ellos no saben lo que es ir a comprar un Kg de huevo, porque ellos no lo pagan de su bolsillo",0
3,excelsior,teresamunoz1060,19/05/2024,"Que corriente la xochilt,lo único que hace es querer provocar a Claudia, porque no puede con ella.",29
3,excelsior,franciscopegueros6792,19/05/2024,"Porque dejan que la chochitl levante pancartas eso esta prohibido, porque la dejan, pobre xochitl estas a la disposición de claudia",26
3,excelsior,aracervant5627,19/05/2024,Y de donde va a sacar Claudia el dinero para Las mujeres de 60..... Sera que de Las mujeres de 40 y 50? De Las q si trabajan de sus ahorros e impuestos?,0
3,excelsior,MV-lr2ze,19/05/2024,"Sabes cuando olvidas que alguno de estos tres va a ser presidente, realmente es muy gracioso",0
3,excelsior,dianacabrera4979,19/05/2024,"En mi humilde opinión, jorge es el que más lo puede manejar,  a veces son incoherentes sus propuestas , como van a detener a un  mariguano! Es el que nobse pone a discutir ni hechas habladas con  sus mensajitos o pancartas  contra sus oponentes por qué la que siempre tiene chicharito, si no, no sabe que decir y de plano no, ahora con claudia, comentan sobre le  escritora anabel, es buena  investigando y si, no creo que todo sea a  resultados  cuando la gente ya no puede salir a la calle ni de vacaciones sin que le hagan algo, efectivamente  ella también tiene sus números. Maquillados, como es visible, pero algo debe mejorar.",8
3,excelsior,MariadelaLuzLaraBuchar,19/05/2024,En todos los debates es lo mismo con Xóchitl.  Nomas mirando a Claudia.  Pero no propone nada bueno.,30
3,excelsior,aleesanchez6579,19/05/2024,"Soy de Argentina y la verdad que me parecen tres impresentables que les puedo decir, no les creo a ninguno de los tres y no le veo mucho futuro a Mexico asi... Mi humilde opinion",0
3,excelsior,MargaritaR.Ch.,19/05/2024,"Ella se cree hecha a mano, igual que su amo, no contesta cuando no tiene respuesta.",0
3,excelsior,rosaiselaperezhernandez6358,19/05/2024,"Xochil, tu lo digiste, te lo recordamos. Sra claudia , gracias al nuevo gobierno, hay menos ninis, maynez tu gobierno de mc, nos dejaron sin apoyos.",17
3,excelsior,user-hq9rg6qx6g,19/05/2024,Wau Wau Claudia “ muy bien dicho fuiste a debatir no a calumniar “ jajaja,37
3,excelsior,cruzvictoriaguzmanruiz4590,19/05/2024,Soy desimotransitorio pero cuando me jubile me pagaban 8000 pesos mensuales y ya paran 10 años  pues me jubile 2013  1 de octubre tomo prejubilado y empezó mi jubilación 2014 y a ido aum e notando poco,0
3,excelsior,elisarodriguez6219,19/05/2024,Por favor defiendan a las criaturas que secuestran defiendan a los niños que no dejan hacer defiendan los hospitales,0
3,excelsior,user-sp9jc5li2v,19/05/2024,Y la canasta básica para cuando no me sirve de nada que el salario suba 100 pesos si el aceite el huevo el gas suben 50 cada uno,6
3,excelsior,user-lb1kb9me7d,19/05/2024,"Que mis hermanos Mexicanos No se hagan ilusiones sobre un país sin problema de seguridad, independientemente quien gobierne,el mal radica en el corazón de las personas. En políticos,en religiosos,en gente civil,etc. Se ocupa amor a México y amor y respeto a la vida de todos los demás,por encima del interés personal.",16
3,excelsior,elromantico7820,19/05/2024,Xochitl habla del agua y ella es la culpable de falta de agua con sus empresas adónde es socia con que cara habla de escasez de agua,0
3,excelsior,carlosjesusolvera9262,19/05/2024,Claudia apunta    los temas que escucha    y esos temas esos apuntes  son  para  valorarlos y  ejercerlos eso  de apuntar  lo hace una persona que esta estudiado   muy buen carácter     para  anotar eso habla de una persona que  sabe y que  estudia     shenbaun     nuestra próxima presidenta     bendiciones  a  ella,0
3,excelsior,eloisamartinez8049,19/05/2024,Que no le habian dicho a xsochil que cusndo no es su tiempo no enseñe letreros ️,39
3,excelsior,aidetcedillocortes1790,19/05/2024,Porq nadie piensa en hacer un hospital de cardiología  que mucha falta nos hace acá en el estado de México,7
3,excelsior,RobertoGonzalez-vw2kh,19/05/2024,"El apoyo a los Adultos mayores esta muy  bien que continúe ya que muchos malos hijos dejan de lado a sus padres  y nadie los contrata tambien.. El PriAn tuvo su oportunidad de hacer un cambio en mexico  lamentablemente solo robaron y no tuvimos cambio si no al contrario  violencia , desaparecidos muchas cosas ,  .. obviamente un cambio no viene de la noche a la mañana y mucho  menos en un país se  logra hacer un cambio  , pero Mi viejito Andres Manuel  milagrosamente a demostrado mucho ah hecho muchas cosas , y la manera en que continúen estos cambios o Transformación es continuar con MORENA ,  Para que volver al PRIAN.?? SI SE SABE Q LO LO INICO Q HACEN ES ROBAR",0
3,excelsior,ethelbalammaldonado495,19/05/2024,"Amigo no todos van a la escuela por la educación de los padres que no tuevieron esa oportunidad y la beca si ayuda a los niños a no dejar las escuelas pero igual y pese a esto laa condiciones sociales como padres alcohólicos, drogadictos con problemas emocionales donde vivo un grupito de niños cuando reciben au beca se juntan y consiguen frutas. Las venden fuera de la  escuela porque saben que papá o mama lo van q mal gastar y es sorprendente como pelean su dinero y han entendído que necesitan mover ese dinerito. Claro no es el caso de todos pero esto les da una oportunidad para que salgan los emprendedores del futuro",0
3,excelsior,franciscopegueros6792,19/05/2024,"Si es cierto, la chochitl solo rebuzno en contra de claudia, jajajaja esta envenenada del coraje y la rabia que le tiene a claudia,",16
3,excelsior,baltazarpascual,19/05/2024,Fuerza e inteligencia México!!!! ahora tienen la oportunidad de seguir en el camino correcto a convertirse en una nacían mucho mas prospera y ser el ejemplo a seguir para Latinoamérica. Vallan por todo con el plan C. Saludos desde Guatemala!!!!!!,28
3,excelsior,user-ui1rz9re5p,19/05/2024,"Maynez comparando salarios gringos con los de Mexico, vaya ridiculez",0
3,excelsior,leojuarez3477,19/05/2024,Estaríamos viviendo en un país  con dignidad cuando un político no sería  corruptos y onesto  y que no sea por dinero que les llega en sus manos por el país  es muy rico lo único que buscan los políticos es ser rico y los pobres pagando impuesto.,0
3,excelsior,anavera4001,19/05/2024,"Dios ilumina a México para tomar con conciencia y que sea mejor para nosotros, la sociedad necesita un cambio de bien, dónde hasta compresión , dónde si trabajemos de la mano todos unidos, por una mejor vida,",7
3,excelsior,AbelGarcia-ml3ji,19/05/2024,Gracias Claudia Sheimbaum por tu propuesta un voto masivo para Claudia Sheimbaum arriba Morena arriba Claudia Sheimbaum arriba Andrés Manuel López Obrador,29
3,excelsior,angelulloa6696,19/05/2024,No se saca nada de estos 3 ..   o se dabe cual es peor ..,0
3,excelsior,MarioCruz-sb7vk,19/05/2024,D q sirve seguro popular no hay medicamento  xochil arriva claudia,0
3,excelsior,user-cs9rm8fl3o,19/05/2024,"Xóchitl tienes que reforzar mas la ""r"" en tu vocabulario,  es solo una observación",10
3,excelsior,odilarubio9617,19/05/2024,Maynez no uses a los niños. Fuera. Mientes igual q el pri.,100
3,excelsior,gabrielgaleana712,19/05/2024,La transformación de un país no sólo es responsabilidad del gobierno sino de cada familia e individuo que lo integra trabajando con honradez y esmero haciendo cada uno su parte tanto el gobierno como la sociedad,0
3,excelsior,valerialozada9003,19/05/2024,"Me hartó la voz de xochitl,  no votaría por ella, definitivamente sería muy molesto escucharla en cada informe o lo que sea que tuviera que decir",0
3,excelsior,rosaelenamartinez6282,19/05/2024,Que gane quien pero que Aga algo por la gente,14
3,excelsior,juliancruz46,19/05/2024,186 mil muertos Xochitl?  Y los muertos de Calderon?. Mas los desaparecidos.,56
3,excelsior,kit_suki-otak4848,19/05/2024,Quien te gustaria que estuviera a  tu lado si te wnvuentras en peligro en la carretera dice mainez y gue el primero en coreer cuando se cayó el templete donde se presento sin la mas minima idea de ayudar a las que estaban arriba,0
3,excelsior,alanavalos9896,19/05/2024,Aquí si le vas a morena!!!,3
3,excelsior,mariadelapazresendis6049,19/05/2024,"Porque no hay denuncia de obras no realizadas ,pero si están registradas como ya hechas en el sistema ejemplo calles pavimentadas...",16
3,excelsior,ileananunez8298,19/05/2024,"Lo q dicen de la frontera sur, es completamente cierto. Yo vivo en Chiapas y está completamente controlado x el crimen organizado, los pueblos están siendo atacados! Y actualmente es uno de los estados más calientes en este momento!!",7
3,excelsior,ruthgarcia3760,19/05/2024,"""... A los tres se les pregunta: que van hacer concretamente, con qué, cómo y CUÁNDO van hacer un plan eficiente, splicable, medible y público, para no haya un solo meccano revogiendo migajas de los famosos programas, para que el presupuesto que se esfuma en los tales programas sociales, se invierta en crear y cobstruir fabricas, manofactura, empress productuvas para el desarrollo e independencia evonomica de los mexicanos,... cuándo? Cómo y vuando van a recuperar todos los shorros personales de los jubilados oensionsdos y votizantes,nprocesar a los lafrones wue orestaron y no han querido pagar???"" Esclavos humillados por los los "" programas"", familias de jubilafos, pendionados y trabajadores, emigrantes que pagan impuestos.",0
3,excelsior,pameyjeny4852,19/05/2024,Ala conductora de lentes NO SE LE ENTIENDE SU VOZ,0
3,excelsior,user-lu3xq9vw3e,19/05/2024,No nos alcanza por qué todavía el pueblo está pagando sus transas de cien años PRIAN corruptos,33
3,excelsior,diannis2367,19/05/2024,"Yo estoy genial con Morena cada mes tengo mi despensa aquí en tecamac crecio mucho con Morena, nos dan zapatos para todos los niños del municipio para la escuela hay mucho apoyo",20
3,excelsior,danielvudoyra1784,19/05/2024,La pregunta cuáles son sus propuestas de gobierno para sacar a delante el país.,0
3,excelsior,user-ij8cs5sc5y,19/05/2024,"Xóchitl solo va a los debates a andar defiendo con un cartel que dice ""deja de mentir"" y a criticar  a Claudia",0
3,excelsior,MonikaOsante-rz8lj,19/05/2024,"0areseria q ingresar ala universidad es como sacrificarse y no deveria ser asi , deveria de ser mas facil ingresar a una universidad publica",11
3,excelsior,diegopadilla5042,19/05/2024,Desde USA 🇺🇸 mi voto ️ es de MORENA,79
3,excelsior,MariaRamirez-qz6gv,19/05/2024,En Ecatepec no va ver agua hasta que pase las votaciones y que votemos por morena,0
3,excelsior,carlosjesusolvera9262,19/05/2024,Eso si  aumento las camaras de la coudad de mexico  y  ahora a diario   detienen   a delicuentes  que  roban  cosas pequeñas   pero  si hace el orden,0
3,excelsior,kristinapupelyte181,19/05/2024,"Reducción de percepción social de inseguridad nacional?! En Colima nunca se ha vivido tal nivel de inseguridad cómo está ahora, está como el estado mas violento del MUNDO...",9
3,excelsior,anabellvargas2705,19/05/2024,Sheibaun tu unica carta de victoria  son los programas sociales. De ahi todo lo que dices son mentiras y corrupción,17
3,excelsior,IrissusetFranciscoManuel,19/05/2024,Morena ya no Kito los medicamentos de los centros de salud Kito  Barias cosas Kito el seguro popular,0
3,excelsior,reubengonzalez5615,19/05/2024,"Enterate más Jorge - o ¿ Acaso también eres terrorista ?  ¿ Osea deseas  que siga jamás .?   Creo te falta entender ese tema ,--",0
3,excelsior,user-pm9km5oi2k,19/05/2024,Esas fosas que dices xochitl.  Son herencia de  los  partidos que representas,18
3,excelsior,danyreza4190,19/05/2024,Le duele a la botarga que claudia  no la volté a ver  pero que bueno  que claudia sea mas professional,12
3,excelsior,elenacarrillo6049,19/05/2024,esos desaparecidos de los habla Xochitl pregúntenle a la Xochil Gálvez en qué trabajaba  su hermana,0
3,excelsior,anaaliciaagueda7747,19/05/2024,Xochil no sirve es puro chisme y ademas es muy corriente,2
3,excelsior,user-lb1kb9me7d,19/05/2024,No se le puede tener confianza a politicos que favorecen más a los intereces extranjeros que el bienestar de su propio país y de su gente.,12
3,excelsior,mondee3828,19/05/2024,"No salieron, Xóchitl,  fueron acarreados por Claudio X. Y muchos fueron obligad@s, están con Morena y los obligaron.",23
3,excelsior,antoniomartinezmejia8730,19/05/2024,XQUE.   PUBLICAN. UNA. COSA. Y. DICEN. OTRA. QUE NO NOS. INTERESA. A. MUCHA. GENTE.,0
3,excelsior,miriamzamara5567,19/05/2024,Si vien el seguro es  necesario más clínicas  y mejor servicios  dentan y mejor surtido  de medicamentos  todos se quedan cortos  eso dejar de la lado enfermedades  a ninguno se les oye mejorar  eso,0
3,excelsior,user-bz2qm6jh5r,19/05/2024,"Xochitl Gálvez, está fuera del contexto del debate y tiene 1 punto menos",20
3,excelsior,janette_larios_,19/05/2024,El único que toma en cuenta la salud psicológica es Máynez. Es un tema importante para cualquier cambio para mejorar nuestra sociedad.,15
3,excelsior,jorgesaulurbanobalcazar4950,19/05/2024,Si el  PRI. Vuelve al poder olvidarse  los estados del sur por qué nos van a dejar olvidados  si se dan  cuenta Chiapas  tiene muchos recursos saquen provecho  ahorita México fuera potencia económica,0
3,excelsior,a.p.001,19/05/2024,Esta señora doña Mochil Galvez primero debería de aprender a hablar,0
3,excelsior,FernandoSouza-yk9qo,19/05/2024,"VOTO MASIVO ️️ PARA MORENA, PT Y VERDE EN TODOS LOS PUESTOS DE ELECCIÓN POPULAR, SOBRE TODO LA PRESIDENCIA DE MÉXICO PARA CLAUDIA SHEINBAUM PARDO️️🇲🇽  CLARA BRUGADA PARA LA JEFA DE GOBIERNO DE LA CDMX Y GUBERNATURAS, ALCALDES, MUNICIPES, EN LOS ESTADOS, ETC. ️️️️️🇲🇽",58
3,excelsior,franciscopegueros6792,19/05/2024,"La chochitl es una candidata acomplejada y minúscula, a leguas se le nota la envidia y el coraje que le tiene a claudia",12
3,excelsior,CELSOR.,19/05/2024,"BUENO...  Los que estuvieron gobernando durante ¡SETENTA AÑOS!...  ¿Se acordaron de los pobres?  Ahora se arañan de ""tanto amor"" a los pobres.   Además decir ""pobres"" es un verdadero insulto a la inteligencia: en el siglo XXI; no deberían haber pobres, en ninguna parte del planeta...  Tecnología nos sobra; también espacio, en realidad la tierra está poco poblada, el único problema; es el estúpido desorden productivo, ocasionado por enfermos sicópatas, verdaderos asaltantes que van al bandidaje económico sin ningún control, dejando enormes pasivos para las generaciones venideras.",0
3,excelsior,angeltellez7478,19/05/2024,"se les hace fácil ver los toros de las gradas pero no en donde está el torero , lo que tratan es ensuciar la imagen del señor y eso se llama instinto de supervivencia y como me había gustado mucho que fuera el quien estuviera hay aver si es cierto",0
3,excelsior,jesusvargas9393,19/05/2024,"Suben el salario, y suben la canasta básica  te friegan en los impuestos",20
3,excelsior,nareideluna4894,19/05/2024,"Esta señora xochil,igual como los demas debates anterior3s,no hay propuesta  solo se dedica Atacar.no sabe gobernar asus hijos,que pueda con un país esta bien dechabeta de la cabeza.todos con Claudia ahi esta la sabiduria,el entedimiento y la transformación,seguimos connla 4T.",10
3,excelsior,user-lm8dg8ub8n,19/05/2024,Son. Buenos. Los debates. Porque. Así. Notamos. Quien. Podría ser. Mejorcito. Para Gobernar. Tengamos. EnCuenta k. Son promezas k. Que. Se. Hacen.  Pero. Al. Final. No. Pueden. Decidir Ellos. Solos.,0
3,excelsior,bettyparis3186,19/05/2024,Maines: prometer no es empobrece  el que nunca ha gobernado ni un comité vecinal,0
3,excelsior,ClaudiaLopez-tw7sq,19/05/2024,"Nunca estuvimos peor que ahora en seguridad y en economía aumentan salario mínimo pero queda igual sin alcanzar pues todo a aumentado más del doble cual es el beneficio, en educación debería de haber más universidades sin necesidad de exámenes y de buena calidad, programas reales de mejora al ambiente en fin estamos fritos.",9
3,excelsior,user-cu7zh7mh3z,19/05/2024,Ya botarga puras mentiras y calumnias ya no puedes botarga no tienes como defenderte solo atacando a tu futura Presidenta  vamos todos con la 4 T,23
3,excelsior,rigobertomagdalenonavarret5562,19/05/2024,De que consensos habla la Sra. representante del PRIAN Y PRD si siempre se opusieron y votaron en contra a las reformas y leyes que le convenían al pueblo de México,0
3,excelsior,UL11111,19/05/2024,"Que estrés que la falduda no pueda con la R, No puedo neta no puedo!!!",0
3,excelsior,marcelaespinoza5140,19/05/2024,No prometas lo que no bas a cumplir xochil,31
3,excelsior,innagomez626,19/05/2024,Las estancias infantiles lo veían personal en su mayoría sin título y tiempo completo muchos maestros no lo trabajaban; en Chiapas en Gobierno de Velasco todo elevabann los precios.,13
3,excelsior,user-kp4rp5ur3k,19/05/2024,Me gustaría que algún presidente  propusiera que solo dejara tres partidos para no se derroche mucho dinero con la existencia de muchos partidos politicos   Que los elijan por medio de votaciones oh algo si,0
3,excelsior,vickyrodriguez2651,19/05/2024,"La Claudia habla de "" educación"", cuál!?",0
3,excelsior,sacnitegil1906,19/05/2024,"Xochiltl se ve súper desesperada, les urge el voto al prian porque le han invertido mucho dinerito a su campaña y les urge recuperarlo",16
3,excelsior,josehernandezromero3917,19/05/2024,Ya calle esa botarga que dice puras mentitasviva la 4T,30
3,excelsior,HugoCuriel-on2yh,19/05/2024,No se puede correr el riesgo de que quiten el vienestar de los mallores por eso y otras cosas mas no apollaremos al pan y al pri,0
3,excelsior,ChristianRodriguez-mh3fv,19/05/2024,Jefe digeo te acorralaron  en  tu cuamtico futuro,1
3,excelsior,ricardozapata973,19/05/2024,"Definitivamente debemos continuar con el proyecto de transformación, con una verdadera democracia.",7
3,excelsior,esperanzatoxqui1534,19/05/2024,Bravo  felicidades Claudia próxima presidenta votemos por morena,122
3,excelsior,lauraperez-uf7bz,19/05/2024,Creo que Maynez es la continuidad de lo bueno de este gobierno pero con otro enfoque necesario para seguir careciendo,0
3,excelsior,Mr6106552,19/05/2024,"55:00 estoy en desacuerdo , México es famoso por ser neutral, asi debería mantenerse",0
3,excelsior,jimmymarquez4218,19/05/2024,Agregar a niños y niñas es evitar los secuestros de niños y niñas y venderlos como mercancía y en eso están muchos de los que estubieron en puestos de política,4
3,excelsior,MaryselaEscobar,19/05/2024,Esta mujer me confunde xochitl no se si es francesa o rusa,7
3,excelsior,vilmamartinez5692,19/05/2024,Claro que es bueno muchos no tiene de que comer y ese dinerito les ayuda por eso votar por Claudia para que no lo quiten,0
3,excelsior,ashlamgutierrezgomez688,19/05/2024,"Fuera de mmda…  El único que propone y es convincente, es Maynez. Xóchitl le tira a Claudia y ella solo se defiende.  Al final, ninguno representa a nuestro país y sus necesidades.",0
3,excelsior,marcelaespinoza5140,19/05/2024,Y Xochil siempre miente,15
3,excelsior,robertomartinezavelino,19/05/2024,Muy bien MAYNEZ EXCELENTE TURNO DE 7 HORAS 5 DÍAS NO MÁS LA MANO DE OBRA EN MÉXICO ES BARATA COMPARADO CON OTROS PAISES,30
3,excelsior,josebrambila3209,19/05/2024,"Que diferiencia tan grande la manera que ba bestida la señora Claudia,en comparación a xochitl",0
3,excelsior,guadalupefarfan3375,19/05/2024,Xochitl ya cambio de táctica ahora resulta que le interesa los pobres si de principio opino que no están de acuerdo con los apoyos,0
3,excelsior,isabelsalinas594,19/05/2024,Felicidades viva MORENA,39
3,excelsior,carmenrobles8151,19/05/2024,PoRQUE NOMAS ATACAS  A CLAUDIA LE TIENES MIEDO A EL PKBRE DR TĮ,20
3,excelsior,libreriaentzana3745,19/05/2024,En qué mundo vive Claudia con su gráfica de la percepción de la inseguridad,0
3,excelsior,PVNDA735,19/05/2024,"JAJAJAJAJA WEEEYY PRIMERO ""LOS POBRES"" pinché palabra tan fea, entiendan amigos, si asi nos dicen es por que asi nos ven, como unos pobres, no solo económicamente...",0
3,excelsior,trinidadchavezmartinez1362,19/05/2024,Maynez felicidades que dijiste Xochitl te falto esa parte muy bien,4
3,excelsior,ObduliaRetamaR,19/05/2024,Zochil tu no vaz a representar a nadie no te queda la banda presidencial te verias chistosa ji ji,4
3,excelsior,AdrianaGarcia-ly1vp,19/05/2024,Xochil no tiene propuestas propias,0
3,excelsior,guillermomendoza7684,19/05/2024,An permitido que exista más violencia,0
3,excelsior,herberthernandez8241,19/05/2024,"Jajajajaja de Risa loca Xochilth tiene que leer sus propuestas, se me hace más inteligente Peña.",27
3,excelsior,anonimo-oh7bn,19/05/2024,Plan C,10
3,excelsior,JessicaAcosta-hg9lj,19/05/2024,"Xochitl en vez de decir algo cuerente de ver como va a solucionar, solo tira y tira",0
3,excelsior,victorvera9293,19/05/2024,poner gentge capscitada y no lucrar con las nesesidades del las personas eso es lo que nos pasa aca en tijuana arreglen eso,0
3,excelsior,hectorescobar505,19/05/2024,Bien dicho Claudia vienen al debate,20
3,excelsior,hermilasanchezsanchez8717,19/05/2024,Soy Herminio yo pregunto Cladia que paso con la gasolina q hiva a costar a 10. Peso,4
3,excelsior,fernandoalverdin-gu6uu,19/05/2024,"Ya no se si es un debate por el bien del país  o es comedia , Xóchitl devria  hacer mancuerna con brincos dieras",0
3,excelsior,mastersherato3354,19/05/2024,"que no es sacar ventaja xochitl con laminas o cartulinas fuera de su tiempo por eso hay reloj , eso es ser ventajosa y aprovechada.",0
3,excelsior,user-wz3eu7jv9k,19/05/2024,Xóchitl deja de prometer cosas que bien sabes que no podrás cumplir porque la lengua no tiene hueso y la mayoría de veces habla más de la cuenta así que deja de hablar tanta basura,5
3,excelsior,zuckzo,19/05/2024,"Que flojera dan, la neta puros pobre candidatos nos dieron. al dia de hoy hay que votar por el menos peor.",5
3,excelsior,CoOte041,19/05/2024,Sinceramente en Mi humilde opinión morenas a cochino mucho solamente le da oportunidad a los que están lejos y a los que son trabajadores Nunca es una oportunidad Y si gana morena por más veces nos va a llevar a la quiebra aparte los que tienen pensión bueno o los viejitos que no trabajan o los menores que no que tienen dinero piden vegetación así se las Dan con ya tener dinero Eso es para los más necesitados no para los que ya tienen dinero así que son muy acolchados los del morena sinceramente porque nos mantenemos de su dinero básicamente y hay más impuestos más bien el dinero que les dan a los demás son nuestros impuestos no hay quien gane todos tienen unas propuestas horribles Y si alguien gana puede ser Pero para ser sinceras nos va a llevar a la quiebra,0
3,excelsior,marcosgandarilla8849,19/05/2024,Está xochilt  Gálvez  habla  de lo que el señor y la señora claudia hablan,0
3,excelsior,JulioEnriqueFlores,19/05/2024,"Que hable sobre el secuestro, que es a lo que se dedica su hermana",6
3,excelsior,elisaitzelbecerramartinez8098,19/05/2024,"En qué realidad vives Claudia, menos violencia, mejor economía etc etc... Siempre tienen tú y AMLO los datos más maravillosos... Solo Dios sabe en qué país viven ustedes",4
3,excelsior,user-yi6uz7le5f,19/05/2024,Ganará claudia . Esa otra señora es puro ataque . Que pena .,1
3,excelsior,CarlosZepeda-yg6fy,19/05/2024,"Da verguensa Esa mujer del Prian, deveras no pueden encontrar alguien por moments intelligente",0
3,excelsior,sandraavila6626,19/05/2024,"Apoyo total  a Morena,Claudia por mucho se los lleva. Xochitl mas mentirosa no puede ser",48
3,excelsior,fabiolasantos934,19/05/2024,"Su voz de mustia  de Claudia, esas son las peores, México despierta",5
3,excelsior,chayanaguacate3237,19/05/2024,"La verdad hay puntos importantes en los tres de eso se trata el debate el problema que la política ya tenemos desde Salinas que estamos  que ya no sabemos por quién votar y aún decidiéndote no lo ases convencido por qué No habido un Gobierno que resuelva de lleno la mejora de un país entero salud (falta de Medicamento ) ,seguridad  ( no existe si No tienes palancas  en el gobierno ,salario (aumento pero aumentaron todo la canasta básica ) etc",0
3,excelsior,user-ij9be8ih1e,19/05/2024,Quien te apoya en la frontera con Estados Unidos si no es la delincuencia,0
3,excelsior,Elenaceton,19/05/2024,"Ay Claudia mentira tras mentira, ya mero es segura la CDMX",10
3,excelsior,FelipeCalles,19/05/2024,"La Reforma a Pensiones busca evitar que las pensiones, sean jineteadas por los Bancos.",13
3,excelsior,user-de5fy8vi2w,19/05/2024,Eso no inporta lo que inporta son los botos,1
3,excelsior,pedromarban6070,19/05/2024,No me gustaría que soxilt nos represetara ante el mundo seve muy tonta México necesita gente inteligente y preparada,0
3,excelsior,salvadormendiolavanegas2076,19/05/2024,Min. 44:21 La Sra. Xóchilt no lograba entender lo que le decían por el chicharo,7
3,excelsior,silvialira9155,19/05/2024,"Que temple de Claudia de soportarla y contestar con tanta firmeza y garbo, felicidades.",31
3,excelsior,user-cn7qy8nm1m,19/05/2024,"La primera mujer presidenta de México, Claudia sheimbaum!! Wao se imaginan y bien preparada felicidades México!!",0
3,excelsior,lilamedinaandrade3134,19/05/2024,El candidato que anda en campaña se le arima las personas y les grita no me enpujen,0
3,excelsior,johndariogutierrez9995,19/05/2024,ES TRISTE QUE EL PRIAN TENGA UNA CANDIDATA TAN INFANTIL,5
3,excelsior,emmriosa,19/05/2024,"CERO propuestas de Xochitl, puras mentiras y quejas. Lamentable.",28
3,excelsior,HortenciaRamon,19/05/2024,"Muy buen comentario , señor Maine's mexico de pie en un mundo de cabeza",0
