num_debate,canal,username,fecha,comentario,num_likes
3,excelsior,monabolanos6729,19/05/2024,No disen nada por mexico nadamas se sacan los trspitos digsn q proponenn  para tu mexico,0
3,excelsior,user-cc8kf5ny2f,19/05/2024,Si no pueden ni con el ejercito....que va.,0
3,excelsior,AnyiTerreros-sw7ez,19/05/2024,Xochitl es la única que solo está echando culpa y lo único que pone es la cartulina que dice !!miente!! Y no a dicho nada bien,0
3,excelsior,hc6909,19/05/2024,se mamo CON su acento frances esa xochitl rrraaatrrreera,0
3,excelsior,user-yy5ps7dq6s,19/05/2024,Estamos contigo Claudia sonora estamos con morena ya no ratas priistas y ni panistas viva morena viva México,1
3,excelsior,ramonignacio90,19/05/2024,Que bulgar  esa mujer que  quiere  representar  a nuestro pais mexicano.,1
3,excelsior,user-lm8dg8ub8n,19/05/2024,Cómo quiera. México. Si. Está. Cambiando. En su política 3candidatos. En. Debate. Lo. Demuestra.  Arriba. México,0
3,excelsior,diegodelcid6472,19/05/2024,Dejen de decir mentiras cuando miran el dinero se olvidan de todo,0
3,excelsior,elisamanzo6107,19/05/2024,"Parece  la botarga , solo aventando  veneno !!",0
3,excelsior,alanavalos9896,19/05/2024,Pero bien q xochil leyó el libro,0
3,excelsior,Luci2-uo1jh,19/05/2024,todos roban pero que gane el que roba poquito....,0
3,excelsior,HannahMizialko-jw4xf,19/05/2024,Saludos de Chicago IL a Claudia  y los Demas son puros punches piratones,0
3,excelsior,Sa3126,19/05/2024,"Definitivamente, Xóchitl nada tiene que hacer. Me daría vergüenza tenerla como presidente. Igualito como cuando estuvo Peña Nieto.",0
3,excelsior,victorm.ramirez4203,19/05/2024,Ese Pobre maynez es un puto chiste no se Que ase ahi  viva Claudia,1
3,excelsior,user-qs7zs3hi2h,19/05/2024,Aqui si nos muestran los verdaderos intereses por la juventud y las familias desde el valor del peso desde grandes graficas así  poder incrementar grandes ganacias partidistas,0
3,excelsior,raguilar5325,19/05/2024,Que legalisen la mariguana.  Aver si así dejan de mandar los narcos.narcos y políticos ..unidos basta ya de tanta maldad,0
3,excelsior,gerardoriveravelazquez7115,19/05/2024,Siempre me da cringe ese cartel de claudia miente me da cringe,0
3,excelsior,DanielRivera-ie6jw,19/05/2024,Wow,0
3,excelsior,jesusmanualmanriquez3952,19/05/2024,"No eres onesta tu Xochitl,no eres ejemplo",1
3,excelsior,mirnarodriguez5762,19/05/2024,"Ni Maynez ni Xóchitl no son buenos , la única es Claudia Sheinbaum",0
3,excelsior,adolfoyepez4408,19/05/2024,Entodo mexico no ha subido ido el salario minimo,0
3,excelsior,lestat9444,19/05/2024,Sheinbaum se hizo pendeja con lo de su casa ilegal jajaja,0
3,excelsior,jorgesaulurbanobalcazar4950,19/05/2024,Los apoyos  los quieres  quitar para dárselos a tus partidos corruptos,0
3,excelsior,franciscolopezmejia8497,19/05/2024,La mejor en el debate yo de doy el voto a Claudia  será la mejor porque dice la verdad,1
3,excelsior,user-cc8kf5ny2f,19/05/2024,Yo quisieta ver las 10 universidsades de la tal Xochitl.,0
3,excelsior,JoseRazo-um3gl,19/05/2024,"Nunca a existido tanta libertad de expresión como en este momento, gracias a MORENA, y a las benditas redes sociales.",0
3,excelsior,JoseGamino-sv4kw,19/05/2024,"Otra vez el apuntador ,",0
3,excelsior,miguelolmos5278,19/05/2024,Álvarez Martínez el único que habló con la verdad Lástima que hasta los periodistas como Dóriga y sus achichincles compañeritos gustan de alabar sólo a Gálvez,0
3,excelsior,vetofrores6754,19/05/2024,Aquí en guerrero estamos con claudia. Yya,0
3,excelsior,cristinamartinezgarcia6721,19/05/2024,La señora Xóchitl no tiene respeto cada que habla la doctora Claudia sacá su cochino cartel y distrae eso no es repetoso de su parte,0
3,excelsior,olgalunanava3262,19/05/2024,"bravo   bravo   CAUUDIA  HAY  XOCHILT,  XOCHILT  COMO TE   GUSTA  CRITICAR   A  LOS   DEMAS",0
3,excelsior,MarioAlejandroVillaMandujano,19/05/2024,Keremos seguridad  ya no se puede trabajar en paz,0
3,excelsior,VictordanielManzanoruiz,19/05/2024,"Esta muy claro esta señora xochilt nomas se la paso criticando al gobierno, no tiene propuestas, esta perdido el prian",0
3,excelsior,mario-hz3do,19/05/2024,El gobierno actual ya a echo un pais de.muchos logros  y esta mejor que antes se ve se nota.,0
3,excelsior,isaireyes3504,19/05/2024,Es lo pero que mire hoy,0
3,excelsior,miriamzamara5567,19/05/2024,Xochil se auto vendió y produjo su casa con dinero del pueblo para que tierra mierda teniendo la cara embarrada,0
3,excelsior,rolandreyes1662,19/05/2024,Xochitl ya deja de atacar a claudia los mexicanos necesitamos escuchar propuestas no burradas,0
3,excelsior,jorgemolina4130,19/05/2024,Xóchit es la actual jefa de los “ z”,0
3,excelsior,eduardomorenolara5124,19/05/2024,No tengo 1:37 horas para perder,0
3,excelsior,rigobertomagdalenonavarret5562,19/05/2024,"De que libertad habla la Sra. representante del PRIAN y PRD,  y, o de que miedo de salir a las calles habla que tiene el pueblo. Cuando el miedo que tiene el pueblo de México es de que llegaran a ganar el PRIAN y PRD no salir a la calle y la libertad es la que no teníamos ya que dejan que se realicen en las votaciones bien por sus fraudes que haian  en el tiempo que ganaba el PRI y el PAN.",0
3,excelsior,franciscajuarez9539,19/05/2024,Para mi mil veces es mucho mejor los apoyos del señor presidente 🇨🇮 apoyos de 6000 pesos bimestrales ️️🇨🇮,0
3,excelsior,lilamedinaandrade3134,19/05/2024,En evento se le arimaban las personas y el les gritaba no me enpujen y se enjaba es muy despota,0
3,excelsior,user-vx7ph8dd6x,19/05/2024,"Vamos con Claudia Cheinbaum, Chochilt ta bien mensilla. Y Mainez,es buen candidato.",0
3,excelsior,farahguillermo2802,19/05/2024,Sochil solo abla alo loco no analisa sus respuestas,0
3,excelsior,mirnarodriguez5762,19/05/2024,"Siempre ganará Claudia es más respetuosa y o está que los otros partido Exelente debate de la futura Precidenta es la mejor ,",0
3,excelsior,bettyparis3186,19/05/2024,Mainers !! MC ate informo que ya existe un Servicio Civil de Carrera !!,0
3,excelsior,anaavila16,19/05/2024,Segun Lopez obrador Mexico es autosuficiente ni nececitaria ninguna remesa porque este viejo siempre habla muy mal de Estados Unidos.,0
3,excelsior,user-st9sk6cv9f,19/05/2024,"""piores sequías""   Ay no, no sabe ortografía",0
3,excelsior,user-cf5dt8dw4l,19/05/2024,acaray 10.000 mensuales con 2 días de descanso ala semana eso dime intereso,0
3,excelsior,delfinareyesortiz,19/05/2024,Si Jorge gana Gana Caludia.Si Claudia gana. gana  Jorge Asi de fácil.pero de Xóchil no veo claro.Los del pri todo el tiempo fue robo.,0
3,excelsior,DanielRivera-ie6jw,19/05/2024,"Son demasiadas, evidencias,  y votantes, para que se las roben , marquen mis pabras, ella  ,ya gano y seguira ganando,",0
3,excelsior,jorgebello3296,19/05/2024,"Xóchitl y sus carteles de niña de primaría, no tiene propuestas y solo va a echar culpas.",0
3,excelsior,user-yx3ho6md9n,19/05/2024,Sra promesas ya vayase a su casa a disfrutar todo lo robado,0
3,excelsior,AureliaBaza,19/05/2024,No mas redadas para todos los mexicanos  55:40,0
3,excelsior,josenarvaeznarvaez7653,19/05/2024,Y tu hermana xochil donde esta.,0
3,excelsior,aquilesvillamindieta,19/05/2024,Que quede claro xochil no serás presidenta ustedes tuvieron sus oportunidades y no las aprovecharon  nunca más asia tras  bamos por la 4 trasformación .,0
3,excelsior,user-gn9in1eq8v,19/05/2024,Ayyy exactamente lo que no voy a ver!!!,0
3,excelsior,user-iz9nf8ir2k,19/05/2024,Creo que la politica es un motivo para mudarse a Marte...,0
3,excelsior,maximojuangarciachuquiyuri1896,19/05/2024,La Sra Galvez parece a la congresista Patricia Chirinos del Perú. Una lengua suelta que solo acusa y no propone. Muy vulgar.,0
3,excelsior,user-yu9yx3ch3v,19/05/2024,Que presidente ho presidenta va ha umentar  las  becas,0
3,excelsior,jaimealfonsoluisleoncuadra9964,19/05/2024,La mujer delcentro se parece a Milei,0
3,excelsior,angeles981,19/05/2024,Aquí no salieron a su favor prian,0
3,excelsior,evelinescalante5402,19/05/2024,"XOCHITL DA PENA AJENA, CERO ARGUMENTOS, ES UNA VERGÜENZA QUE ESTE COMO CÁNDIDATA.",0
3,excelsior,jesusenrrique5141,19/05/2024,Ya Viendo a los tres ninguno convence pero mejor voy a votar por mainez,0
3,excelsior,eduromerov.5912,19/05/2024,Lenguas Nativas haber si nos vamos quitando ese despotismo indígena (Lenguas autóctonas  o lenguas nativas americanas),0
3,excelsior,carlosjesusolvera9262,19/05/2024,Xochilt  no sabe nada   no esta estudiada   pobre señora   no    de verdad no sabe nada,0
3,excelsior,claratellez,19/05/2024,Amlo dijo qué bajaria la gasolina y aun no cumple,0
3,excelsior,MiguelSantiago-ib9wx,19/05/2024,"candidata del prian, si vasa sacar tus trapitos al sol, que sea parejo, se te estan olvidando los ex presidentes, creo que no te conviene hablar de ellos, eñ actual presidente apenas lleva 6 años, el no podrá reparar a México con tampoco tiempo, es una vergüenza para sochitl.",0
3,excelsior,rodrigoperez2968,19/05/2024,Porque Xochitl no dice nada absolutamente nada sobre los expresidentes corruptos,0
3,excelsior,franciscolopezmejia8497,19/05/2024,Que bien Claudia   nuestra próxima  precidente será Claudia porque si Abla con la verdad viva Claudia  y viva México y la 4T la esperanza de México,1
3,excelsior,aprilrios1671,19/05/2024,Pog que habglaga asi la sseñoga xochitl,0
3,excelsior,user-rw1wf1uj1s,19/05/2024,Y no me importan tus demandas porque quién te va a demandar soy yo,0
3,excelsior,samuelruiz8874,19/05/2024,Nose porke mainez parece peña nieto,0
3,excelsior,AureliaBaza,19/05/2024,Familias seguras  40:35,0
3,excelsior,dragonmaster8314,19/05/2024,Mi progresó de video: 49:35,0
3,excelsior,armame4846,19/05/2024,Desde el minuto 4:01 Claudia ya había ganado el debate.,0
3,excelsior,user-ij9be8ih1e,19/05/2024,Jajaja una hermana secuestradora k se puede esperar de ti,0
3,excelsior,DanielRivera-ie6jw,19/05/2024,"Y mas castigo, ouch",0
3,excelsior,VictorianoHernandezHerna-rp4tb,19/05/2024,Ya nosotros el pueblo lo savemos  no es nuevo shochil no teda para mas,0
3,excelsior,DanielRivera-ie6jw,19/05/2024,"Como, la verdad, sale, ouch",0
3,excelsior,lorenzomendez4353,19/05/2024,Le dieron un metidon a xochitl jajja,0
3,excelsior,loschuchas123,19/05/2024,"Que pena que la candidata del PRIAN quedara como presidente de mi país.  Nada de seriedad, un chiste de persona.",0
3,excelsior,user-qi6ko4op1d,19/05/2024,La Cheimbahum habla asta con amor  y estoy ajeno a,0
3,excelsior,josecheco9460,19/05/2024,Jorge tienes mejor diculso,0
3,excelsior,bonboncakess,19/05/2024,Pasé de Claudia a Xochitl y ahora mi voto para maynez,0
3,excelsior,GuillermoVelazquez-zm6mf,19/05/2024,Cembremos mas arboless,0
3,excelsior,tomasrobles6969,19/05/2024,Claudia si tiene muy bien el vates y de propuesta  la candidata del prian qué vergüenza puro ir en contra de México y calumniar,0
3,excelsior,rogeliosanchez-vu4oo,19/05/2024,El mejor es Jorge las otras dos se la pasan atancandose,0
3,excelsior,AureliaBaza,19/05/2024,Que tenga el dolar valor  1:05:07  1:37:39,0
3,excelsior,JesusFlores-tp2ql,19/05/2024,Vuelvo a repetir México siempre estará por arriba de muchos goviernos del mundo,0
3,excelsior,TheDannieloko,19/05/2024,"Ay chica Shein.... Querías los hospitales bienestar mente, no mamns",0
3,excelsior,user-mi5ln1uy1y,19/05/2024,Mexicanos que no los engañen morena es quien a iniciado las vecas para estudiantes y el salario mínimo las pensiones a adultos mayores,0
3,excelsior,vickyrodriguez2651,19/05/2024,""" calumnias!?"" Toda una verdad mendig@ marionet@ de Claudia",0
3,excelsior,user-ho2zy4fc1l,19/05/2024,Mi nieta estudia medicina en ticul,0
3,excelsior,MarilynrubiReyes,19/05/2024,Xóchilt es bien envidiosa.,0
3,excelsior,jesushernandezvillagomez2073,19/05/2024,Xochil alias chimoltrufia,0
3,excelsior,yulimymontal7706,19/05/2024,LA SOLUCION AL PROBLEMA DE MEXICO...OJO OJO..MEXICANOS...NO ES UNA PERSONA..ES EL SISTEMA DE GOBIERNO QUE TENEMOS..LLAMADO REPUBLICANO..COMO TODO LATINOAMERICA..ESTAMOS MUY.MAL...SOLUCION..SISTEMA DE,1
3,excelsior,user-zl9vj9ou5t,19/05/2024,Sochil  hablas de honestidad?,0
3,excelsior,salvadorarcadio2560,19/05/2024,Xóchil tiene. Todas la. Rason  si. Sochil.  Pierde. México. No tendrá. Sueldo.  Bien pagado. Eso es una. Temas. Muy. Preocupantes,0
3,excelsior,DanielRivera-ie6jw,19/05/2024,Tiempo mefido  wow,0
3,excelsior,miguelvega7256,19/05/2024,Ya ganaron  Gelatinas uno para C/U.,0
3,excelsior,marymorales8759,19/05/2024,Con morena se ha visto el cambio y queremos que siga cambiando arriba Claudia sheibaun,0
3,excelsior,HannahMizialko-jw4xf,19/05/2024,Todos esos muertitos eran unos anjelitos,0
3,excelsior,AureliaBaza,19/05/2024,Mejores derechos  51:38,0
3,excelsior,claraedithhernandezperez8098,19/05/2024,no hay seguridad en el pais,0
3,excelsior,jorgemartinez7848,19/05/2024,"Yo propongo que la difamacion si no se compriu3ba sea un delito Como el chisme del barrio una mujer no te da las nalgas y la difamas mentira ono se divorcia por un pendejo y ni la carcel pisa, pero la la aprueban  por que hoy estubieran presos",0
3,excelsior,pastorarielsalgado,19/05/2024,no creemos en el pri o pan,0
3,excelsior,user-qh1gw8gp3t,19/05/2024,AI CHOCHIL CHOCHIL MAYNES TE PAPIO Y VA A VOTAR POR SHEINBAUn,1
3,excelsior,alfredoramirez9540,19/05/2024,Yosiento que hasochil galves le falta educación porque sumanera dees presión es muy prepotente parami no debería de ser presidenta,0
3,excelsior,pilonmontes7754,19/05/2024,Xochilt no sabe de politica es problematica,0
3,excelsior,BenjaminGarcia-io3fk,19/05/2024,No sean chismosos primero terminen con la delincuencia,0
3,excelsior,luiggiferro-pi9zy,19/05/2024,Tenemos presidente ya no queremos adefesios,0
3,excelsior,isrealgarcia2201,19/05/2024,Xochil ataca tan pobremente no se enfoca en que ofrece solo senalamientos espero que no quede por que llegaria nuevamente salinas de gortari con el pri a terminar de robar mexico,0
3,excelsior,IsabelMunoz-xb2xi,19/05/2024,La Sra Xóchitl trae mucho coraje no se ubica y es de lo peor,0
3,excelsior,AureliaBaza,19/05/2024,Que tenga el dolar valor  1:05:07,0
3,excelsior,m.teresaarceluvianos289,19/05/2024,Dios nos cuide siempre,0
3,excelsior,unnuevoamanecerconyeshua952,19/05/2024,Para mi ninguno de los tres tiene la capacidad para sacar adelante al pais ni a quien irle chiapas esta como nunca invadido por narcos,0
3,excelsior,anaruiz8118,19/05/2024,"Adelante con  Xochitl, todo mi apoyo para usted mi señora. Fuera morena.",0
3,excelsior,guadalupefarfan3375,19/05/2024,Luis Donaldo Colosio es un inseguro de si mismo por eso se vende fácil no le importa traicionar al partido que representa ya lo demostro,0
3,excelsior,halconlibrecandoocana6919,19/05/2024,Xochil va a dar empleo vendiendo gelatinas,0
3,excelsior,vickyrodriguez2651,19/05/2024,Jorge Maynez: un vil comodín.,0
3,excelsior,rodrigoperez2968,19/05/2024,Votar por Xochitl es como un ciego con el bastón,0
3,excelsior,monicarociojimenezgallegos2033,19/05/2024,"Xóchitl es una farsa, como buena candidata del PRIAN, sólo ataca, como si tuviera rabia .",0
3,excelsior,mariadelaluzortegagarnica8039,19/05/2024,Xochitl.abla.de.asesinatos.y.cuantos.asesinatos.se.cometieron.durante.los.gobiernos.priiisttas.y.puedo.decir.mas,1
3,excelsior,JoseLomeli-wu6zs,19/05/2024,"Y SEGUIMOS EN LO MISMO !!!!!!!! LOS POVRES , POR QUE LOS QUE TRAVAJAN EN EL GOBIERNO U!FFFFFFFFFFFFFF  LES VA MUY MUY MUY BIEN E !!!!!!!!!!!!!!!!!!!!!!!!",0
3,excelsior,AureliaBaza,19/05/2024,No mas deportaciones  49:44,0
3,excelsior,miguelolmos5278,19/05/2024,el ganador en el debate Ojalá gané en las elecciones,0
3,excelsior,lavidadelilegal7326,19/05/2024,Pero antes con el gobierno del PRI y el pan avia mas pobres,0
3,excelsior,MarcosDelanjel,19/05/2024,Quien me aga Rico que queda pero en dinero....,0
3,excelsior,anastaciobautista5299,19/05/2024,xoclhill cuidado se cuestra y estorciona,0
3,excelsior,keniacastro1156,19/05/2024,Cigen en la misma mentira no asen nada solo promesas,0
3,excelsior,AureliaBaza,19/05/2024,Líderes mejores  42:24,0
3,excelsior,JoseMorales-tw3ki,19/05/2024,ya se miro kien es kien. Arriba claudia,0
3,excelsior,AureliaBaza,19/05/2024,No mas punida 46:44,0
3,excelsior,isabelreynoso4405,19/05/2024,Xochitl nos va ha rescatar de este pésimo gobierno,0
3,excelsior,franciscajuarez9539,19/05/2024,Asta mas ay veces les da 🇨🇮️️,0
3,excelsior,sergiocastromeza5910,19/05/2024,Qué decepción ni a cual irle...,0
3,excelsior,arturocastillo7584,19/05/2024,Hechos no palabras .,0
3,excelsior,DayanaOrtega441,19/05/2024,Creo que maynez es el mejor y más preparado,0
3,excelsior,user-ho2zy4fc1l,19/05/2024,Es una mentira xocil maine Morena esta trabajando bien mi esta estudiando mi nieta 3 años de medicina en ticul,1
3,excelsior,MarcelinoSegundosanchez-eh7cs,19/05/2024,la maldicion de su corrupción ya lo alcanzó  al prian,0
3,excelsior,estefnavazquez,19/05/2024,Carta de escritor para Xóchil,0
3,excelsior,jesusvaldez1756,19/05/2024,Claudia selos está comiendo está bien preparada se preparo bien inteligente Claudia ojalá sea la presidenta,0
3,excelsior,stephanietorres5261,19/05/2024,Maynez me ha ganado con la jornada,0
3,excelsior,rozrguez2167,19/05/2024,VAMOS POR MAYNEZ,1
3,excelsior,user-yx3ho6md9n,19/05/2024,Esactamente sr maynez tu eres el que va hacer el proximo precidente,0
3,excelsior,monicarociojimenezgallegos2033,19/05/2024,Claro que hay apagones por la ineptitud y corrupción del PRIAN,0
3,excelsior,jesusmanualmanriquez3952,19/05/2024,"Viva Claudia, viva Claudia viva México",1
3,excelsior,aldeacasaca,19/05/2024,Si es muy cierto he higual   van acer todos,0
3,excelsior,Francisco-bd5qv,19/05/2024,Que siga nuestro ejercito la guardia nacional en  las calles,0
3,excelsior,AureliaBaza,19/05/2024,Gas a buen precio  41:23,0
3,excelsior,mariahernandez9944,19/05/2024,Está perdida ya la zochil y de ses perAda porque no va aganar  esa es pura mentira,0
3,excelsior,irmatorreslopez6791,19/05/2024,Con Xochitl no.vá a hacer nada yo estoy con Claudia si se puede,0
3,excelsior,DanielRivera-ie6jw,19/05/2024,ouch,0
3,excelsior,user-ct1ez4tl7y,19/05/2024,"Xochitl no le ganaria a nadie, es muy engreida y solo se dedica a ofender y nunca muestra ningun plan",0
3,excelsior,ubermaurilio9968,19/05/2024,Tambien aumento la biolensia,0
3,excelsior,marymorales8759,19/05/2024,Vamos con morena Claudia esta mejor preparada sebe que sabe lo que dice y hace arriba Claudia,0
3,excelsior,user-du9rk3bj5j,19/05/2024,Todo lo k dijo semba puras Mentiras también el PRIAN  mejor con Maynes,0
3,excelsior,olgalunanava3262,19/05/2024,pura  mentiras  xochilt galves no  puedes  decir unas palabras  tuyas que salgan   tuyas  propias  ßiempres estas  copiando a  la  Dra.claudia  SHEINBAUM   hay que tener un  propio  CRITERIO S,0
3,excelsior,user-ho2zy4fc1l,19/05/2024,De Medicina primero Dios y Morena muy pronto médico morena morena votarémos por morena,0
3,excelsior,criadoresnuevageneracion4485,19/05/2024,Yo boy 100% claudia se dieron cuenta que los otros dos solo isieron atacar a claudia no tienen nada más que odio a la 4t por que se les va el dinero y los sobornos delas manos no saben de política,0
3,excelsior,gustavoochoa9001,19/05/2024,vamos Por el Bien de México Votemos   Por El Plan C porque la 4t es lo mejor para los Mexicanos,0
3,excelsior,SeveroFernando-xf4cn,19/05/2024,Sochi estas diciendo mentiras yo soy indígena,0
3,excelsior,fernandoalverdin-gu6uu,19/05/2024,"Yo digo que hay que aventar al yulay de presidente  ,ese carnal a echo más por la gente  que estos pen*",0
3,excelsior,jorgemartinez7848,19/05/2024,"Morena numero uno Movimiento 2  Prian 20 Nunca mas el prian, critican no proponen ahor aestan muy de acauerdo con penciones, que no decian ue ivamos hacer venesuela",0
3,excelsior,salvadorarcadio2560,19/05/2024,Xóchil. Si va. Pagar. Buen sueldo.  Y.  Claudia no lo BA aser ya. Quedó con los. Empresario. Pagar sueldo miserables. Viven.  Encañando. Al. Pueblo mexicano,0
3,excelsior,juanquintero647,19/05/2024,"Arrival Morena. Ya Amlo  tiene Todo cominando , lo que nesesitamos  es continuar la transformasion",0
3,excelsior,pedrovilla5656,19/05/2024,Que ipocrita zochitl como si el pueblo no supiera que ellos se opusieronn votaron en contra de esas ayudas,0
3,excelsior,junas8288,19/05/2024,Xochli puro atacar a morena es lo único que hablas.,0
3,excelsior,elisarodriguez6219,19/05/2024,A Claudia le creo todo,1
3,excelsior,user-kr4es8qu6b,19/05/2024,Chuky le queda corto a la chukyl la muñeca diavolica,0
3,excelsior,alquigel2742,19/05/2024,Que descaro galves porque votas en contra eres una mentirosa,1
3,excelsior,user-yx3ho6md9n,19/05/2024,Muy bien hablado sr mainez va para precidente,0
3,excelsior,DanielMartinez-th1pt,19/05/2024,Escucho hablar a maynez  y se me hace el mejor candidato ala presidencia   Estoy entre Claudia y maynez    De plano se me hace muy pndeja  la candidata Xochitl,0
3,excelsior,hilarinomallquiheredia1052,19/05/2024,Deben dar gracias al señor presidente Lopez Obrador por hacer realidad el desarrollo de México.,0
3,excelsior,tonyzv9244,19/05/2024,"Prefiero al PRI y al PAN , antes que MORENA",0
3,excelsior,betzaydabautista2055,19/05/2024,"Vamos con Mainez,",0
3,excelsior,chopilizmttz3645,19/05/2024,Este Renato no es interpreter.. es el sordo ..    esta mentiroso ...,0
3,excelsior,JESSBOY72,19/05/2024,"Vamos con Claudia, vamos por Morena",0
3,excelsior,vicentemartinez-bj2yh,19/05/2024,Noseas mexico en llamas por calderon,0
3,excelsior,rosesegoviano3473,19/05/2024,Ya me cayo mal xochil,0
3,excelsior,Alan123RoblesMendez-vd4gk,19/05/2024,claudia presidenta  < y esos mienten <,0
3,excelsior,franciscolopezmejia8497,19/05/2024,L as SRA X Abla puras promesas,1
3,excelsior,SandraAvila-gc3sm,19/05/2024,Esa jelatinera no se cansa de atacar arriba Claudia,0
3,excelsior,soledadmiranda8107,19/05/2024,Q mentirosa es esa claudia ni ella se la cre,0
3,excelsior,user-ke9zr8zs2f,19/05/2024,Votare por quien le vaya el al pumas  Y no dire mas,0
3,excelsior,DanielRivera-ie6jw,19/05/2024,Zzzzzzzzzzzzzzzzzzzzzzzzzz,0
3,excelsior,elisarodriguez6219,19/05/2024,Yo de 1000 amores que se quede morena tengo más fe que en todos los demás,0
3,excelsior,magalimellado933,19/05/2024,LaDoctora Claudia tiene la Educacion y amanal Puebloella se lleva el voto,0
3,excelsior,alicesblanco1,19/05/2024,"Mas de lo mismo, puro teatro.",0
3,excelsior,esperanzalunanegrete9975,19/05/2024,Claudia no te vayas a torcer. .,0
3,excelsior,RebecaHuerta-sk5vo,19/05/2024,"Ya la Xochitl no se sabe otra, la señora de las mentiras, ya que la respete, porque será la Presidenta de México, la doctora Claudia, arriba Morena",0
3,excelsior,giselalanda2498,19/05/2024,No pongan serca a esos dos de la cuarta  trasmormacion,0
3,excelsior,user-os4nm1zk2t,19/05/2024,No cabe duda claudia para presidenta de mexico,0
3,excelsior,vidalgonzalez1410,19/05/2024,Te apoyo claudia,1
3,excelsior,mirnarodriguez5762,19/05/2024,Botare’ por Claudia Sheinbaum ella es honesta y leal viva Morena ella ganara’,0
3,excelsior,Nonamesur1123,19/05/2024,"Fuera el pri de morena, fuera Murat",0
3,excelsior,zulmaguzman5269,19/05/2024,Todos con Claudia para presidenta de México 🇲🇽,0
3,excelsior,rogeliorojas7486,19/05/2024,LA XOCHIL SE COMPROMETE A TERMINAR LA PREPA,0
3,excelsior,VictorianoHernandezHerna-rp4tb,19/05/2024,Chaudia shemban estamos con ella el pueblo lo save,0
3,excelsior,anaavila16,19/05/2024,En mi humilde opinion ls mananera no resuelve nada ahi solo esta el presidente escondiendose en Palacio Nacional para no ver la realidad de las nececidades de Mexico.,0
3,excelsior,aureliamorales78,19/05/2024,Ninguno tendrá mi voto,0
3,excelsior,RicardoRamirez-mr6lx,19/05/2024,Siiiii cochis si por eso no bas a ser precidenta,0
3,excelsior,DanielRivera-ie6jw,19/05/2024,Ouch y mas auch,0
3,excelsior,MaritereCampos,19/05/2024,Que segura nuestra nueva presidenta Claudia  el triunfo es tuyo,0
3,excelsior,johndariogutierrez9995,19/05/2024,EL PRIAN SE ACABA DE HUNDIR CON ESA CANDIDATA PERO PARA SIEMPRE.,0
3,excelsior,MaritereCampos,19/05/2024,La botarga  se la pasa atacando a Claudia no le queda de otra  es su miedo de perdedora  ya veremos el triunfo de nuestra presidenta Claudia orgullosamente .,0
3,excelsior,AureliaBaza,19/05/2024,Niños felices  44:20,0
3,excelsior,DulceRamirez-uh8bt,19/05/2024,Es CLAUDIA La Sra.X ya da flojera Nunca votaría por ella.,0
3,excelsior,yolandasaldivar1753,19/05/2024,"Claudia,  Claudia,  Claudia abre los ojos !!!!!!!!!!!!!",0
3,excelsior,user-ms5mx4bd9c,19/05/2024,Sueña la votarga votomasivo para la 4T jajaja,0
3,excelsior,JoseRodriguez-ej2ho,19/05/2024,Ni una propuesta buenadeXo hilt,0
3,excelsior,AureliaBaza,19/05/2024,Salario  seguro  29:10,0
3,excelsior,catalinaramos7010,19/05/2024,Ya Xochitl supéralo.,0
3,excelsior,AureliaBaza,19/05/2024,Fuera fosas comunes  39:25,0
3,excelsior,DanielRivera-ie6jw,19/05/2024,"Ella, la educo,  wow,",0
3,excelsior,vicentemartinez-bj2yh,19/05/2024,Hitu xochitl vienes de un partidos fayido,0
3,excelsior,alfonsopablorodriguez2337,19/05/2024,Los Mexicanos estamos contigo Claudia   Viva Claudia Sheimbaum yeeeeyyyyy   Dios te da La Victoria.,0
3,excelsior,user-ge7kn7cs7g,19/05/2024,"Maines di e que el prian va en segundo lugar y tiene razón,pero ganará Claudia",0
3,excelsior,mirnarodriguez5762,19/05/2024,Ella será la Precidenta de Morena,0
3,excelsior,javismontes4134,19/05/2024,"CLAUDIA SHEIBAUM ES PRESIDENTA EN LOS ESTADOS UNIDOS MEXICANOS, ASI LO EXIGE LA CIUDADANIA DE MEXICO, HASTA LA VICTORIA PRESIDENTA CLAUDIA",0
3,excelsior,MaritereCampos,19/05/2024,Tienes mi voto Claudia el de toda mi familia adelante el triunfo es tuyo,0
3,excelsior,gavioloren,19/05/2024,LA MEJOR ES CLAUDIA... VOTA POR CLAUDIA SHEINBAUM Y MORENA EL 2 DE JUNIO 2024,0
3,excelsior,isabelreynoso4405,19/05/2024,Lo peor que nos ha pasado morena,0
3,excelsior,DanielRivera-ie6jw,19/05/2024,Que caaaaaaaaasssssstiiiiiigoooooo,0
3,excelsior,josecarvajal4346,19/05/2024,Xochitl ya no sabe ni ke decirrr ke sera cuando sea presidentaa  estaa bien peladaaaaaaaa,0
