num_debate,canal,username,fecha,comentario,num_likes
3,excelsior,user-vo6mu2nn5t,19/05/2024,"En mi humilde opinión!!! Yo sigo pensando que esos apoyos que se brindan a los adultos mayores están perfectos, ya que muchos de nosotros, dejamos a un lado a nuestros adultos y seamos honestos, a la edad de 60 quienes los quieren contratar? NADIE!!! Ahora si bien, yo tengo 30 años, y tengo la capacidad y la fuerza de seguir trabajando, algo que nuestros mayores ya no tienen,  acuérdense, cuando estábamos chicos nuestros mayores vieron por nosotros, ahora nos toca a nosotros ver por ellos 1 K",0
3,excelsior,elbetasinsertestter,19/05/2024,"resumen rapido del debate: xochil solo ataca a clauda sin dar propuestas ni contestar alas preguntas, y claudia se defiende y entre ratos da propuestas, y maynez solo sonrie y da propuestas manteniendo su postura seria y hablando lo necesario",57
3,excelsior,lupitasuarez.5353,19/05/2024,"Cómo no va a encabezar la búsqueda, si su hermana secuestradora sabe dónde dejo a todos los que secuestro, que fácil chamba se pone",28
3,excelsior,SamGarcia-jc1tw,19/05/2024,"Ninguno de los candidatos tiene una visión real de por que la violencia y la oscuridad dominan no solo México si no en todo el mundo, europa no es tan blanca como muchos imaginan, en europa secuestran niños bebes y los usan para rituales de sacrificio a dioses paganos, eso sucede en todo el mundo pero en europa y estados unidos es peor de lo que imaginan, y la realidad es que a dia de hoy hay mucha gente enferma a la que le gusta disfrutar del sufrimiento de los demas, cuando va a saber un policía que un señor celoso va a matar a su pareja por que segun anda con otro, o cuando va a saber la guardia nacional que un señor y su esposa se van a poner de acuerdo para secuestrar a una niña y que sea violada para despues asesinarla y botar sus restos a un terreno valdio, por favor hay que abrir los ojos y entender que esto va mas alla de un simple gobierno, hay una fuerza malvada que adoctrina a la humanidad entera y la hace asi a traves de control mental, musica, peliculas, libros y todo tipo de contenido que incite a la violencia hoy esta totalmente normalizado, el cambio tiene que estar en la mente de cada uno y de sus valores humanos, por que no enseñan en la escuela a respetar, a amar al projimo, a respirar bien, a valorar cada pequeño pedazo de vida que nos rodea, por que no nos enseñan que asi como existe la oscuridad existe la luz y que esa es la verdadera lucha  “Por que la lucha no es contra sangre ni carné, si no contra principados, contra potestades, contra los gobernadores de las tienieblas de este siglo y contra huestes de maldad en las regiones celestes""",10
3,excelsior,user-ed7ze1ko8k,19/05/2024,Bla bla bla.   A estas alturas.  Ya sabemos quién miente.  No somos pendejos.,545
3,excelsior,justagirlname5885,19/05/2024,"Señor maynez admiro su valentía,en decir públicamente con nombres y apellidos de estos corruptos,quiénes fueron los responsables de poner a México en la peor crisis,donde el ciudadano humilde pagó las consecuencias de sus actos..",305
3,excelsior,josemejia-zb3oz,19/05/2024,"No soy Mexicano, pero no entiendo ese debate Presidencial debido a que se salen de la tangente, Jorge sabe responder, la Sra Xochilt no tiene Etica profesional y la Sra Claudia es mas  contunjente.",53
3,excelsior,donacianojuarez7717,19/05/2024,COTCHIL GALVEZ ME GUSTARIA QUE HABLARA DE SU HERMANA QUE ESTA VACASIONANDO EN LA CARSEL ESPERO QUE HABLE PORQUE ESTA AHI  POS NO CREO SEA POR PREDICAR LA BIBLIA,44
3,excelsior,Cris27cvc,19/05/2024,Se han dado cuenta que solo maynez y claudia dan propuestas saben de códigos penales saben de artículos de la constitución planteamientos del senado etc y Xóchitl solo va a juzgar y leer lo que le escriben; y sus propuestas son soñadas. Me molesta que ni para el debate se prepare,56
3,excelsior,SolLopez.,19/05/2024,Con xochitl no hay propuestas puro atacar a claudia no sabe otra  cosa,283
3,excelsior,franciscojavier5322,19/05/2024,"Las ideas de Maines son buenas que lastima que no tenga la fuerza necesaria, piencen bien su voto, por el PRIAN ningun Voto",32
3,excelsior,osvaldogalindovalenzuela9374,19/05/2024,Y si votamos por Maynez y hacemos una remontada histórica?,23
3,excelsior,nancyroucas7207,19/05/2024,Y Xochitl porque no dices todos los desaparecidos de sexenios del pria todos tienen la cola surrada de que te admiras,303
3,excelsior,annagarcilazo2621,19/05/2024,"Xóchitl Gálvez no tiene ninguna propuesta, solo se la paso atacando a claudia",482
3,excelsior,lourdesgarcia3442,19/05/2024,"Señora Xóchitl, da pena ajena, por favor usted no representa mi México lindo",15
3,excelsior,user-lq5sn8nd1o,19/05/2024,Maynez es el único con propuestas y firmeza no se presta para atacar demuestra su inteligencia y madures.,41
3,excelsior,FabianLopez-pp4le,19/05/2024,Claudia con muy alto conocimiento en los temas maynes ha madurado demasiado en tan poco tiempo pero Xóchitl de plano no aprende nada aprendió si pero a atacar solamente sin proyecto,144
3,excelsior,zabdizone1900,19/05/2024,"Que onda con la imagen de Xochitl, ¿quien se la cuida? No hay congruencia en nada, ni en su speech ni en su imagen ni en nada, ese comentario donde mezcla la política con la religión cuando no iba ni al caso en la temática. Esa señora está perdida.",37
3,excelsior,aesthetickiutpink6060,19/05/2024,"Maynez es el único que puede hacer un cambio real, los otros partidos son la misma historia, piensen bien su voto. Quieren en verdad progresar como pais o quedar igual o peor?. Maynez es la verdadera “transformación”.",11
3,excelsior,julianvazquez8580,19/05/2024,"El debate deberia de ser para presentar los peoyectos que van a realizar, en lugar de perder el tiempo atacandose. El pueblo mexicano necesita ver los proyectos para votar por el mejor.",19
3,excelsior,rossmejia5761,19/05/2024,Creo que Maynes y Claudia deberían trabajar juntos … definitivamente Xóchitl…fueraaaaaaa!!!!,99
3,excelsior,leonardoflores7519,19/05/2024,"El PRIAN nos mando una candidata que creen que nos representa por la ""ignorancia"" pensaron que empatizamos con ella, pero la realidad es otra",185
3,excelsior,user-st9sk6cv9f,19/05/2024,"""Quien dice mentiras, de verdad se habla al espejo"" jajaja",11
3,excelsior,user-yi6uz7le5f,19/05/2024,La señora de azul lo que destila es puro odio e irrespeto .,8
3,excelsior,user-oz4pm3hc2t,19/05/2024,"No se supone que un presidente debe ser el maxino exponente de inteligencia para dirigir un país?  Jamas votaria por el prian, Xochitl da pena ajena",150
3,excelsior,hectorgallegos2094,19/05/2024,"Es descomunal el descaro de Xochitl, increíble lo que le dice a Claudia sobre que se robo una propiedad cuando esta ampliamente documentado periodisticamente el tema de la casa roja  miente con cinism, que miedo.",157
3,excelsior,ojisalazar5050,19/05/2024,Podemos apostar por EL BUEN GEORGE MAINEZ... DEMOSLE EL BENEFICIO DE LA DUDA.,25
3,excelsior,josebrambila3209,19/05/2024,"Señora xochitl, y cuando llegue a su casa,ba a poner esa cortina que trae puesta en su bentana?",5
3,excelsior,mariadelosangelesgomezsosa3144,19/05/2024,Creo qué la Xóchil no sale a la visitar las colonias (centro dé salud y otros  hospitales salen a aplicar vacunas) (sé le traba la lengua a XOCHITL) no habla sobre proyectos en beneficio del país (sé la pasa criticando a Claudia),71
3,excelsior,ma.judithbadillomota4562,19/05/2024,"Chochil ,puro agredir a Claudia ,y sus letreros obsoletos , no tiene propuestas firmes ,es más coherente Maynez que chochil , saldremos a votar por Claudia",219
3,excelsior,kmez1686,19/05/2024,"OMG soy una Nicaragüense viendo esto desde Seattle Washington y en mi humilde opinión Maynes y Claudia deberían unir fuerzas , la otra señora no me late .",2
3,excelsior,ethelbalammaldonado495,19/05/2024,Cómo van a poner dos días de descanso no todas las empresas generan lo mismo deberían hacer un estudio o como están divididas las empresas en SA de cv personas físicas pero determinar por su ingresos y los egresos que empresas si cuentan con la capacidad para sostener dos días de descanso. Porque si no los emprendedores que necesitan o que dan un para de empleos donde quedan terminanirian trabajando más el emprendedor para lograr sacar a su trabajador entonces donde la igualdad. Bueno solo es una sugerencia. Porque queda claro que existen empresas en México que sí tendrían la capacidad para dar dos días de descanso pero cuáles serían las condiciones.,6
3,excelsior,jaja123411,19/05/2024,"El día de ayer me obligaron a ir al zócalo a ""apoyar"" a xochil, soy comerciante y si no iba nos castigan sin dejarnos vender.",70
3,excelsior,LemuelSosa-es8iz,19/05/2024,"Máynez diciendo que millones de jóvenes van a escuelas privadas porque nunca hay espacio en universidades públicas, Claudia diciendo ""Voy a hacer 1 millón de casas"" cuando es verdad lo que dice Máynez, más de 14 millones de casas abandonadas... Todo eso yo lo e vivido, y al chile Máynez es quien más apegado a la realidad de México esta.",53
3,excelsior,user-ub3om7qt4g,19/05/2024,"Seamos serios , imagínate a Xóchitl en una ponencia en la ONU, mostrando cartelitos ?",7
3,excelsior,moisesbarcenas8530,19/05/2024,"El salario mínimo está bien que suba pero y no suban los impuestos, si me subes el salario pero me lo quitas con impuestos así no sirve de nada. Los tres tienen buenas propuestas e ideas pero neta para que tanto estudio si párese que las decisiones se toman a la ligera",5
3,excelsior,mabelsanchez6216,19/05/2024,Pueden hacer mil debates y sacar las concluciones que quieran pero no hay forma de que le ganen a claudia buena o mala es la realidad  mejor empiesense a preparar para atacarla como a lopez Obrador no les queda de otra no soy morenista soy realista,91
3,excelsior,lovemolang8627,19/05/2024,"De que sirve tener tantos médicos, si luego las medicinas no las venden?",1
3,excelsior,alejandrorojas758,19/05/2024,Ola saludos como pueblo le pedimos al ho a la que gana el debate que nos den el seguro popular por que avemos personas que no tenemos el alcance para una operación medicamento que se escucha mi petición bendiciones,3
3,excelsior,patriciaflorescastillejos9949,19/05/2024,"Porque dejaron a Xochitl sacar sus letreros, desde ahí se ve que es necia y terca.",253
3,excelsior,rinconesdemexicovlogs3979,19/05/2024,"Maynez estoy de acuerdo con usted, no conocía nada de usted, pero siga trabajando me encantan sus propuestas, eso que dijo que hay que apoyar a los infantes, yo votaré por usted.",57
3,excelsior,milbiaramires3807,19/05/2024,"La Señora del centro apenas tiene proyectos ,sólo sabe atacar y sacar carteles,no soy de México pero les deseo lo mejor para la nación y que las personas no tengan que salir de su Pais por malos gobernantes.",2
3,excelsior,user-yx3ho6md9n,19/05/2024,Shochil no te salgas del tema no ataques no tienes fundamentos estas mal eres la sra promesas,5
3,excelsior,maribelrl5169,19/05/2024,"A la candidata del PRI le hubiera de dar vergüenza ya que su hermana esta en la carcel por secuestradora, no México mo te dejes engañar.",79
3,excelsior,user-cs9rm8fl3o,19/05/2024,"Que argumentos tan pobres tiene la candidata del PRIAN, no le da vergüenza presentar los mismos motivos por los que la mayoría dejo de confiar en ellos después de 60 años de poder",87
3,excelsior,BalMartinez-fh4ii,19/05/2024,"Encerio? Que emoción si gana Xochitl seré rica entonces ya que disque según ella, va ver muchas programas sociales .",4
3,excelsior,AngelMartinez-nt9yu,19/05/2024,4:32 xddd,0
3,excelsior,esthergonzalez9239,19/05/2024,Soy el único niño de 11 años que se está viendo el debate por interes,41
3,excelsior,user-ii4kz6cg1v,19/05/2024,Se los quitaron porque los prianistas se quedaban con una buena parte del dinero de esas estancias.,148
3,excelsior,fernandoalverdin-gu6uu,19/05/2024,"Con todo respeto , la verdad si me preocupa quien quedé alfrente del país , solo se atacan entre ellos , en lugar de dar un buen ejemplo  para todas las personas  que los observan solo fomentan el odio y el rencor , están viendo como está el país y no se incan , ahibse ve la falta de consciencia y madures  liderazgo  no hay principios  ni valores .",4
3,excelsior,mariadejesus-pb1mp,19/05/2024,No cuentan la realidad que vive la  población  de inseguridad.,4
3,excelsior,luispaullopezrodriguez1900,19/05/2024,"1:28:25 Porque si México tiene menos estados que  USA, tiene mayor cantidad de diputados y senadores, porque seguir pagando impuestos para que se los quede toda esa gente que solo va a dormir, no puede ser posible, alguien algún día realmente se va a animar a bajar toda esta cantidad de gente que gana dinero solo por ir a dormir??",50
3,excelsior,LauraDiaz-dn9lh,19/05/2024,OMG . Xóchitl Gálvez está bien resentida con la vida! Tiene una profunda envidia hacia Claudia,179
3,excelsior,miguelolmos5278,19/05/2024,Las dos candidatas Son la misma Solo que una más revolcada que la otra,1
3,excelsior,HildaFabela-dz1yh,19/05/2024,"No creo tenga Xóchilt capacidad para controlar la delincuencia como dice,con su hermana no  la tuvo, todavía tengo la duda sino fué cómplice de la misma",2
3,excelsior,TeresaFacundoHernandez,19/05/2024,Le deve dar vergüenza a Xochitl de hablar de seguridad cuándo ella y su hermana son secuestradora x el hijo de la señora k secuestraron dice k eran gran amigas si así le hicieron a su amiga k no te haran a ti si votas x ella.,38
3,excelsior,yolandaperez-vb5es,19/05/2024,Quieran o no el gobierno actual es el único que ha logrado qué México mejore y mejorado la vida de los mexicanos aunque no lo quieran reconocer.,106
3,excelsior,DanielRivera-ie6jw,19/05/2024,?oookay?,0
3,excelsior,juanapatriciaguiterrezcerv5435,19/05/2024,Yo tengo mi madre es viuda espero q quien gane ayude a esas mujeres luchonas yvsolas y q deberás ayuden mi madre tiene 61 años y todavía le falta para q le ayuden con su pensión ojalá vean este escrito los candidatos y ayuden a esas madres q necesitan de ustedes,4
3,excelsior,alexcrown5391,19/05/2024,"Si no gana Xochitl, pasara de haber vendido gelatinas a "" vender las gelatinas"" XD",27
3,excelsior,sebastianbnks2817,19/05/2024,Votaré por Claudia pero Maynez suena muchoooo mejor que Xochitl mas congruente y contundente,241
3,excelsior,leojuarez3477,19/05/2024,Quien estaría en mi lado es un político que es onesto  y que alguna a los pobres y que ponga mucho empeño a su trabajo  que primero los ciudadanos por recibe  un salario de los mexicanos  y por los bonos que los mexicanos  regalamos a ustedes los político y que no por el dinero que ustedes políticos  maneja para los mexicanos  .,1
3,excelsior,manuel3100,19/05/2024,Si en un debate presidencial la señora Xochitl no respeta y hace ese tipo de artimañas de andar sacando carteles cómicos ya me imagino si llegara al poder menos va a respetaría se ve y muestra su personalidad es algo evidente y a mí como ciudadano me avergonzaria tener a esa persona representando al país y al pueblo de México,1
3,excelsior,patriciaflorescastillejos9949,19/05/2024,"Me hubiera gustado otro formato de debate. Una mesa redonda , participación ciudadana con gente preparada. Etc",79
3,excelsior,rosamariavaldesnava1834,19/05/2024,Ya despertaron los acareados porque así lo manifestaron las personas que  entrevistaron.  A muchos los llevaron a  la fuerzas,116
3,excelsior,user-vj1vw7vx8s,19/05/2024,En Venezuela el Salario mínimo es 130 Bolívares mensual que son 0.36 Céntimo diario...,1
3,excelsior,viririanaramirez320,19/05/2024,720p?!!!! Creo que el programa da mucho más para que se quede en esto!! Que pena da el canal!!!,3
3,excelsior,hildalopez4604,19/05/2024,"Mo voto y el de mi familia es por Claudia, que siga la 4T, ya vimos todo lo bueno que hicieron en el sexenio que está por terminar y por el mismo camino seguirá Claudia! La Xóchitl ya sabemos que todo lo que está prometiendo no lo va a cumplir",52
3,excelsior,marcoantoniopereztorres2063,19/05/2024,"La inseguridad en México siempre va hacer pesima, a si que no prometan lo que no pueden cumplir, a mi criterio claudia es la mejor candidata  xochitl es pésima y maynez esta muy verde para representarnis. I",50
3,excelsior,aidaleonorzapatazuniga8766,19/05/2024,"Definitivamente que pena que entre más escucho, más se orienta mi voto, me recomendaron escuchar los debates y la candidata pripan, solo se enfoca a atacar, mis respetos para los otros dos candidatos, se ve que se prepararon !",0
3,excelsior,user-gj1qb4xw8i,19/05/2024,"Que corriente es el ataque de Xochitl, cuando a ella se le han comprobado tantos actos de corrupción, México no comprende como podemos tener a esta mujer de "" candidata"" es una vergüenza su falta de talla cultural, politica y moral, es inconcebible",1
3,excelsior,fran4542,19/05/2024,"No escucho propuestas a nivel nacional, para mejorar las condiciones del campo, exportaciones, importaciones.... algo. Parece que sólo van a gobernar CDMX",93
3,excelsior,maribelrl5169,19/05/2024,Pregunta a Xochitl como fue la infancia de su hermana que se volvió secuestradora,91
3,excelsior,ruthgarcia3760,19/05/2024,"""... Cuándo vamos a conocer en redes sociales ,el plan y agenda de nación de cada uno de estos candidatos de sus partidos politicos, no de nosotros los ciudadanos mexicanos...mya conociendo su agenda , tal vez, podriamos pensar votar por la mejor y más sutentica agenda, que es lo que nos interesa...???"" Madres , amas de casa, jefas de familias, teabajadoras, técnicas y profesionales que queremos un futuro sin corrupcion ni drogas, ni crimen, emigrantes, familias de todas las ffaa.",1
3,excelsior,victoriarodriguez1610,19/05/2024,"¿Como? ¿Como?¿COMO? No hay respuesta , solo propuestas.",1
3,excelsior,franciscotorres9249,19/05/2024,"Este debate se lo lleva Maynez por encima de todo lo mencionado, es el único que da y responde a cada pregunta.",94
3,excelsior,josemanuellira1954,19/05/2024,"En la campaña presidencial de Luis echeverria en 1968 muy chico yo oía decir a la gente que el pan no le hiba a hacer nada otra vez al pri y le pregunté a mi papá que era el pan, yo creía que era el pan de harina que me comía y me contesto que el pan era el partido político de los ricos y el día que ese partido llegue a gobernar a México se hiba a llevar madre al país, que sabio fue mi padre hace 56 años,  hoy  qué paso con los 2 sexenios que goberno el pan ????",20
3,excelsior,leojuarez3477,19/05/2024,Si ustedes los político siguen robando y los policías también de corruptos  adonde vamos a llegar  .,2
3,excelsior,johnnyubiera8471,19/05/2024,"Según la Biblia, los padres de Moisés fueron Amram y Jocabed. En Éxodo 6:20 se menciona que Amram tomó por mujer a Jocabed, su tía, y ella le dio a luz a Aarón y a Moisés. Amram y Jocabed eran de la tribu de Leví, por lo tanto, Moisés era de ascendencia levítica. La historia de Moisés comienza en Éxodo 2, donde su madre, Jocabed, lo esconde para protegerlo de la orden del faraón de matar a todos los niños hebreos varones. Fue entonces que la hija del faraón lo encontró y lo adoptó como su propio hijo.",1
3,excelsior,Epesita,19/05/2024,"México no se compone solo en un sexenio, lo que descontrulleron a base de engaños, no necesitamos despensas y tiradas de de errores",128
3,excelsior,markrosascdmx,19/05/2024,"Xóchitl Galvez solo se paso en el debate en atacar y atacar , no dijo nada relevante y no dio soluciones a las preguntas de los panelistas, me da tristeza que haya personas que aun cree en esta señora.",53
3,excelsior,siempredecurioso,19/05/2024,NO SE DICE PRESIDENTA SE DICE PRESIDENTE SEA HOMBRE O SEA MUJER.,1
3,excelsior,MrThunderlord84,19/05/2024,"Xochitl entre mas habla con esa actitud de adolescente malcriada ,mas se hunde. (Que actitud mas infantil la de hacer cartelones señaladores  Con la intencion de difamar y mentir) En la politica, la postura y la templanza son primordiales  La manera en la que se expresan habla mucho de ellos y tambien la manera en la que reaccionan denota el liderazgo o la falta del mismo. No se tiene que hacer mucho  Analisis  Claudia reune las caracteristicas aptas para gobernar.",1
3,excelsior,clemenciaramirez9570,19/05/2024,"Esa Xóchitl, cae muy mal a mucha gente, tiene puro beneno en su corazón y en la lengua . Dra. Claudia próxima Presidenta de Mexico.",117
3,excelsior,user-qp4ym2wn5v,19/05/2024,"Sueño guajiro de Maynes,si aún teniendo una ley federal del trabajo,hay empresas que te no respetan la jornada laboral de 8 hrs.no te pagan los días no laborables por ley ,no pagan el tiempo extra conforme a la ley, y no hay una comisión de la cofedet que se encargue de hacer una investigación de campo y que en verdad castigue ese tipo de explotación laboral moderna, la esclavitud no se abolió solo se modernizó",61
3,excelsior,siempredecurioso,19/05/2024,Oy esa jalada que los mexicanos en el exterior tenemos que trabajar el doble para mandar más remesas porque ya no alcanza ñ,1
3,excelsior,CoOte041,19/05/2024,Por qué Xóchitl habla hace como francesa,1
3,excelsior,marthaalicia4506,19/05/2024,De verdad que solita se pone de a pechito pobre botarga solo es el payaso de las cachetadas,120
3,excelsior,GonzoCruz-jq8hk,19/05/2024,"No puedo creer que esas son nuestras opciones para votar gente ignorante atacandose en cada debate solo fijándose en las cosas que sus partidos hicieron en el pasado ,pero preguntense porque en vez de estar hechandose la culpa el uno al otro porque no mejor se enfocan en el futuro en cosas que realmente importan y hacer acciones en vez de estar agarrandose con el sarten como señoras de barrio",21
3,excelsior,faviolasierra5850,19/05/2024,Deberían hacer una revisión en todas las instancias para ver dónde está el problema ya que mexico hay dinero y muchas becas pero como se utilizan pues creo que si a de haber terceros administrando por eso siempre hay una falla en estos temas,0
3,excelsior,HortenciaRamon,19/05/2024,"15:57 hola país soy orgullosamente mexicana ,por las circunstancias de el país no estoy en México y ustedes saben la principal la inseguridad de la violencia y eso es el primer gran problema de el país, México es maravilloso, ahí hay de todo para comer,y para vivir el mejor lugar de el mundo ,yo votaré por el señor Maine's por qué claramente se ve su mentalidad coherente y conciente ,es una persona que se ve transparente , que realmente sabe lo que los mexicanos necesitamos , apoyemos a quien es conciente por qué así cada día dara su servicio al país ,yo votare por la verdad hablando y haciendo realidad lo hablado",1
3,excelsior,Maldapariz,19/05/2024,"Me gustó mucho lo propositivo que es Máynez, creo que las otras candidatas suelen abusar de decir cosas incendiarias y se la pasan desviando el tema en vez de dar una postura clara, me gusta el acercamiento de Máynez de decriminalizar el aborto y dejar de llenar las cárceles de personas con delitos menores;  insistir que la diversificación de  los aliados económicos es clave y por supuesto también cambiar las políticas migratorias mexicanas para ser congruentes en como queremos que traten a nuestra gente.",53
3,excelsior,user-yd6gx3hz7g,19/05/2024,"El grave problema del cambio climático, no sólo depende del gobierno sea del partido que sea, el cambio climático depende de cada ser humano que se encuentre viviendo en este mundo.",101
3,excelsior,victorm.ramirez4203,19/05/2024,Creo Que Les falta ablar de modificar la constitucion por Que se Les olvida Que el perro de sedillo la modifico a favor de Los politicos y en contra del Pueblo,1
3,excelsior,guillermomendoza7684,19/05/2024,No sirve que hagan hospitales si no tienen ningún medicamento,0
3,excelsior,benjamincampero5401,19/05/2024,"No dudo que a él prian lo sigan miles de personas, el problema para ellos es que a morena lo siguen millones",194
3,excelsior,perfectaflores1485,19/05/2024,Vamos por Claudia,63
3,excelsior,AngelRamirez-lw8je,19/05/2024,Es impocible que  ba mejorar al pueblo de México y hasta hora despertaron el PRIAN yel zochilt ellos son los que  no sueltan  el. Dinero para las programas,1
3,excelsior,franciscoramos5205,19/05/2024,"Increible que una candidata a presidenta ,se dedique en un debate nacional a desacreditar y no realice una sola propuesta ...nos falta el respeto a los mexicanos que ya no somos ignorantes . Esperemos que en futuros debates eliminen las difamaciones y sea de propuestas",21
3,excelsior,santosnieblas6628,19/05/2024,Xochilt es una vergüenza,51
3,excelsior,oliviareyesoropeza430,19/05/2024,"Esta, señora que aspira a gobernar nuestro país, muestra en su participación, un total desconocimiento de los logros obtenidos con los programas de bienestar social. Creo nesesario y urgente que realice un trabajo de investigación, para que haya más conguencia en su discurso. Deben ponerle el video de Vicente Fox, con quién se identifica plenamente.",0
3,excelsior,SeveroFernando-xf4cn,19/05/2024,Cómo puedo saber cuando están en vivo,0
3,excelsior,patriciavazquez985,19/05/2024,No entiendo porque los moderadores no le llama la atención a los carteles a destiempo que pone Xóchitl y que actitud tan absurda e infantil. Cómo si estuviera en la secu,19
3,excelsior,user-lt9px2ld2d,19/05/2024,Con todo respeto XOCHITL no nos lave el cerebro somos millones de Mexicanos que ya no es fácil de engañarnos no vamos a votar por Ud. FUERA PRIAN trabajaron a su favor FUERA CORRUPTOS,51
3,excelsior,RED-JIREN,19/05/2024,Ver a Xóchitl en el debate es como ver una bolsa llena de mierda echada a perder.,4
3,excelsior,blessboygarcia5798,19/05/2024,"Maynes . Me gusta como piensa, y Claudia tiene una seriedad y informacion concluyente.    La otra señora me recuerda a los democratas americans.",1
