num_debate,canal,username,fecha,comentario,num_likes
3,once,aurorareyes8921,19/05/2024,"Yo soy una adulta nayor que recibo una pensión que el borracho Fecal me negó, siendi que habia trabajado en iniciativa privada durante 17 años, pero en 2009 me dejaron sin oportunidad en el IMSS.",28
3,once,mentescreativasenproceso5126,19/05/2024,Xóchitl Gálvez agradecemos tus desatinos; porque gracias a ellos haz desenmascarado al INE y a norma Piña. Ese es el poder judicial.,42
3,once,aurorareyes8921,19/05/2024,"Maynez estuvo repitiendo lo mismo que ha dicho en todos los debates, pero nada nuevo y ni como lo hará.",21
3,once,yazlazca6984,19/05/2024,"TODO LO QUIEREN RESOLVER CON BECAS, PERO LOS ESTUDIANTES SALEN SIN PREPARACÓN... ASÍ DEN A TODOS LOS NIÑOS BECAS, SI LOS ESTUDIANTES NO SE APLICAN, NO SIRVE DE NADA",9
3,once,saulurielmartinezlopez101,19/05/2024,"Sin un acarreado jajaja, hoy un conocido que vende en la calle en el mercado de la Merced me comentó como los llevaron de acarreados a la marcha de la X, no tienen vergüenza",9
3,once,MARGARITACONSTANTINOM,19/05/2024,La pobre botarga se ve desesperada.... Pura incoherencia dice,21
3,once,enriquesoni116,19/05/2024,"Ocupamos que les den casa a los adultos mayores, pagando como renta,no por ser weyes si no por tener disponibilidad del Infonavit para éste déficit.dónde no tenemos viviendas",8
3,once,silviareyesnunez9665,19/05/2024,"Yo voy por Claudia, pero Mainez esruvo genial le dio con todo a la Xochil.",20
3,once,thejoakexer2556,19/05/2024,"Me pregunto por qué no nos dejan ver lo que tienen que decir los voceros en los puntos del debate, se me hace bien sospechoso como si no quisieran que viéramos.  Dónde lo puedo ver?",6
3,once,jorgeramirezcoss,19/05/2024,"Confiamos en quien nos mintió y robó por setenta años, o por quién decía cambiar y por doce años robaron y mintieron o por quién en cinco años hizo lo mismo por lo que se quejaba y aparte no se puso los pantalones en contra de los delincuentes y cuando digo delincuentes es también por sus camaradas políticos de otros partidos. Entonces por quién botar. O mejor botarlos a todos al carajo",6
3,once,eduardoestrella15,19/05/2024,"Como estudiante, estoy en apoyo a Maynez. Hasta el momento, ha estado bastante preparado para las preguntas del público y ha sido más congruente, dado que es el único que ha hablado sobre el tema de la concesión de aguas y de las jornadas laborales. Sus ideas para ayudar a los jóvenes a mí me atrae (parece broma, pero no he recibido ningún apoyo por morena a pesar de estudiar en escuela pública). Espero al menos quede muy reñido con Claudia, no importa si no gana.",11
3,once,marianatrejo3492,19/05/2024,"He leído muchos comentarios en los que dicen que Claudia es la mejor opción para ser presidenta pero queridos lectores la verdad no es así, por qué a lo que ustedes comentan no saben lo que han estado haciendo la señora Claudia y el señor presidente, me queda claro de cómo se está yendo México cada vez más para abajo, felicidades ahora seremos la nueva Venezuela gracias a ustedes.",9
3,once,rosacano2214,19/05/2024,"Plan C,  voto Masivo para el 2 de junio de 2024 para la Dra. Claudia Sheimbaum Pardo.",21
3,once,carolcruz2902,19/05/2024,Plan C,12
3,once,julianlopez1552,19/05/2024,Imaginemos que muchas personas únicamente tienen este debate como referencia de voto. Qué triste escuchar que se tiren tierra en vez de sacar provecho a este espacio con propuestas y profesionalismo.,0
3,once,almond2929,19/05/2024,"Todo lo que prometen está muy bien. Pero los que trabajamos dignamente y nos esforzamos todos los días, entonces nos harán pagar más impuestos como propone el señor Maynez? No es justo",3
3,once,aurorareyes8921,19/05/2024,"Seguimos firmes en apoyo a Nuestra Próxima Presidenta Dra Claudia Sheimbaum Pardo. De Norte a Sur, de Éste a Oeste, ganaremos la contienda éste 2 de Junio por Congruencia, trabajo y Voluntad.",18
3,once,oscarivanresenosjasso5194,19/05/2024,Cuando ponen a los 3 candidados la de enmedio es la niña de la primaria que todo lo toma en broma  y se reia de todo sin idea de la clase jajaja,1
3,once,christiandanielpaz6276,19/05/2024,Pasen las propuestas,1
3,once,CITYREMIX,19/05/2024,esa tal Xochitl no sabe ni que decir jajaja,8
3,once,ricardoricardo7684,19/05/2024,Gracias Xóchitl por exhibir una vez más a toda tu coalición y salir a marchar en beneficios de unos solos cuantos.  Gracias Xóchitl por seguir humillándose que es lo único que puedes hacer.  Gracias Xóchitl por hacerle ver al pueblo que solamente peleas por tus intereses y el de unos cuantos.   Xóchitl hoy en debate te la metieron doblada   Vamos Claudia  Vamos Obrador  Vamos Plan C,12
3,once,JoseVazquez-pv5jv,19/05/2024,CLAUDIA BARRIÓ EL PISO CON COCHITL GÁLVEZ EN EL DEBATE.,18
3,once,ricardopalacios394,19/05/2024,"Híjole no sé cómo se aguantan la.rida cuando Xochitl habla de corrupción de los demás  representante del PRI , Y CUANDO DICE QUE ELLA ES LA QUE LE SABE, NO SABE NI PROGRAMAR",3
3,once,cosascotidianas458,19/05/2024,"O sea quee para Maynez estará bien que los jóvenes fumen marihuana en la calle, eso ayudará a mejorar la seguridad en las calles",2
3,once,cosascotidianas458,19/05/2024,¿Por qué la unica que alza imagenes cuando los otros hablan es Xochilt?,2
3,once,carmenestradalopez3502,19/05/2024,CLAUDIA PRESIDENTA NI UN VOTO AL PRIANPRD NI MC,17
3,once,claudiaangeles6468,19/05/2024,ES CLAUDIA,10
3,once,citlallifuenteshernandez1420,19/05/2024,"En lugar de que Xóchitl se concentre en armar MENTIRAS, debería de armar verdaderas propuestas, pero es totalmente INCAPAZ de hacer una real propuesta en beneficio del pueblo.   XÓCHITL, VAS A PERDER!!!",2
3,once,olavikorpi8269,19/05/2024,¡Alguien páguele un curso de dicción a Gálvez! Si de por sí es intolerable escucharla...,2
3,once,bettyhernandez8867,19/05/2024,"Moderadores muy chafas, no hicieron razonar , pregunten sin dejar que se les escurra la del prian, eso es lo q hacen",4
3,once,maximilianomartinez1930,19/05/2024,"CHochil miente, soy adulto mayor y nunca me han extorsionado, ni siquiera han tratado de hacerlo.",4
3,once,abrahamt.espana7085,19/05/2024,Es obvio que Xóchitl trae apuntador,7
3,once,claudiaangeles6468,19/05/2024,XOCHITL LE PONÍA LAS VÍCTIMAS A SU HERMANA LA SECUESTRADORA,4
3,once,aurorareyes8921,19/05/2024,"Cierto Dra Claudia Sheimbaum, mi nieta está estuduando en la Universidad Rosario Castellanos, hracias por atender a kos jóvenes, adultos mayores personas con discapacidad y a todos los niños que asisten a Jardin de Niños, Primaria, Secundaria, preparatoria y Universidad, solo falta lumpiar el poder judicial y la UNAM, que están enquistados de corrupción.",5
3,once,carolcruz2902,19/05/2024,Viva la 4T!!,9
3,once,diegoarmandohernandezhernandez,19/05/2024,Pog culpa,0
3,once,user-zd5bi1gk2t,19/05/2024,"Minuto 27 . 04  de Xóchilt le dura casi 40 segundos y en su marcador sobran 35 , andan la prueba?",0
3,once,bettyhernandez8867,19/05/2024,"Carajo  que no se atropellen , moderadores que onda",1
3,once,elperrogatuno8668,19/05/2024,Es un honor estar con la próxima presidenta Claudia Sheinbaum,7
3,once,carolcruz2902,19/05/2024,Claudia Sheimbaum!!,4
3,once,bettyhernandez8867,19/05/2024,"Que onda azul ,hagan preguntas y digan definición de autoritarismo  represión, democracia , muerte de periodistas por parte del gobierno?",2
3,once,andreaalvarado5578,19/05/2024,"Se trata de aumentar el salario mínimo sin afectarnos con la inflación, de nada me ha servido el aumento de salario si tengo que gastar más para vivir",2
3,once,mariaetherarista465,19/05/2024,Virndo de nuevo el debate que la botarga no trae propuestas ni pela a maynez su unico trabajo es atacar a la doctora claudia,0
3,once,CarolinaTepatzi-ul1zc,19/05/2024,Me quedo satisfecha de que vote por AMLO   PRIMERO LOS POBRES SI CUMPLIO.   Obvio todo el cagadero que el PRIAN hizo no se va a limpiar en 6 años.,0
3,once,aurorareyes8921,19/05/2024,"Me parece que la que se mantuvo Sobria, elegante, propia, respetuosa y con oídos sordos a las calumnias de xóchitl gálvez, la botarga que parece espantapájaros de milpa.",5
3,once,cesarserna4373,19/05/2024,El problema de la campaña de Xochitl ha sido atacar constantemente a Claudia dejando de lado sus propuestas.,3
3,once,pilarojedarodriguez4081,19/05/2024,Seguimos con Claudia Sheinbaum!,9
3,once,mariacalixto9322,19/05/2024,NO TODAS LAS PERSONAS  DE EL PAIZ SON CATOLICOS,0
3,once,darinelroblerohernandez1056,19/05/2024,Cómo soy morenista les digo que vamos a ganar,5
3,once,aurorareyes8921,19/05/2024,"Vamos directo con ka Dra Claudia Sheimbaum Pardo a ka Presidencia, Clara Brugada a la Jefatura de Gobierno de CDMX y aquí en Álvaro Obregón vamos xon Javier López Casarín de Morena y Aliados.",4
3,once,ClaudiaCastaneda-ed3mk,19/05/2024,Arriba claudia,3
3,once,greciadelatorresuarez9361,19/05/2024,Que lindo maynez haciendo un corazoncito con sus manos,4
3,once,antonioch1135,19/05/2024,"Xochitl presidenta, critican a Fox y a Calderon. Siempre hubo seguridad y estabilidad economica. En la actualidad Mexico es el 2do pais con mayor violencia en America",1
3,once,luislira3876,19/05/2024,"Ninguno es espontáneo, es triste",0
3,once,enriquesoni116,19/05/2024,El prometer no empobrece cumplir es lo que aniquila,4
3,once,enriquesoni116,19/05/2024,Cochil habla así porque trae chicle o porque se muerde la lengua,1
3,once,celiacarroavina9992,19/05/2024,"Nuestro voto es por la Dra Claudia Shembaum,  a ustedes el repudio absoluto",5
3,once,franklincalderon744,19/05/2024,"La botarga si le sabe a todo jajaja Pero no sabe hacer ni una suma , y ya se me fue el discurso hahhaakakakajajkajaha",0
3,once,monosaurio7837,19/05/2024,maynes el mas fake de todos,2
3,once,enriquesoni116,19/05/2024,Cochil sácate el chicle,1
3,once,yazlazca6984,19/05/2024,"USO DE ENERGÍAS INFINITAS, COMO LA CREADA A BASE DE LA UNIÓN Y SEPARACIÓN DE PARTÍCULAS DE AGUA E HIDRÓGENO. LAS ENERGÍAS RENOVABLES TAMBIÉN AFECTAN AL PLANETA, TAMBIÉN GENERAN UN MPACTO",0
3,once,carolcruz2902,19/05/2024,Viva AMLO!!!,6
3,once,amandagonzalez5216,19/05/2024,Viva claudia!!,4
3,once,abrahamt.espana7085,19/05/2024,A ver las orejas de X,1
3,once,modestaantoniasantanaarias4206,19/05/2024,Me gusta el canal 11.,2
3,once,UniCorni.7,19/05/2024,"dicen que nunca hemos estado mejor. no se ustedes, pero yo nunca he estado peor, y no hablo de partidos políticos, hablo de inflación, de el costo real de la canasta básica y de cómo mi salario  cada vez alcanza para menos, ni hablar de rentar una vivienda y pagar los servicios, la escasez de recursos como el agua nos manejamos con pipas desde hace meses. y pague y pague impuestos para un seguro social que me da citas para dentro de tres meses. no se si ustedes están bien",0
3,once,carmilliacalvillo,19/05/2024,"Estuvo de mejor veo una buena película y un buen libro por ejemplo los que dijo una de las candidatas que dicho sea de pasó, parece el presagio del contexto de ambos libros lo que se vive hoy en día.",1
3,once,ANGELTOVARMARTINEZ,19/05/2024,Maynez como siempre el mejor candidato. ARRIBA MAYNEZ,3
3,once,katybahena3593,19/05/2024,Cochilt CORRUPTAZA!!️,1
3,once,yazminaguayo3512,19/05/2024,"Cada que la Dra. Sheinbaum habla, me quedo asi de a poco si mamita, a ver cuentame mas de ese chisme, quien te conto todo eso chiquita, estamos hablando del mismo México, de la misma realidad?",0
3,once,user-zd5bi1gk2t,19/05/2024,Y a todos Alos otros candidatos se ve su cronómetro completo pero cuando xochitle habla desaparece,0
3,once,amandagonzalez5216,19/05/2024,Claudia presidenta,4
3,once,alanrodriguesz9981,19/05/2024,"Voto masivo para  morena Claudia plan C... Continuará con la transformación.,.....fuera prian fuera movimiento naranja....",0
3,once,fordhenry1413,19/05/2024,minuto 54:25  se puede ver el micro del apuntador,0
3,once,andreaalvarado5578,19/05/2024,"No es verdad, no hay medicamentos ni médicos especialistas. Por favor abran los ojos , hagamos voto consiente, da tristeza ver cómo tratan de vernos la cara, es indignante el descaro de las mentiras que dicen",0
3,once,mariacalixto9322,19/05/2024,XOCHITL   TU NO VAS A HASER LA PRÓXIMA  PRECIDENTA,3
3,once,jaimealvarezdelgado9873,19/05/2024,Felicidades a Julia!! Muy bien la manera de confromtar a ña representante del PRIAN.,1
3,once,user-zd5bi1gk2t,19/05/2024,1:01.3 xochitle,0
3,once,alexisperez6089,19/05/2024,"Claudia Presidenta y Maynes, ambos pueden cambiar a Mexico",2
3,once,espaciodelprogreso7993,19/05/2024,Elena Arcila magnífico.,0
3,once,angy9103,19/05/2024,vamos Doctora Claudia vamos a ganar,4
3,once,enriquesoni116,19/05/2024,Para que cambiar si el poder judicial saca a los maleantes,1
3,once,estelamalpica3015,19/05/2024,"Fatal la cintia , es el mismo corte que Xóchitl, mentiras …",0
3,once,enriquesoni116,19/05/2024,Azul y Alberto ahí les dejo mi aportación a mis nececidades,0
3,once,lorenaventura6141,19/05/2024,Si yo digo presidente tu distes  Maynes presidente  Deja tu respuesta,0
3,once,user-he8tm8hk3d,19/05/2024,No me imagino a la esposa del dr  Simi  como presidenta,0
3,once,ELIAZARBASTIDAS,19/05/2024,#PT voy,1
3,once,TonyCarbot,19/05/2024,"Es una verguenza Claudia, puras mentiras. #FueraMorena",0
3,once,user-he8tm8hk3d,19/05/2024,Esta bien !!! Q este encontra de las feministas  vulgares y corrientes. Una mujer se deve de dar su lugar y respeto,0
3,once,Juanitocd,19/05/2024,Xochitl la vergüenza de Hidalgo,0
3,once,CarlosMartinez-li8ho,19/05/2024,MAYNES YA EN SEGUNDO LUGAR. CLAUDIA SIGUE EN PRIMERO......,3
3,once,luisfernandez2860,19/05/2024,Según Xóchilt no usa acarridos  ya se le olvidó que el PRIAm son más usan eso,0
3,once,maximilianomartinez1930,19/05/2024,"Si, yo soy aquel y bla bla bla bla bla bla bla bla bla bla bla bla",0
3,once,razielmoctezumamx,19/05/2024,¡¡¡ CLAUDIA SHEINBAUM PRESIDENTA !!! ¡¡¡ CLAUDIA SHEINBAUM PRESIDENTA !!! ¡¡¡ CLAUDIA SHEINBAUM PRESIDENTA !!! ¡¡¡ CLAUDIA SHEINBAUM PRESIDENTA !!! ¡¡¡ CLAUDIA SHEINBAUM PRESIDENTA !!! ¡¡¡ CLAUDIA SHEINBAUM PRESIDENTA !!! ¡¡¡ CLAUDIA SHEINBAUM PRESIDENTA !!! ¡¡¡ CLAUDIA SHEINBAUM PRESIDENTA !!! ¡¡¡ CLAUDIA SHEINBAUM PRESIDENTA !!! ¡¡¡ CLAUDIA SHEINBAUM PRESIDENTA !!! ¡¡¡ CLAUDIA SHEINBAUM PRESIDENTA !!! ¡¡¡ CLAUDIA SHEINBAUM PRESIDENTA !!! ¡¡¡ CLAUDIA SHEINBAUM PRESIDENTA !!!,2
3,once,martinafranco1755,19/05/2024,Arriva morena,2
3,once,saulurielmartinezlopez101,19/05/2024,Claudia Presidenta,1
3,once,Carlosprez,19/05/2024,"TERRIBLE, TANTA CORRUPCION Y SHEINBAUM NO DICE NADA. ORGULLOSA SHEINBAUM DEL 68 PERO NO DIJO NADA DE LA MILITARIZACIÓN DEL PAIS, Y TIENE EN SUS FILAS AL NIETO DE UN GENERAL QUE PARTICIPO EN LAS MATANZAS CONTRA ESTUDIANTES",1
3,once,sergioalvarez8623,19/05/2024,Cacacaclaudia,0
3,once,saulurielmartinezlopez101,19/05/2024,"Vergüenza la X, ni un voto al PRIAN",3
3,once,JuanSanchez-zu1nz,19/05/2024,"Mentirosos,,, Claudia es la única capaz de Gobernar a México",0
3,once,sergioalvarez8623,19/05/2024,Narcaclaudia,0
3,once,gracielrodriguezcorona8244,19/05/2024,Xóchitl  la mejor   El candidata,3
3,once,user-he8tm8hk3d,19/05/2024,El mani paquia esta bien endejo,0
3,once,LJ0808,19/05/2024,Neta no hay otras opciones ?,0
3,once,user-he8tm8hk3d,19/05/2024,Jaja la.  Otarga se basa a un libro de una ridicula,0
3,once,esmeraldavazquez3436,19/05/2024,Eliminar a los plurinominales. Si por favor,1
3,once,user-he8tm8hk3d,19/05/2024,Q aprendan al presidente de El Salvador,0
3,once,ricardoricardo7684,19/05/2024,Gracias Xóchitl por exhibir una vez más a toda tu coalición y salir a marchar en beneficios de unos solos cuantos.  Gracias Xóchitl por seguir humillándose que es lo único que puedes hacer.  Gracias Xóchitl por hacerle ver al pueblo que solamente peleas por tus intereses y el de unos cuantos.   Xóchitl hoy en debate te la metieron doblada   Vamos Claudia  Vamos Obrador  Vamos Plan C,5
3,once,sergioalvarez8623,19/05/2024,Cacacaclaudia,0
