"User","arroba","hora de publicación","comentario","comentario_editado","Xóchitl","Claudia","Maynez","Ninguno"
"Ahora Tabasco Noticias","@AhoraTabasco","18:28","🗳️  EleccionesAhora | @OHarfuch afirma que, según encuestas de salida, @claudia sheinbaum se perfila como ganadora en la elección presidencial de México. |  México |  Noticias |  AhoraTabasco |  EleccionesMéxico2024 |  EleccionesMéxico |  Elecciones2024MX |  Voto |  Vota |  Votar |  Domingo","elecciones ahora oharfuch afirma que,según encuestas de salida,claudia sheinbaum se perfila como ganadora en la elección presidencial de méxico.méxico noticias ahora Tabasco elecciones en méxico 2024 elecciones en méxico elecciones en méxico 2024 voto vota votar domingo","0","1","0","0"
"Néstor ✈️","@nestormora_","18:27","Ya todos y todas se están declarando ganadores. Al rato cuando salgan a decir que los resultados no los favorecen van a quedar como estúpidos.  EleccionesMéxico2024","ya todos y todas se están declarando ganadores.al rato cuando salgan a decir que los resultados no los favorecen van a quedar como estúpidos.elecciones en méxico 2024","-1","-1","-1","0"
"Liliana DeLuna","@lilianadeluna","18:27","El vestuario de @XochitlGalvez ha conservado el estilo, colores y simbología que desde el inicio de su campaña utilizó, transmitiendo cercanía y calidez con el electorado. Una de las claves de la  MarcaPersonal es la consistencia.  EleccionesMéxico2024","el vestuario de xochitl galvez ha conservado el estilo,colores y simbología que desde el inicio de su campaña utilizó,transmitiendo cercanía y calidez con el electorado.una de las claves de la marca personal es la consistencia.elecciones en méxico 2024","1","0","0","0"
"Grupo Fórmula","@Radio_Formula","18:59","“Una cosa dijo pero otra se ve”: Marko Cortés (@MarkoCortes), presidente nacional del PAN, reacciona ante el discurso de Mario Delgado y defiende que los votos que obtuvo Xóchitl Gálvez serán suficientes para obtener la victoria.  EleccionesMéxico2024  Elige2024","una cosa dijo pero otra se ve:marko cortés(markocortes),presidente nacional del PAN,reacciona ante el discurso de mario delgado y defiende que los votos que obtuvo xochitl galvez serán suficientes para obtener la victoria.elecciones en méxico 2024 elige en 2024","1","0","0","0"
"K A R E N L U N A ®","@karenlunamx","18:59","Aquí en delegación Coyoacán cerraron casillas de la nada con cantidad de personas aún formadas.  nonosdejaronvotar  EleccionesMéxico2024","aquí en delegación Coyoacán cerraron casilla electoral de la nada con cantidad de personas aún formadas.no nos dejaron votar elecciones en méxico 2024","0","0","0","-1"
"teactiva","@teactiva","18:59","En caso de que efectivamente gane Claudia Sheinbaum quisiera mandar a chingar a su madre al peje por su reelección.  EleccionesMéxico2024","en caso de que efectivamente gane claudia sheinbaum quisiera mandar a chingar a su madre al peje por su reelección.elecciones en méxico 2024","0","1","0","0"
"JUAN PÉREZ DICE","@JuanPerez_Dice","18:59","La lloratón de mafiosos de los medios de comunicación en las  EleccionesMéxico2024 es un deleite.","la lloratón de mafiosos de los medios de comunicación en las elecciones en méxico 2024 es un deleite.","0","0","0","-1"
"Policía Estatal del Estado de México","@EstatalEdomex","18:59","La ciudadanía mexiquense se comprometió en este  ProcesoElectoral2024. Con su participación en las  EleccionesMéxico2024 se fortalece la democracia en el país y en el  EdoMéx.  EleccionesMx2024  EstadoDeMéxico","la ciudadanía mexiquense se comprometió en este procesoelectoral2024.con su participación en las elecciones en méxico 2024 se fortalece la democracia en el país y en el estado de méxico.elecciones en méxico 2024 estado de méxico","0","0","0","1"
"@diario24horas","@diario24horas","18:59","respondiendo a @diario24horas @XochitlGalvez and @aguilarkarina 'Esperaremos los resultados del @INEMexico solo para ratificar el triunfo' advierte @XochitlGalvez, candidata presidencial de Fuerza y Corazón por México.  En2024Eliges  EleccionesMéxico2024 📹: @aguilarkarina","respondiendo a diario24horas xochitl galvez and aguilarkarina esperaremos los resultados del INE México solo para ratificar el triunfo advierte xochitl galvez,candidata presidencial de fuerza y corazón por méxico.en 2024 eliges elecciones en méxico 2024:aguilarkarina","1","0","0","0"
"Miguel Ángel","@miguelangelcr83","18:59","No sé porque les sorprende que @TelevisaTVmx se haya vendido a la  4T cuando por más de 50 años su otrora dueño se declaró abiertamente como un 'soldado del PRI'... 🙄  EleccionesMéxico2024","no sé porque les sorprende que televisatvmx se haya vendido a la 4ta transformación cuando por más de 50 años su otrora dueño se declaró abiertamente como un soldado del pri representado por xochitl...elecciones en méxico 2024","-1","-1","0","0"
"Info Quórum","@quorum_mx","18:58","🟠🗳📣🧐🤔El candidato  EduardoRivera se asume como el ganador de la  gubernatura de  Puebla en estas  EleccionesMéxico2024.  coberturaquórum","el candidato Eduardo Rivera se asume como el ganador de la gobernatura de puebla en estas elecciones en méxico 2024.cobertura quórum","0","0","1","1"
"Lucy","@__LucyBell","18:58","Siendo una de las votaciones con mayor afluencia, se supone que hay que esperar a los conteos, pero Televisa ha declarado al ganador. Mi México mágico.  EleccionesMéxico2024","siendo una de las votaciones con mayor afluencia,se supone que hay que esperar a los conteos,pero televisa ha declarado al ganador.mi méxico mágico.elecciones en méxico 2024","0","0","1","1"
"Cris","@CrisNaos","18:58","Por Homero Gómez, @DahliaBat y las desaparecidas de México.  EleccionesMéxico2024  VotoDignamente","por homero gómez,dahliabat y las desaparecidas de méxico.elecciones en méxico 2024 voto dignamente","0","0","1","0"
" FotoRreporterosMx","@FotoReporMx","18:58","El presidente de Morena, Mario Delgado, da ganadora a la candidata Claudia Sheinbaum después de varias encuestas de salida. Foto: Arturo García Campos / FotorreporterosMx  EleccionesMéxico2024  Elecciones2024  EleccionesMx2024","el presidente de morena,mario delgado,da ganadora a la candidata claudia sheinbaum después de varias encuestas de salida.foto:arturo garcía campos fotorreporterosmx elecciones en méxico 2024 elecciones 2024 elecciones en méxico 2024","0","1","0","0"
"OVACIONES","@ovaciones","18:56","🇲🇽 🗳️ Xóchitl Gálvez da su discurso y se proclama ganadora, aunque pide esperar a los resultados oficiales. 'Estamos viviendo una elección histórica'  EleccionesMéxico2024 📹: @AndresDiaz04 / Ovaciones","xochitl galvez da su discurso y se proclama ganadora,aunque pide esperar a los resultados oficiales.estamos viviendo una elección histórica elecciones en méxico 2024:andresdiaz04 ovaciones","1","0","0","0"
"Corresponsales MX","@CorresponsalsMX","18:55","Xóchitl Gálvez, candidata presidencial de la coalición  PAN  PRI  PRD, se autoproclamó triunfadora de la elección presidencial. 'Está claro que ya ganamos', aseguró en conferencia de prensa.  EleccionesMéxico2024","xochitl galvez,candidata presidencial de la coalición PAN pri representado por xochitl PRD,se autoproclamó triunfadora de la elección presidencial.está claro que ya ganamos,aseguró en conferencia de prensa.elecciones en méxico 2024","1","0","0","0"
"Luis Encina","@LuisEncina17","18:55","No dudo por un segundo que Sheinbaum haya ganado. Pero ¿Por qué vergas no ponen los porcentajes de sus encuestas?  EleccionesMéxico2024","no dudo por un segundo que sheinbaum haya ganado.pero¿por qué vergas no ponen los porcentajes de sus encuestas?elecciones en méxico 2024","0","1","0","0"
"A-Proximidad","@AProximidad","18:55"," Aproximidad 🚨 AlertaADN  EleccionesMéxico2024 | Mario Delgado (@mario_delgado) afirma que tienen amplia ventaja sobre la candidata del 'PRIAN', e indica que 'no hay duda del triunfo de Claudia Sheinbaum (@claudia sheinbaum), una mujer que ha conquistado a…","aproximidad alertaadn elecciones en méxico 2024 mario delgado(mario_delgado)afirma que tienen amplia ventaja sobre la candidata del prian representado  por xochitl,e indica que no hay duda del triunfo de claudia sheinbaum(claudia sheinbaum),una mujer que ha conquistado a","-1","1","0","0"
"Omar Garcia","@omargv1977","18:54","Nuestra próxima presidenta de México!!! Y todo su gabinete!!!  EleccionesMéxico2024","nuestra próxima presidenta de méxico!!!y todo su gabinete!!!elecciones en méxico 2024","0","1","0","0"
"Fernanda Salazar","@Fer_SalazarM","18:53","Qué les pasa a los hombres analistas? No puedo más… @aguilarcamin diciéndole a @magalonik y @DeniseMaerker que no es cierto lo que dicen, grosero y déspota. Ambas brillantes, pero el tipo queriendo tener la única razón. No están acostumbrados a escuchar.  EleccionesMéxico2024","qué les pasa a los hombres analistas?no puedo más aguilarcamin diciéndole a magalonik y denisemaerker que no es cierto lo que dicen,grosero y déspota.ambas brillantes,pero el tipo queriendo tener la única razón.no están acostumbrados a escuchar.elecciones en méxico 2024","-1","-1","-1","0"
"Drake5 ⚽🟨🟦","@soul_drake5","18:53","Esto me recuerda cuando Anaya o Bronco aseguraban antes de tiempo haber ganado la presidencia. Y nada,  AMLO aparecía arrasando en las preliminares ❗.  EleccionesMéxico2024","esto me recuerda cuando anaya o bronco aseguraban antes de tiempo haber ganado la presidencia.y nada,amlo aparecía arrasando en las preliminares.elecciones en méxico 2024","0","1","-1","0"
"lucas","@wavkos","18:53","Ya no entendí, todos son ganadores o como? 🤣  EleccionesMéxico2024","ya no entendí,todos son ganadores o como?elecciones en méxico 2024","0","0","-1","1"
"sopita 🗣️","@hmtyoongi","18:53","Todos andan diciendo que ya ganaron y aún ni terminan de contar votos, de seguro no mamen.  EleccionesMéxico2024","todos andan diciendo que ya ganaron y aún ni terminan de contar votos,de seguro no mames.elecciones en méxico 2024","-1","-1","-1","-1"
"ContraRéplica","@ContraReplicaMX","18:53"," EleccionesMéxico2024 Declaraciones de Marko Cortés ante la proclamación del triunfo de Santiago Taboada en la  CDMX  Elecciones2024","elecciones en méxico 2024 declaraciones de marko cortés ante la proclamación del triunfo de santiago Taboada en la Ciudad de México elecciones 2024","0","-1","0","0"
"Quinta Fuerza","@QuintaFuerzaMX","18:51"," Elecciones2024 🇲🇽🗳️ El equipo de sonido, video y el gran templete donde subirá el ganador a la Presidencia de México este domingo, ha comenzado a instalarse en la explanada del reconocido Zócalo de la  CDMX.  EleccionesMéxico2024  México  Elecciones","elecciones 2024 el equipo de sonido,video y el gran templete donde subirá el ganador a la presidencia de méxico este domingo,ha comenzado a instalarse en la explanada del reconocido zócalo de la Ciudad de México.elecciones en méxico 2024 méxico elecciones","0","0","0","1"
"PERIÓDICO SUPREMO","@Diario_Supremo","18:51","🗳  EleccionesMéxico2024 Santiago Taboada (@STaboadaMx) se declara ganador de las elecciones por la Jefatura de Gobierno según datos de tres encuestas registradas en el INE. Mientras Parametría da ganadora a @ClaraBrugadaM.  CDMX  EleccionesMéxico2024","elecciones en méxico 2024 santiago Taboada(staboadamx)se declara ganador de las elecciones por la jefatura de gobierno según datos de tres encuestas registradas en el INE.mientras parametría da ganadora a Clara Brugada.Ciudad de México elecciones en méxico 2024","0","0","1","0"
"Josué Barrera","@josue_barrera","18:51","No olvidemos el gran trabajo de miles de ciudadanos que, sin recibir pago alguno, han dado su mayor esfuerzo para coordinar, supervisar y contar nuestro voto. Gracias a todos los funcionarios @INEMexico @INE_Sonora.  Elecciones2024Mx  EleccionesMéxico2024","no olvidemos el gran trabajo de miles de ciudadanos que,sin recibir pago alguno,han dado su mayor esfuerzo para coordinar,supervisar y contar nuestro voto.gracias a todos los funcionarios INE México ine_sonora.elecciones en méxico 2024 elecciones en méxico 2024","0","0","0","-1"
"COMPA EATZ 🇵🇸","@EATZ_mx","18:49","Este discurso es el inicio para impugnar, sin importar que sean 5, 10 o 20 puntos de diferencia. Es la derrota de la extrema derecha que no le importa nada, solo el poder por el poder.  EleccionesMéxico2024","este discurso es el inicio para impugnar,sin importar que sean 5,10 o 20 puntos de diferencia.es la derrota de la extrema derecha que no le importa nada,solo el poder por el poder.elecciones en méxico 2024","0","-1","0","0"
"elbaccaysuslocuras","@elbacca77","18:59","respondiendo a @DeniseDresserG Qué mal pedo que te vendiste!!  XóchitlGálvezPresidenta  EleccionesMéxico2024","respondiendo a denisedresserg qué mal pedo que te vendiste!!xochitl gálvez será la presidenta elecciones en méxico 2024","1","0","0","0"
"Síntesis Puebla","@sintesisweb","18:59","Los candidatos de la coalición Mejor Rumbo para Puebla, @eduardorivera01 y @marioriestra, en rueda de prensa luego de la jornada electoral. @FotoSintesisOB  EleccionesMéxico2024","los candidatos de la coalición mejor rumbo para puebla,eduardorivera01 y marioriestra,en rueda de prensa luego de la jornada electoral.fotosintesisob elecciones en méxico 2024","0","0","1","1"
"Aldo Zavala 🌍","@Aldo_Z","18:59","Santiago Taboada se convertiría en el primer jefe de gobierno, electo democráticamente, de la CDMX y ajeno a la izquierda. Un acontecimiento histórico desde la llegada de Cuauhtémoc Cárdenas en 1997.  EleccionesMéxico2024  YaVoté  XochiltlGálvezPresidenta24","santiago Taboada se convertiría en el primer jefe de gobierno,electo democráticamente,de la Ciudad de México y ajeno a la izquierda.un acontecimiento histórico desde la llegada de cuauhtémoc cárdenas en 1997.elecciones en méxico 2024 ya voté xochitl galvez presidenta 2024","1","-1","0","0"
"NX Noticias","@NXNoticias","18:58","Según información estadística de N+, El Financiero proyecta a Sheinbaum como la ganadora de esta elección presidencial. Información en proceso…  EleccionesMéxico2024","según información estadística de n,el financiero proyecta a sheinbaum como la ganadora de esta elección presidencial.información en proceso elecciones en méxico 2024","0","1","0","0"
"Canal 13 Guadalajara","@C13Guadalajara","18:57"," UltimaHora l @ClaudDelgadillo de la coalición  SigamosHaciendoHistoria se dice ganadora con 43% de los votos🗳️📝.  Noti13Elecciones  EleccionesMéxico2024","última hora l clauddelgadillo de la coalición sigamos haciendo historia se dice ganadora con 43 de los votos.noticiero de elecciones elecciones en méxico 2024","0","1","0","0"
"Luna lunera","@SuchiapaSelene","18:32","Los 'perdedores' se ven felices y los 'ganadores' traen tremendas jetas… pero Televisa, acatando órdenes salió a dar un triunfo con quién sabe qué datos. Los rostros no mienten… al tiempo, porque  YoVotéPorXóchitl.","los perdedores se ven felices y los ganadores traen tremendas jetas pero televisa,acatando órdenes salió a dar un triunfo con quién sabe qué datos.los rostros no mienten al tiempo,porque ya voté por xochitl.","1","-1","0","0"
"Patricia Ramos","@PatriciaRamosTV","18:59","El podium que han colocado en el zócalo o plaza principal de la capital mexicana dice @claudia sheinbaum presidenta. Esto antes de conocerse los resultados oficiales de la jornada electoral.  EleccionesMexico2024","el podium que han colocado en el zócalo o plaza principal de la capital mexicana dice claudia sheinbaum presidenta.esto antes de conocerse los resultados oficiales de la jornada electoral.elecciones en méxico 2024","0","1","0","0"
"Chema Téllez","@SoyChemaTellez","18:59","¡El  PRI da como ganadora de la Presidencia de México a  XóchiltGálvez! 😱🇲🇽🗳️  EleccionesMéxico2024","¡el pri representado por xochitl da como ganadora de la presidencia de méxico a xóchiltgálvez!elecciones en méxico 2024","1","0","0","0"
"White Label","@churromansini","19:59","Pre de votos en actas contabilizadas, Claudia Sheinbaum con un 58% de los votos, valió madre  EleccionesMéxico2024  EsClaudiaPresidentaDeMéxico","pre de votos en actas contabilizadas,claudia sheinbaum con un 58 de los votos,valió madre elecciones en méxico 2024 Claudia será presidenta de México","0","1","0","0"
"Italo Caro ⚔️🛡️🎮","@italo_caro","19:59","Y comienzan ... Los 2024 juegos del hambre...  EleccionesMéxico2024","y comienzan...los 2024 juegos del hambre...elecciones en méxico 2024","-1","-1","-1","0"
"Barbón","@Isra_GuerreroB","19:59","Así arranca el PREP del INE:  EleccionesMéxico2024","así arranca el PREP del INE:elecciones en méxico 2024","1","0","0","0"
"Ángel Metropolitano","@angelmetropoli","19:59","🗳️  EleccionesMéxico2024 l Alicia Bárcena, afirmó en su cuenta de la red social X que la votación de los mexicanos en el exterior mostró una “afluencia extraordinaria”.  INE  México","elecciones en méxico 2024 l alicia bárcena,afirmó en su cuenta de la red social  porque la votación de los mexicanos en el exterior mostró una afluencia extraordinaria.INE méxico","0","1","0","0"
"Graymer Méndez","@graymermendez","19:59"," México tiene la primera mujer en la historia democrática en ser Presidente de la nación Azteca @claudia sheinbaum  EleccionesMéxico2024 @RedAMLOmx","méxico tiene la primera mujer en la historia democrática en hacer presidente de la nación azteca claudia sheinbaum elecciones en méxico 2024 redamlomx","0","1","0","0"
"Carlos Ramirez Zago","@carlos_ramzago","19:59","Los primeros datos del  PREP favoreciendo a Claudia Sheinbaum @claudia sheinbaum  EleccionesMéxico2024","los primeros datos del PREP favoreciendo a claudia sheinbaum claudia sheinbaum elecciones en méxico 2024","0","1","0","0"
"Arcz","@lArczl","19:59","Xóchitl viendo el resultado del PREP donde gana Claudia xd  EleccionesMéxico2024","xochitl viendo el resultado del PREP donde gana claudia xd elecciones en méxico 2024","-1","1","0","0"
"ALFREDOMATTA","@ALFREDOMATT4","19:59","ARRANCA EL PREP CON CLAUDIA SHEINBAUM GANADORA. Supera a Xochitl por el DOBLE de votos!!! 35% Xochitl vs 65% Claudia! No que las encuestas estaban cuchareadas?  Prep  ClaudiaPresidentaDeMéxico2024  Ganadora  EleccionesMx2024  EleccionesMéxico2024  Televisa  Ganamos 'Ganó Claudia'","arranca el PREP con claudia sheinbaum ganadora.supera a xochitl por el doble de votos!!!35 xochitl contra 65 claudia!no que las encuestas estaban cuchareadas?PREP claudia será la siguiente presidenta de méxico en 2024 ganadora elecciones en méxico 2024 elecciones en méxico 2024 televisa ganamos ganó claudia","-1","1","0","0"
"Enrique Villanueva - El Opinador","@ElOpinadorTV","19:59","El gran perdedor, la ciudadanía. El INE proyecta participación en las votaciones del 56.61% Seguimos buenos para quejarnos, pero no para levantarnos y hacer algo al respecto. Y con la güeva como bandera, México seguirá inmóvil con y sin políticos.  EleccionesMéxico2024","el gran perdedor,la ciudadanía.el INE proyecta participación en las votaciones del 56.61 seguimos buenos para quejarnos,pero no para levantarnos y hacer algo al respecto.y con la güeva como bandera,méxico seguirá inmóvil con y sin políticos.elecciones en méxico 2024","0","-1","-1","0"
"🇲🇽@RomanoXIV♥","@RomanoXIV","19:59"," XochitlALV  EleccionesMéxico2024 Habemus Presidenta. Van a reunirse en el Zócalo para festejar. Claudia Sheimbaum Pardo Presidenta De Los Estados Unidos Mexicanos.","vete a la verga xochitl elecciones en méxico 2024 habemus presidenta.van a reunirse en el zócalo para festejar.claudia sheinbaum pardo presidenta de los#Estadosunidos mexicanos.","-1","1","0","0"
"Meraki Seguros","@MerakiSeguros","19:59","Que forma tan OGT de revolver a las personas al votar poniendo varios partidos en vez de uno solo con el nombre del candidato y punto.  EleccionesMéxico2024  VolaréTour2024  YaVoté","que forma tan ogt de revolver a las personas al votar poniendo varios partidos en vez de uno solo con el nombre del candidato y punto.elecciones en méxico 2024 volaré tour 2024 ya voté","0","0","-1","1"
"❤‍🔥","@nightschild1","19:59","la derecha no soportó  XóchitlGálvezPresidenta  EleccionesMéxico2024  ClaudiaPresidentaDeMéxico2024  YaVoté","la derecha no soportó xochitl gálvez será la presidenta elecciones en méxico 2024 claudia será la siguiente presidenta de méxico en 2024 ya voté","-1","1","0","0"
"Abel Muciño","@AbelMucino","19:59","Se acerca el caos en  MEXICO  EleccionesMéxico2024 @INEMexico  Xalapa","se acerca el caos en méxico elecciones en méxico 2024 INE México xalapa","1","0","0","0"
"Hitoshi Demegawa","@KiraLiebhaber","19:59","'Hoy, los ciudadanos y ciudadanas fueron a votar por candidatos y candidatas, donde funcionarios y funcionarias estuvieron al pie del cañon para orientarlos y orientarlas a fin de que todos y todas emitieran su voto.' Parecen retrasados mentales. Retrógradas  EleccionesMéxico2024","hoy,los ciudadanos y ciudadanas fueron a votar por candidatos y candidatas,donde funcionarios y funcionarias estuvieron al pie del cañon para orientarlos y orientarlas a fin de que todos y todas emitieran su voto.parecen retrasados mentales.retrógradas elecciones en méxico 2024","0","-1","-1","-1"
"Alerta Mundo 24","@ALERTAMUNDO24","19:58","ÚLTIMA HORA MÉXICO 🚨 🇲🇽  PREP RESULTADOS PRELIMINARES elecciones presidenciales México. Actas capturadas 582  EleccionesMéxico2024  México  EsClaudiaPresidentaDeMéxico  XóchitlGálvezPresidenta","última hora méxico PREP resultados preliminares elecciones presidenciales méxico.actas capturadas 582 elecciones en méxico 2024 méxico Claudia será presidenta de México xochitl gálvez será la presidenta","1","1","0","0"
"Majo Poncino","@MajoPoncino","19:57","Hoy México eligió a su primera presidenta mujer de su historia @claudia sheinbaum 🇲🇽 🫶🏼  EsClaudiaPresidentaDeMéxico  EleccionesMéxico2024","hoy méxico eligió a su primera presidenta mujer de su historia claudia sheinbaum Claudia será presidenta de México elecciones en méxico 2024","0","1","0","0"
"🅿️inche🅱️rady 𝕏 👻","@_pinchebrady","19:57","A mamarla hijos de prra, no que no ganaba  claudia sheinbaumbaumPresidenta? Jajajajaja viva la 4t putisima madre  EleccionesMéxico2024  EsClaudiaPresidentaDeMéxico","a mamarla hijos de perra,no que no ganaba Claudia Sheinbaum presidenta?jajajajaja viva la 4ta transformación putisima madre elecciones en méxico 2024 Claudia será presidenta de México","0","1","0","0"
"Brisa Reyes","@reygarb2006","19:57"," EleccionesMéxico2024  ClaudiaPresidentaDeMéxico2024 Ya ganamos, México tiene a la primera PRESIDENTA de México.","elecciones en méxico 2024 claudia será la siguiente presidenta de méxico en 2024 ya ganamos,méxico tiene a la primera presidenta de méxico.","0","1","0","0"
"ABCD NOTICIAS OFICIAL","@NoticiasAbcd","19:55"," ÚLTIMAHORA  AlMomento | Primeros resultados del PREP con corte a las 20:00 horas (hora de la  CDMX). Sigue en este hilo 🧵 las actualizaciones. ⬇️  ABCDNoticias  EleccionesMéxico2024  Elecciones2024MX","última hora al momento primeros resultados del PREP con corte a las 20:00 horas(hora de la Ciudad de México).sigue en este hilo las actualizaciones.noticias elecciones en méxico 2024 elecciones en méxico 2024","1","0","0","0"
"𝕏arli Rubio","@CapXarli","19:59","Cálmense...a penas van el 0.6% de las actas computadas. La noche es larga.  EleccionesMéxico2024  prep  EleccionesMéxico2024  ElecciónPresidencial  EleccionesMéxico","cálmense...a penas van el 0.6 de las actas computadas.la noche es larga.elecciones en méxico 2024 PREP elecciones en méxico 2024 elección presidencial elecciones en méxico","1","0","0","1"
"Jhonatan J. de los Santos","@delossantosuy","19:59","México hace historia. Felicitaciones Presidenta electa, Dra. @claudia sheinbaum por la aplastante victoria. 🇲🇽✊🏻🇺🇾 México nos da un gran ejemplo y nos ilusiona.  EsClaudiaPresidentaDeMéxico  EleccionesMéxico2024","méxico hace historia.felicitaciones presidenta electa,doctora.claudia sheinbaum por la aplastante victoria.méxico nos da un gran ejemplo y nos ilusiona.Claudia será presidenta de México elecciones en méxico 2024","0","1","0","0"
"Oscar Peñaloza Pérez","@OscarPenaloza26","19:59","Se sigue haciendo Historia, la primera Presidenta de México y la primera mujer en América del Norte. 🇲🇽🗳️✅  ClaudiaPresidentaDeMexico  EleccionesMéxico2024","se sigue haciendo historia,la primera presidenta de méxico y la primera mujer en américa del norte.Claudia será presidenta de México elecciones en méxico 2024","0","1","0","0"
"Noticias Gdl","@NoticiasGdl_Mx","19:59","🗳️ Urna2024: Juan José Frangie, candidato de Movimiento Ciudadano a Zapopan, informa que los resultados le favorecen y “que ya ganó las elecciones”  EleccionesMéxico2024  Elecciones2024Mx","urna2024:juan josé frangie,candidato de movimiento ciudadano a zapopan,informa que los resultados le favorecen y que ya ganó las elecciones elecciones en méxico 2024 elecciones en méxico 2024","0","0","1","1"
"Jj","@jjemptysoul","19:59","A las 8:28pm  claudia sheinbaumbaum acaba de rebasar el 60% de los votos.  XochitlGalvez pasa a 28.33%.  Maynez llega a 8.7% según el  PREP  EleccionesMéxico2024","a las 8:28pm Claudia Sheinbaum acaba de rebasar el 60 de los votos.xochitl galvez pasa a 28.33.maynez llega a 8.7 según el PREP elecciones en méxico 2024","1","0","1","0"
