"User","arroba","hora de publicación","comentario","comentario_editado","Xóchitl","Claudia","Maynez","Ninguno"
"Francisco_Economista","@FrankECONOMISTA","14:32","Por la vida, la verdad y la libertad. Vayamos con mucho ánimo, con esperanza, y sin miedo a votar. Desde Tijuana, donde nace la patria, apoyando a @XochitlGalvez  YoVotéPorXochitl  XóchitlGálvezPresidenta  EleccionesMéxico2024","por la vida,la verdad y la libertad.vayamos con mucho ánimo,con esperanza,y sin miedo a votar.desde Tijuana,donde nace la patria,apoyando a xochitl galvez yo voté por xochitl xochitl gálvez será la presidenta elecciones en méxico 2024","1","-1","0","0"
"Brenda Caballero","@BrendaC92067594","15:32"," EsClaudiaPresidentaDeMéxico  EleccionesMéxico2024  YaVoté Vamos por Morena!! A Ganar 🥰😉♥️","Claudia será presidenta de México elecciones en méxico 2024 ya voté vamos por morena!!a ganar","0","1","0","0"
"El Tapatío Agrio 🇲🇽","@AgrioTapatio","15:32","chinga tu puta madre Morena  EleccionesMéxico2024  YoVotéPorXochitl  XóchitlGálvezPresidenta  YaSeVanhijos de su puta madre  ","chinga tu puta madre morena elecciones en méxico 2024 yo voté por xochitl xochitl gálvez será la presidenta ya se van los hijos de su puta madre","1","-1","0","0"
"Libertario Morelos","@Antonio58808325","15:31"," YoVotéPorXóchitl  XóchitlGálvezPresidenta  NarcoPresidenteAMLO80  EleccionesMéxico2024 a la verga MORENA","ya voté por xochitl xochitl gálvez será la presidenta narco presidente AMLO elecciones en méxico 2024 a la verga morena","1","-1","0","0"
"Ricardo Ojeda Ramírez 🏈 ✈️🎮 🚘 🐱 🇲🇽🇲🇽🇲🇽","@richarko","15:31","Ya ejerci mi derecho  EleccionesMéxico2024  YoVotéPorXóchitl","ya ejerci mi derecho elecciones en méxico 2024 ya voté por xochitl","1","0","0","0"
"Alix Yuliana","@AlixYuliana8","15:27","Esto es un  fraude 4 horas haciendo fila en el consulado y solo dejan pasar personas de 60+ a votar porque saben que son los únicos que votan por la mierda de morena  fueramorena  EleccionesMéxico2024  XóchitlGálvezPresidenta","esto es un fraude 4 horas haciendo fila en el consulado y solo dejan pasar personas de 60 a votar porque saben que son los únicos que votan por la mierda de morena fuera MORENA elecciones en méxico 2024 xochitl gálvez será la presidenta","1","-1","0","0"
"Iván M.","@NavimoOfoO","15:26","Ya vote  EleccionesMéxico2024  EsClaudiaPresidentaDeMéxico  ClaudiaPresidentaDeMéxico2024 😀","ya vote elecciones en méxico 2024 Claudia será presidenta de México claudia será la siguiente presidenta de méxico en 2024","0","1","0","0"
"Hiram Mendoza","@JHMendozza","15:24","Yo si cumplí  EleccionesMéxico2024  XochitlGálvezPresidente24","yo si cumplí elecciones en méxico 2024 xochitl galvez presidenta 2024","1","0","0","0"
"Ricardito","@RicarditoAnaya","15:22","Mi voto fue por Xóchitl Gálvez  XochitlGálvezPresidenta  EleccionesMéxico2024","mi voto fue por xochitl galvez xochitl gálvez será la presidenta elecciones en méxico 2024","1","0","0","0"
"Iñaki Levy","@ElPoderdelaInfo","15:22","¡LISTO! Vota Todo Morena 😏👍 Ahora sí, vamos por el plan c apoyado por Claudia, desde el PREP se verá el avasallador Triunfo de  ClaudiaPresidentaDeMéxico ¡Viva MÉXICO! 🇲🇽 Y VIVA el segundo piso de la 4ta Transformación 👏😃  EleccionesMéxico2024","¡listo!vota todo morena ahora sí,vamos por el plan c apoyado por claudia,desde el PREP se verá el avasallador triunfo de Claudia será presidenta de México¡viva méxico!y viva el segundo piso de la 4ta transformación 4ta Transformación elecciones en méxico 2024","0","1","0","0"
"David Contreras","@daco_eli","15:21"," EsClaudiaPresidentaDeMéxico  EleccionesMéxico2024","Claudia será presidenta de México elecciones en méxico 2024","0","1","0","0"
"Antigansoganso","@antigansoganso","15:21","Adiós a Todo Morena  CHASPM  EleccionesMéxico2024  CuentenleBien  CuentenleBien  XóchitlGálvezPresidenta","adiós a todo morena chingue su puta madre elecciones en méxico 2024 cuéntenle bien cuéntenle bien xochitl gálvez será la presidenta","1","-1","0","0"
"Alondra Álvarez","@alvarez_al98","15:20"," EleccionesMéxico2024  VotoPorMéxico  XóchitlGálvezPresidenta","elecciones en méxico 2024 voto por méxico xochitl gálvez será la presidenta","1","0","0","0"
"Fernando","@Fernand06932502","15:19"," Plan_C va  EleccionesMéxico2024  Ya_Gano_Claudia","plan C va elecciones en méxico 2024 ya ganó Claudia","0","1","0","0"
"Federico Steck","@Fedsteck","15:19","Amor con amor se paga.  EleccionesMéxico2024 @claudia sheinbaum  ClaudiaArrasará  ClaudiaPresidentaDeMéxico","amor con amor se paga.elecciones en méxico 2024 claudia sheinbaum Claudia arrasará en las votaciones Claudia será presidenta de México","0","1","0","0"
"Sir Blacksea 🇲🇽","@blacksea777","15:19","LISTO!!!  XochitlGálvezPresidenta24  EleccionesMéxico2024  YoYaVotéPorXochitl","listo!!!xochitl galvez presidenta 2024 elecciones en méxico 2024 yo ya voté por xochitl","1","0","0","0"
"Miguel Blanco","@Lord_Blanco","15:18","Llevaba 6 años esperando el 02 de Junio. @Pepe_Yunes Gobernador de  Veracruz  EleccionesMéxico2024  XóchitlGálvezPresidenta","llevaba 6 años esperando el 02 de junio.pepe_yunes gobernador de Veracruz elecciones en méxico 2024 xochitl gálvez será la presidenta","1","0","0","0"
"Fachito","@der_yveltal","15:14","Ya cumplí con mis obligaciones de joto panista. Votar al PAN tiene doble efecto: Mandar al carajo a MORENA y hacer berrear a los maricones.  EleccionesMéxico2024","ya cumplí con mis obligaciones de joto panista.votar al PAN tiene doble efecto:mandar al carajo a morena y hacer berrear a los maricones.elecciones en méxico 2024","1","-1","0","0"
"Cams","@cams_87","15:13","Hoy digo con todo orgullo, vote por Morena. En 2018 voté con incertidumbre, hoy con toda la confianza, gracias Presidente @Lopez Obrador_ Carro completo para Morena, se necesitan las reformas a la SCJN, quitar los plurinominales y dinero a los partidos.","hoy digo con todo orgullo,vote por morena.en 2018 voté con incertidumbre,hoy con toda la confianza,gracias presidente Lopez Obrador_ carro completo para morena,se necesitan las reformas a la scjn,quitar los plurinominales y dinero a los partidos.","0","1","0","0"
"cristianarciniega","@xtianarciniega","15:12","VOTE POR LA VIDA, LA LIBERTAD Y LA VERDAD. ¡QUE MUERA EL MAL GOBIERNO! ¡VIVA MÉXICO Y VIVA LA DEMOCRACIA!  EleccionesMéxico2024  XóchitlGálvezPresidenta","vote por la vida,la libertad y la verdad.¡que muera el mal gobierno!¡viva méxico y viva la democracia!elecciones en méxico 2024 xochitl gálvez será la presidenta","1","0","0","0"
"ÅTR 👁️","@atrosiles","15:12","Listo. Qué continúe la 'dictadura', que nuestro país sea  CubazuelaDelNorte  MéxicoreazuelaDelNorte 🙃🙃🙃🙃🙃🙃🙃🙃🙃  claudia sheinbaumbaumPresidenta  EleccionesMéxico2024","listo.qué continúe la dictadura,que nuestro país sea cubazueladelnorte México Corea del Norte Claudia Sheinbaum presidenta elecciones en méxico 2024","0","1","0","0"
"Didier","@cinenproceso","15:10","Ya se votó, ojalá pierda Claudia, ojalá pierda Xochitl, ojalá nunca hubiera existo la opción de Máynez. Más que nunca, unas elecciones donde se siente que el único que pierde es México, somos nosotros.  EleccionesMéxico2024","ya se votó,ojalá pierda claudia,ojalá pierda xochitl,ojalá nunca hubiera existo la opción de maynez.más que nunca,unas elecciones donde se siente que el único que pierde es méxico,somos nosotros.elecciones en méxico 2024","-1","-1","1","0"
"Ecoco","@e_co_c","15:10"," XóchitlGálvezPresidenta  EleccionesMéxico2024  YoVotéPorXóchitl @XochitlGalvez 🇲🇽💓🗳️","xochitl gálvez será la presidenta elecciones en méxico 2024 ya voté por xochitl xochitl galvez","1","0","0","0"
"Ana Karen","@anakareenmv","15:06"," YoVotéPorXochitl 🩷 por el derecho a la democracia !! Por dejarle a mi hija un país de libertad !! 🇲🇽  EleccionesMéxico2024 vamos por la Victoria✨🤞🏻  XochitlGálvezPresidenta","yo voté por xochitl por el derecho a la democracia!!por dejarle a mi hija un país de libertad!!elecciones en méxico 2024 vamos por la victoria xochitl gálvez será la presidenta","1","0","0","0"
"Osmar Méndez","@OsmarMendez33","15:05"," EleccionesMéxico2024 @claudia sheinbaum","elecciones en méxico 2024 claudia sheinbaum","0","1","0","0"
"CaribeñoJarocho🤠","@dramirezosorio","15:03","Que siga la transformacion!  EleccionesMéxico2024","que siga la transformacion!elecciones en méxico 2024","0","1","0","1"
"Yuseb Yong","@YusebYong","15:03","Sin importar dónde ande o las 3 horas para votar, pero cumpliendo con México  EleccionesMéxico2024  YoVotéPorXochitl","sin importar dónde ande o las 3 horas para votar,pero cumpliendo con méxico elecciones en méxico 2024 yo voté por xochitl","1","0","0","0"
"Austin peligro powers","@VVarvi","15:01"," XóchitlGálvezPresidenta  EleccionesMéxico2024  YaVoté","xochitl gálvez será la presidenta elecciones en méxico 2024 ya voté","1","0","0","0"
"david zarco","@davidza81580651","15:01"," EleccionesMéxico2024 plan c apoyado por Claudia SI O SI","elecciones en méxico 2024 plan c apoyado por claudia si o si","0","1","0","0"
"Ulises Rodríguez 🇵🇸","@ulisesrguezlo","15:36","Listo mi voto por un México de derechos y no de derechas  EleccionesMéxico2024  EsClaudiaPresidentaDeMéxico","listo mi voto por un méxico de derechos y no de derecha elecciones en méxico 2024 Claudia será presidenta de México","0","1","0","0"
"JC NINJA","@Cmargon_30","15:58","En respuesta a @xochitl  YoVotéPorXóchitl","en respuesta a xochitl ya voté por xochitl","1","0","0","0"
"Mora(:™","@Moritaah","15:58"," YoVotéPorXochitl  EleccionesMéxico2024 vayan a votar 👏🇲🇽☑️","yo voté por xochitl elecciones en méxico 2024 vayan a votar","1","0","0","0"
"Roberto","@Bet0o0o0_","15:57"," YoVotéPorXochitl","yo voté por xochitl","1","0","0","0"
"🇲🇽Fofonauta 𝕏 🇲🇽","@Fofonauta_","15:56","Respondiendo a @la_grenitas @EPN_GobFederal y 2 más Mi voto es libre pero no secreto! Venga XOCHITL!! @XochitlGalvez  XochitlGálvezPresidenta24  YoVotéPorXochitl","respondiendo a la_grenitas epn_gobfederal y 2 más mi voto es libre pero no secreto!venga xochitl!!xochitl galvez xochitl galvez presidenta 2024 yo voté por xochitl","1","0","0","0"
"Valen🖤","@AnaValenH","15:54"," YoVotéPorXochitl 💙💙💙💙💙","yo voté por xochitl","1","0","0","0"
"Daniel Poot","@danilopoot","15:54","En respuesta a @xochitl  YoVotéPorXochitl","en respuesta a xochitl yo voté por xochitl","1","0","0","0"
"LaPao","@es_tu_pen_do15","15:53","En respuesta a @xochitl  YoVotéPorXóchitl","en respuesta a xochitl ya voté por xochitl","1","0","0","0"
"Libertario Morelos","@Antonio58808325","15:51","En respuesta a @claudia sheinbaum Viva  XóchitlGálvezPresidenta  YoVotéPorXochitl","en respuesta a claudia sheinbaum viva xochitl gálvez será la presidenta yo voté por xochitl","1","-1","0","0"
"Luis Salas","@LuisSal99212937","15:51","En respuesta a @xochitl  YoVotéPorXochitl","en respuesta a xochitl yo voté por xochitl","1","0","0","0"
"Elsa Torres","@ElsaYTorres","15:50"," EleccionesMéxico2024  YoVotéPorXóchitl","elecciones en méxico 2024 ya voté por xochitl","1","0","0","0"
"Allan Colin 🇲🇽🇺🇦🇮🇱 (+) Cruz Azul + LA Rams","@AllanColin_","15:49","En respuesta a @xochitl Desde temprano.  YoVotéPorXochitl","en respuesta a xochitl desde temprano.yo voté por xochitl","1","0","0","0"
"Nino Ramirez","@DrJamons","15:48","En respuesta a @xochitl Obvio!  YoVotéPorXochitl","en respuesta a xochitl obvio!yo voté por xochitl","1","0","0","0"
"Liliana","@Yo_Soy_Lore","15:47","En respuesta a @lialimon  YoVotéPorXóchitl y aunque mis hijos ya no viven conmigo, solicité evidencia.","en respuesta a lialimon ya voté por xochitl y aunque mis hijos ya no viven conmigo,solicité evidencia.","1","0","0","0"
"More Sanvel ✖️","@jsv_more","15:46","En respuesta a @Marcela_Feraud  yovotéporxóchitl","en respuesta a marcela_feraud ya voté por xochitl","1","-1","0","0"
"Santos en Abonos!","@af_Maldonado","15:46","En respuesta a @ryo_hermoso De Guanajuato, cumplido  YoVotéPorXochitl","en respuesta a ryo_hermoso de guanajuato,cumplido yo voté por xochitl","1","0","0","0"
"Estephania Martinez","@PhanieMacs","15:44","En respuesta a @xochitl  YoVotéPorXochitl  XoxhitlGálvezPresidente2024","en respuesta a xochitl yo voté por xochitl xochitl galvez presidenta 2024","1","0","0","0"
"Chivis 🦂🫰💟 OZ👑","@Chivis_palas","15:44","En respuesta a @xochitl  XóchitlGálvezPresidenta  YoVotéporXochitl  BonillaAlcaldeCUU","en respuesta a xochitl xochitl gálvez será la presidenta yo voté por xochitl bonilla alcalde cuu","1","0","0","0"
"Jaime Guevara.","@cucebrio1","15:43","Prometieron todo y cumplieron nada por eso  YaSeVanHDSCHM, corruptos morenistas.  YoVotéPorXochitl  XóchitlGálvezPresidenta  EleccionesMéxico2024  Jalisco","prometieron todo y cumplieron nada por eso ya se van los hijos de su chingada madre,corruptos morenistas.yo voté por xochitl xochitl gálvez será la presidenta elecciones en méxico 2024 Jalisco","1","-1","0","0"
"Luis Alberto García Santamaría","@LuisGarciaAlS","15:43"," YoVotéPorXochitl  VotaPorMéxico  Toluca  YoVoteporMelissaVargas 🫶🏽💯❤️✋🏽🇲🇽","yo voté por xochitl voto por méxico Toluca yo voté por Melissa Vargas","1","0","0","0"
"Elma Rodriguez","@ElmaElmary7","15:43","En respuesta a @xochitl  YoVotePorXochitl","en respuesta a xochitl yo voté por xochitl","1","0","0","0"
"victor manuel","@victorm29670598","15:42"," YoVotéPorXóchitl","ya voté por xochitl","1","0","0","0"
"Kari Gc","@KarinaC09873448","15:42","En respuesta a @ryo_hermoso  YoVotéPorXochitl  XochitlGálvezPresidenta24","en respuesta a ryo_hermoso yo voté por xochitl xochitl galvez presidenta 2024","1","0","0","0"
"Francisco Rodriguez","@frrodriguezm","15:42"," YoVotéPorXochitl  XochitlGálvezPresidente24","yo voté por xochitl xochitl galvez presidenta 2024","1","0","0","0"
"Lalo Salamanca","@LaloSal92","15:41","En respuesta a @xochitl  YoVotéPorXochitl  XochitlGálvezPresidenta Imagen","en respuesta a xochitl yo voté por xochitl xochitl gálvez será la presidenta imagen","1","0","0","0"
"pablolayseca","@pablolayseca","15:40"," YoVotéPorXochitl  XochitlGálvezPresidenta  XochitlYaGano","yo voté por xochitl xochitl gálvez será la presidenta xochitl ya ganó","1","0","0","0"
"Deejay Diego 𝕏","@DJD_EGO","15:40"," YoVotéPorXochitl a mucha honra","yo voté por xochitl a mucha honra","1","0","0","0"
"Ana Limon","@anamlimon","15:40","@xochitl Desde Hermosillo 🩷  xochitlpresidenta2024  YoVotéPorXochitl","xochitl desde hermosillo xochitl presidenta yo voté por xochitl","1","0","0","0"
"Máximo","@MXmoDecimo","15:39"," YoVotéPorXochitl Xóchitl te llevaremos a la victoria!","yo voté por xochitl xochitl te llevaremos a la victoria!","1","0","0","0"
"jafa","@jafa_sabinas","15:37"," YoVotéPorXóchitl","ya voté por xochitl","1","0","0","0"
"José Rubén irvin García tienda","@JosRubnirvinGa1","15:36"," YoVotéPorXochitl  HoyVotoPorXóchitl  yoyavoteporxochilt  FuerzaYCorazonXMéxico  MxSinMiedoYConX  XoxhitlGálvezPresidente24","yo voté por xochitl hoy voto por xochitl yo ya vote por xochitl fuerza y corazón por México méxico sin miedo y con xochitl xochitl galvez presidenta","1","0","0","0"
"Anthonio Sánchez","@antho27","15:36"," YoVotéPorXochitl  XochiltlGálvezPresidenta  EleccionesMéxico2024 Fuera Morena, fuera Claudia, fuera la 4T","yo voté por xochitl xochitl galvez presidenta elecciones en méxico 2024 fuera morena,fuera claudia,fuera la 4ta transformación","1","-1","0","0"
"Jesus Hector Ruiz G.","@JesusHectorRuiz","15:36"," YoVotéPorXóchitl","ya voté por xochitl","1","0","0","0"
"Luis Enrique Saucedo","@luisesaucedo2","15:35"," XóchitlGálvezPresidenta,  YoVotéPorXochitl,  MareaRosaConXóchitl","xochitl gálvez será la presidenta,yo voté por xochitl,marea rosa con xochitl","1","0","0","0"
"Juan Rey","@juan_rey_","15:35"," YovoteporXochitl 🇲🇽","yo voté por xochitl","1","0","0","0"
"yolanda","@Yolis2626","15:35"," YoVotéPorXóchitl","ya voté por xochitl","1","0","0","0"
"APL65","@APL652","15:34"," XochitlYaGanó  YoVotéPorXochitl","xochitl ya ganó yo voté por xochitl","1","0","0","0"
"Maru Jimenez ❌","@MaruJimenez16","15:33"," YoVotePorXochitl ❌🇲🇽🗳️🤞  XochitlGálvezPresidenta24 🙏🏼🥳🥳","yo voté por xochitl xochitl galvez presidenta 2024","1","0","0","0"
"Monset🌻💅🏼👠💥","@FerMond20","15:33","En respuesta a @gloaeza  YoVotéPorXochitl vamos México 🇲🇽","en respuesta a gloaeza yo voté por xochitl vamos méxico","1","0","0","0"
"Aida Saucedo","@AidaSaucedoG","15:33","En respuesta a @xochitl  YoVotéPorXóchitl  XochitlGálvezPresidenta","en respuesta a xochitl ya voté por xochitl xochitl gálvez será la presidenta","1","0","0","0"
"↠ Di ↞ ⠕","@Niaa89","15:32","Muy conmovida de votar por primera vez por una mujer para la presidencia de México… y más por @XochitlGalvez  YoVotéPorXóchitl","muy conmovida de votar por primera vez por una mujer para la presidencia de méxico y más por xochitl galvez ya voté por xochitl","1","0","0","0"
"Emanuel Vázquez Díaz","@EmanuelVD88","15:32","En respuesta a @xochitl  YoVotéPorXochitl","en respuesta a xochitl yo voté por xochitl","1","0","0","0"
"Eddo2822","@Eddo289","15:32","En respuesta a @xochitl  YoVotéPorXochitl","en respuesta a xochitl yo voté por xochitl","1","0","0","0"
"monica moreno","@monchismoreno","15:31"," YoVotéPorXochitl","yo voté por xochitl","1","0","0","0"
"jodon 3.0 🇲🇽","@XavierDeRu","15:31","En respuesta a @xochitl  YoVotéPorXochitl","en respuesta a xochitl yo voté por xochitl","1","0","0","0"
"K. Abugaber","@karim_85","15:30"," YoVotéPorXochitl","yo voté por xochitl","1","0","0","0"
"Roberto Solcar Guerrero 💰💵💰💵","@RobertoSolcar","15:30","En respuesta a @xochitl  XochitlGalvezPresidenta  YoVotéPorXóchitl","en respuesta a xochitl xochitl gálvez será la presidenta ya voté por xochitl","1","0","0","0"
"𝐅𝐫𝐚𝐧𝐜𝐢𝐬𝐜𝐨 𝐀́𝐥𝐯𝐚𝐫𝐞𝐳","@fjalvareztellez","15:29"," YoVotéPorXóchitl","ya voté por xochitl","1","0","0","0"
"Roberto Sandoval.","@Robertooo75","15:28"," YoVotéPorXóchitl","ya voté por xochitl","1","0","0","0"
"Macaflo","@Marcastattoo","15:26","En respuesta a @xochitl  yovotéporxóchitl","en respuesta a xochitl ya voté por xochitl","1","0","0","0"
"Te vale ver...","@ellteb","15:25"," VotaMéxico2024 Fuera Morena. Hace 6 años voté por ellos, no vuelvo a cometer el mismo error  YoVotéPorXochitl  EleccionesMéxico2024","vota méxico 2024 fuera morena.hace 6 años voté por ellos,no vuelvo a cometer el mismo error yo voté por xochitl elecciones en méxico 2024","1","-1","0","0"
"ohmlixyss","@Lixyss","15:25","En respuesta a @xochitl  XochitlGálvezPresidenta 💗🇲🇽💗  YoVotéPorXochitl 💗🫰","en respuesta a xochitl xochitl gálvez será la presidenta yo voté por xochitl","1","0","0","0"
"Alex del Cardo","@AlexVS8379","15:24","Voto y barbacoa con la criatura que le tocó votar por primera vez  YoVotéPorXochitl  XoxhitlGálvezPresidente2024","voto y barbacoa con la criatura que le tocó votar por primera vez yo voté por xochitl xochitl galvez presidenta 2024","1","0","0","0"
"LUIS ANGEL GARCIA","@luisangelgh","15:24","En respuesta a @JackSpartanXX  YoVotéPorXochitl","en respuesta a jackspartanxx yo voté por xochitl","1","0","0","0"
"Lizeth Revueltas 🇲🇽💜🔮🎶","@lizethrevueltas","15:24"," YoVotéPorXóchitl con PRD por @acostanaranjo porque fue quien más la apoyo.  XóchitlGálvezPresidenta","ya voté por xochitl con PRD por acostanaranjo porque fue quien más la apoyo.xochitl gálvez será la presidenta","1","0","0","0"
"LUIS ANGEL GARCIA","@luisangelgh","15:23","En respuesta a @xochitl  YoVotéPorXochitl","en respuesta a xochitl yo voté por xochitl","1","0","0","0"
"LUIS ANGEL GARCIA","@luisangelgh","15:22","En respuesta a @DiazGonzalo55  YoVotéPorXochitl","en respuesta a diazgonzalo55 yo voté por xochitl","1","0","0","0"
"La Plebada y unos cuates","@LaPlebada2022","15:21"," YoVotéPorXóchitl","ya voté por xochitl","1","0","0","0"
"Robert ApLe","@robertocarlosap","15:20"," YoVotéPorXóchitl","ya voté por xochitl","1","0","0","0"
"Cocó Lara","@jclarar","15:20","Que orgullo!!!  YoVotéPorXóchitl","que orgullo!!!ya voté por xochitl","1","0","0","0"
"Danituarte","@danituarte","15:19"," YoVotéPorXochitl","yo voté por xochitl","1","0","0","0"
"Malula X 📌","@Malusilver","15:19","Después de casi dos horas de fila en la casilla 4881 de Cdmx, voté a las 11.50 am. Mis respetos a los funcionarios de casilla 🙌🏻.  EleccionesMéxico2024","después de casi dos horas de fila en la casilla electoral 4881 de Ciudad de México,voté a las 11.50 am.mis respetos a los funcionarios de casilla electoral.elecciones en méxico 2024","0","0","0","1"
"SERCHS CALLEJA","@FESSUYCA","15:18","Por ❌ochitl Por Me❌ico  YoVotéPorXóchitl Por la E❌peranza de un Mejor MEXICO","por xochitl por me ico ya voté por xochitl por la e peranza de un mejor méxico","1","0","0","0"
"Yo nomás","@de_sangrenueva","15:18"," YoVotéPorXochitl  EleccionesMéxico2024","yo voté por xochitl elecciones en méxico 2024","1","0","0","0"
"Jose Luis Vazquez","@luis7126","15:15","@AtypicalTeve ya votamos que gane México  YoVotéPorXochitl @xochitl @XochitlGalvez","atypicalteve ya votamos que gane méxico yo voté por xochitl xochitl xochitl galvez","1","0","0","0"
"Ni te topo!","@garo1971","15:14","En respuesta a @DiazGonzalo55 Diferenciado pero  YoVotéPorXochitl","en respuesta a diazgonzalo55 diferenciado pero yo voté por xochitl","1","0","0","0"
"Merobiba ✨","@Wendycac","15:13"," YoVotéPorXóchitl","ya voté por xochitl","1","0","0","0"
"Carmen","@carmen_baca","15:13"," YoVotéPorXóchitl","ya voté por xochitl","1","0","0","0"
"ErikaFG","@ErikaFG11","15:13","En respuesta a @ryo_hermoso Desde el Estado de México  YoVotéPorXochitl","en respuesta a ryo_hermoso desde el estado de méxico yo voté por xochitl","1","0","0","0"
"𝑨𝒏𝒅𝒚𝑫𝑺 🇲🇽","@Andrea_DS15","15:12"," YoVotePorXóchitl 🩷  XóchitlGálvezPresidenta 🩷  EleccionesMéxico2024","yo voté por xochitl xochitl gálvez será la presidenta elecciones en méxico 2024","1","0","0","0"
"Dr. J. Eduardo Freyre.","@DocFreyre","15:12"," YoVotéPorXóchitl  XochitlGálvezPresidenta  EleccionesMéxico2024","ya voté por xochitl xochitl gálvez será la presidenta elecciones en méxico 2024","1","0","0","0"
"Blanca Corona","@lyza500","15:12"," YoVotéPorXóchitl","ya voté por xochitl","1","0","0","0"
"HLB","@DrummAvariuM","15:11","¡Vida, verdad, libertad! 💙 X  YoVotéPorXóchitl","¡vida,verdad,libertad!x ya voté por xochitl","1","0","0","0"
"Cédric Lamouche","@cedriclamouche","15:09"," YoVotéPorXochitl","yo voté por xochitl","1","0","0","0"
"Eric Medher","@medheric_19","15:08","Listo, ya hice mi parte @XochitlGalvez @xochitl Ahora a esperar para que usted haga la suya... No nos vaya a fallar por favor!!!  YoVotéPorXóchitl Todo 🔵⚪","listo,ya hice mi parte xochitl galvez xochitl ahora a esperar para que usted haga la suya...no nos vaya a fallar por favor!!!ya voté por xochitl todo","1","0","0","0"
"el muchacho de los ojos tristes","@DecemberBoy12","15:07","Hermanitos Mexicanos, sí podemos!! 🫶🏻🇲🇽🩷 @XochitlGalvez  XochitlGálvezPresidenta  YoVotéPorXóchitl","hermanitos mexicanos,sí podemos!!xochitl galvez xochitl gálvez será la presidenta ya voté por xochitl","1","0","0","0"
"(((Crysthal07)))🎙🎧","@crysthal07","15:07"," YoVotéPorXóchitl","ya voté por xochitl","1","0","0","0"
"Beatriz","@Beatriz06057268","15:06"," YoVotéPorXochitl","yo voté por xochitl","1","0","0","0"
"Aniv de la Rev","@Aniv_Delarev0","15:06","Todos mis votos fueron para el PAN a excepción del voto para presidente. Crucé con mucho gusto por el PRD en agradecimiento a Don @acostanaranjo, quien le puso particular interés a la campaña. 👏🏼👏🏼👏🏼👏🏼👏🏼👏🏼👏🏼👏🏼👏🏼👏🏼👏🏼  YoVotéPorXochitl","todos mis votos fueron para el PAN a excepción del voto para presidente.crucé con mucho gusto por el PRD en agradecimiento a don acostanaranjo,quien le puso particular interés a la campaña.yo voté por xochitl","1","0","0","0"
"Nahomy HG","@HurtNahomy","15:04"," YoVotéPorXochitl  EleccionesMéxico2024 Mi flaquito y yo ya votamos","yo voté por xochitl elecciones en méxico 2024 mi flaquito y yo ya votamos","1","0","0","0"
"Xris","@xstian_m","15:04","Adiós a los Narco delincuentes de  morenadestruyendoaméxico  EleccionesMéxico2024  XóchitlGálvezPresidenta  YoVotéPorXochitl","adiós a los narcotraficante delincuentes de MORENA destruye a México elecciones en méxico 2024 xochitl gálvez será la presidenta yo voté por xochitl","1","-1","0","0"
"Bren O","@brendao001","15:02","En respuesta a @xochitl  YoVotePorXochitl","en respuesta a xochitl yo voté por xochitl","1","0","0","0"
"Ivan Castillo","@kasino776","15:59","Mi voto siempre por la izquierda y para dos mexicanas excepcionales @AndreaChavezTre y @claudia sheinbaum  planc  ClaudiaArrasará  claudia sheinbaumbaum 🫶🏾 🇲🇽","mi voto siempre por la izquierda y para dos mexicanas excepcionales andreachaveztre y claudia sheinbaum plan C Claudia arrasará en las votaciones Claudia Sheinbaum","0","1","0","0"
"Maikol","@FematMichel","15:59","Se votó!… MORENA de lado a lado!… 👊🏽  ClaudiaPresidentaDeMéxico2024  ClaudiaArrasará  MORENA2024","se votó!morena de lado a lado!claudia será la siguiente presidenta de méxico en 2024 Claudia arrasará en las votaciones MORENA","0","1","0","0"
