num_debate,canal,username,fecha,comentario,num_likes,comentario_editado,Claudia,Maynez,Ninguno,Xóchitl,topic
3,excelsior,enriquecarreon7974,19/05/2024,Maynes tiene muy buenas propuesta y nadie esta hablando de ello solo por que no es de morena  Como ciudadanos tenemos que ver y poner en balanza que es lo que nos conviene no nada maa por que sea de more o pri o pan o vamos a volver a caer como en el pasado,33,maynez tiene muy buenas propuesta y nadie esta hablando de ello solo por que no es de morena como ciudadanos tenemos que ver y poner en balanza que es lo que nos conviene no nada maa por que sea de more o pri representado por xochitl o PAN o vamos a volver a caer como en el pasado,0,0,0,-1,-1
3,excelsior,mariadelcarmenhernandez8365,19/05/2024,"Jajaja ameee el letrero de miente , aunque ella no es blanca paloma ,ya vamos por Maynez",0,"jajaja ameee el letrero de miente,aunque ella no es blanca paloma,ya vamos por maynez",-1,1,0,-1,-1
3,excelsior,gloriaflores4683,19/05/2024,Mi hijo esta en una escuela privada no xq nosotros tenemos es mi esposo que se esta fregando a trabajar xq segun no paso el examen para entrar en una escuela pública xq para entrar tienes que dar mochada,0,mi hijo esta en una escuela privada no porque nosotros tenemos es mi esposo que se esta fregando a trabajar porque segun no paso el examen para entrar en una escuela pública porque para entrar tienes que dar mochada,0,0,-1,0,19
3,excelsior,perlafonseca5309,19/05/2024,Los plurinominales son personas alos que se les da un pago que es desperdiciado...,47,los plurinominales son personas a lo que se les da un pago que es desperdiciado...,0,0,-1,0,-1
3,excelsior,marimaldonado9753,19/05/2024,"Lo que nuestro país necesita es mucho empleo y realmente más especialidades en los hospitales de gobierno.. es triste lo que dejaron los gobiernos pasando. Hace nueve años mi hermana tenía programado para una cirugía en hospital de gobierno y no tenían insumos para la cirugía . Y en este año mi padre estuvo de gravedad, y también fue atendido el hospital de gobierno... Pero quedé muy agradecida porque nos dieron un servicio extraordinario, medicamentos no gastamos nada en medicamentos. Es ahí donde uno como pueblo ve con sus propios ojos el cambio de  el gobierno.. agradecida por que hoy mi padre está con vida..",59,"lo que nuestro país necesita es mucho empleo y realmente más especialidades en los hospitales de gobierno..es triste lo que dejaron los gobiernos pasando.hace nueve años mi hermana tenía programado para una cirugía en hospital de gobierno y no tenían insumos para la cirugía.y en este año mi padre estuvo de gravedad,y también fue atendido el hospital de gobierno...pero quedé muy agradecida porque nos dieron un servicio extraordinario,medicamentos no gastamos nada en medicamentos.es ahí donde uno como pueblo ve con sus propios ojos el cambio de el gobierno..agradecida por que hoy mi padre está con vida..",1,0,0,-1,23
3,excelsior,miriamzamara5567,19/05/2024,Xochil ni sabe donde están los viñedos  y asi piensa ayudar a ensenada,0,xochitl ni sabe donde están los viñedos y así piensa ayudar a ensenada,0,0,0,-1,-1
3,excelsior,claratellez,19/05/2024,En el estado de México no apoyo de vivienda y tampoco hay medicamentos ni médicos en los centros de salud,0,en el estado de méxico no apoyo de vivienda y tampoco hay medicamentos ni médicos en los centros de salud,-1,0,0,0,25
3,excelsior,amandaespinosa5153,19/05/2024,Pq no preguntaron a la candidata Xochilt sobre el secuestro q hizo su hna q esta en prisión como reina q diga algo sobre lo q hizo,9,porque no preguntaron a la candidata xochitl sobre el secuestro que hizo su hna que esta en prisión como reina que diga algo sobre lo que hizo,0,0,0,-1,11
3,excelsior,rosaiselaperezhernandez6358,19/05/2024,"Xochil, cual vivienda, si tu lo dijiste, que a los 60años no tienes casa propia es por pdjo. Que peleas si tu casa vale 9 millones de pesos,",35,"xochitl,cual vivienda,si tu lo dijiste,que a los 60años no tienes casa propia es por pdjo.que peleas si tu casa vale 9 millones de pesos,",0,0,0,-1,-1
3,excelsior,EstebanMora-vh1id,19/05/2024,Eso es verdad lo que dice MAYNEZ no nos reconozcan a los que vivimos en U.S.A. a mi me qudaron a deber 2000 dolares deldeposito de un carro que lleve a MEXICO se robaron mi dinero y a muchos mas hay mucho que decir sobre ese asunto,0,eso es verdad lo que dice maynez no nos reconozcan a los que vivimos en u.s.a.a mi me qudaron a deber 2000 dolares deldeposito de un carro que lleve a mexico se robaron mi dinero y a muchos más hay mucho que decir sobre ese asunto,0,1,0,0,1
3,excelsior,oscarmauriciomayorgahidalg9543,19/05/2024,"Sin duda hermanos mexicanos, tienen q elegir la libertad , tienen la gran oportunidad,  fuera socialista y comunismo, viva México  Saludos desde Chile",0,"sin duda hermanos mexicanos,tienen que elegir la libertad,tienen la gran oportunidad,fuera socialista y comunismo,viva méxico saludos desde chile",-1,0,0,0,1
3,excelsior,mariaelena1110,19/05/2024,Yo votaré por Claudia porque la otra se me hace muy ignorante,69,yo votaré por claudia porque la otra se me hace muy ignorante,1,0,0,-1,2
3,excelsior,gabriellopez4034,19/05/2024,La Botarga sin ninguna propuesta mucho bla bla bla,76,la botarga sin ninguna propuesta mucho bla bla bla,0,0,0,-1,0
3,excelsior,levypalacios5225,19/05/2024,Javier muy buen periodista lo recuerdo mucho cuando estaba en el canal 11. Por el me empezo a gustar el ver las noticias  explica muy bien,0,javier muy buen periodista lo recuerdo mucho cuando estaba en el canal 11.por el me empezo a gustar el ver las noticias explica muy bien,0,0,0,0,29
3,excelsior,rogelioalejo2060,19/05/2024,Yo vivo Estados Unidos en California donde puedo votar?,0,yo vivo estados unidos en california donde puedo votar?,0,0,0,0,2
3,excelsior,tenor90210,19/05/2024,"INCREÍBLE!! EN LOS COMENTARIOS , NADIE APOYA A XOCHITL  , TODOS APOYAN A CLAUDIA SHEINBAUM  , ESTA GENERACIÓN ES MAS INTELIGENTE",49,"increíble!!en los comentarios,nadie apoya a xochitl,todos apoyan a claudia sheinbaum,esta generación es más inteligente",1,0,0,-1,-1
3,excelsior,hinataakome7089,19/05/2024,Cuál derecho de vivienda..uno que trabaja día día.. y justo cuando ya vas a tramitar el Infonavit. .te bajan los puntos.. entonces cual apoyo..,12,cuál derecho de vivienda..uno que trabaja día día..y justo cuando ya vas a tramitar el infonavit..te bajan los puntos..entonces cual apoyo..,-1,0,0,0,-1
3,excelsior,user-vc7po3mw6e,19/05/2024,1:17:52,0,1:17:52,0,0,0,0,5
3,excelsior,simonmorales5149,19/05/2024,"Jeje la de morena repitiendo lo mismo, no tiene vida",1,"jeje la de morena repitiendo lo mismo,no tiene vida",-1,0,0,0,0
3,excelsior,damianavazquez8009,19/05/2024,Desde guerrero lo único que a mi me gustaría es los productos que consumimos baje de precio porque con $2000 no alcanzan,30,desde guerrero lo único que a mi me gustaría es los productos que consumimos baje de precio porque con$2000 no alcanzan,0,0,-1,0,0
3,excelsior,luisruiz-tn1zl,19/05/2024,"El pasado debate XOCHITL, CON CHICHARO, ESTA VEZ TAMBIEN? Porque no la revisan antes de subir al estrado?",37,"el pasado debate xochitl,con chicharo,esta vez tambien?porque no la revisan antes de subir al estrado?",0,0,0,-1,6
3,excelsior,BenjaminJDunn,19/05/2024,Solidaridad con el extraordinario pueblo mexicano,2,solidaridad con el extraordinario pueblo mexicano,0,0,0,0,1
3,excelsior,ethelbalammaldonado495,19/05/2024,Entonces lqs empresas trendrian que subir sus costos lo cual el comprador final tendria que pagar que se genere la fueste de ingreso para sostener a los trabajadores. No se pero espero quien gane con esa propuesta de verdad no se olvide de los emprendedores y claro sin olvidar a los trabajadores es un tema que no deberia tomarse a la ligera solo por ganar votos,0,entonces lqs empresas trendrian que subir sus costos lo cual el comprador final tendria que pagar que se genere la fueste de ingreso para sostener a los trabajadores.no se pero espero quien gane con esa propuesta de verdad no se olvide de los emprendedores y claro sin olvidar a los trabajadores es un tema que no deberia tomarse a la ligera solo por ganar votos,0,0,-1,0,13
3,excelsior,carlosjuan384,19/05/2024,Claudia dice q hay muchos médicos especialista pero de que sirve si no hay medicamentos en todos los hospitales ahí no dice nada de eso,14,claudia dice que hay muchos médicos especialista pero de que sirve si no hay medicamentos en todos los hospitales ahí no dice nada de eso,-1,0,0,0,25
3,excelsior,marthaalicia4506,19/05/2024,Es un honor estar con Claudia hoy,62,es un honor estar con claudia hoy,1,0,0,0,-1
3,excelsior,nahumchavez8395,19/05/2024,"Los Monclovenses no estamos bien mi madre enferma y sin comida mi padre sin trabajo yo en usa lejos.  por que abandonas a los mexicano? s somos tus hijos tambien y te nesesitamos., muchos no sabemos lo que pasa arriba solo nos importa nueseñora familia. El que sigues tu perdona !  Por que tu nos estas dejando morir de apoco?.",0,"los monclovenses no estamos bien mi madre enferma y sin comida mi padre sin trabajo yo en usa lejos.por que abandonas a los mexicano?s somos tus hijos tambien y te nesesitamos.,muchos no sabemos lo que pasa arriba solo nos importa nueseñora familia.el que sigues tu perdona!por que tu nos estas dejando morir de apoco?.",-1,0,0,0,1
3,excelsior,user-pv4zn7gq8l,19/05/2024,No lo negamos que las ayudas económicas para  los adultos mayores son  buenas pero es dinero de nuestros impuestos  no es de su dinero de morena y lo dicen como si fuera de su dinero . La candidata de morena está manipulando  cuando dice que de ellos depende que se de el apoyo como si ellos donarán su dinero . Qué no se te olvide es de nuestros impuestos,3,no lo negamos que las ayudas económicas para los adultos mayores son buenas pero es dinero de nuestros impuestos no es de su dinero de morena y lo dicen como si fuera de su dinero.la candidata de morena está manipulando cuando dice que de ellos depende que se de el apoyo como si ellos donarán su dinero.qué no se te olvide es de nuestros impuestos,-1,0,0,0,35
3,excelsior,elizabethsaldana8753,19/05/2024,Claudia con propuestas tranquila con buenas respuestas y sobre todo con plan de gobierno de desarrollo para México y sus ciudadanos,87,claudia con propuestas tranquila con buenas respuestas y sobre todo con plan de gobierno de desarrollo para méxico y sus ciudadanos,1,0,0,0,1
3,excelsior,FernandoSouza-yk9qo,19/05/2024,"plan c apoyado por Claudia VA POR QUE VA, IGUAL QUE LA PRESIDENTA CLAUDIA SHEINBAUM PARDO Y LA JEFA DE GOBIERNO CLARA BRUGADA EN LA CDMX Y VOTAR TODO MORENA, PT Y VERDE EN TODOS LOS PUESTOS DE ELECCIÓN POPULAR EN LOS ESTADOS DONDE VA A VER SUFRAGIOS Y PUNTO. ️️️️️️🇲🇽️️",45,"plan c apoyado por claudia va por que va,igual que la presidenta claudia sheinbaum pardo y la jefa de gobierno clara brugada en la cdmx y votar todo morena,pt y verde en todos los puestos de elección popular en los estados donde va a ver sufragios y punto.️️️️️️🇲🇽️️",1,0,0,0,18
3,excelsior,user-st9sk6cv9f,19/05/2024,"""Tendrán a una Presidenta con carácter"" Ay Dios, más bien, tendrán a una ignorante",0,"""tendrán a una presidenta con carácter""ay dios,más bien,tendrán a una ignorante",0,0,0,-1,3
3,excelsior,gerardoriveravelazquez7115,19/05/2024,AMI UN HOMBRE NO ME MANDA pues deberia por que no se merece que ella le mande a los hombres,1,a mi un hombre no me manda pues deberia por que no se merece que ella le mande a los hombres,0,0,1,0,10
3,excelsior,MariPerez-iy4dh,19/05/2024,Vamos Claudia tu ganarás,43,vamos claudia tu ganarás,1,0,0,0,8
3,excelsior,marlenemendez742,19/05/2024,Mainez que ha hecho anteriormente por Mexico? que cargos ha tenido antes? que experiencia tiene?,22,maynez que ha hecho anteriormente por mexico?que cargos ha tenido antes?que experiencia tiene?,0,-1,0,0,1
3,excelsior,user-jf1vy1dx4j,19/05/2024,Maynes si no estuviera claudia la mayoria de gente votara x ti.. Todo lo contestaste a la perfección traes muy buenas propuestas eres el que mejor contesto,0,maynez si no estuviera claudia la mayoria de gente votara por ti..todo lo contestaste a la perfección traes muy buenas propuestas eres el que mejor contesto,1,1,0,0,-1
3,excelsior,SvenAxl,19/05/2024,"Xochitl trae muy buenas propuestas pero en ningun momento expone los proyectos para llevar a cabo estas ""propuestas"", por lo que se convierten en promesas vacias",0,"xochitl trae muy buenas propuestas pero en ningun momento expone los proyectos para llevar a cabo estas""propuestas"",por lo que se convierten en promesas vacias",0,0,0,-1,33
3,excelsior,delialuria5606,19/05/2024,Claudia próxima presidenta,47,claudia próxima presidenta,1,0,0,0,3
3,excelsior,gabriellopez4034,19/05/2024,Vamos con el plan c apoyado por Claudia para acabar con el PRIAND,129,vamos con el plan c apoyado por claudia para acabar con el PRIAN,1,0,0,-1,18
3,excelsior,MagyEli-kx2gt,19/05/2024,"Claudia, deja de mentir por un momento! Morena, es un partido de exclusión que no brinda nada para los mexicanos y las mexicanas.  Necesito que piensen por una vez en todos los mexicanos y mexicanas que queremos un México democrático",0,"claudia,deja de mentir por un momento!morena,es un partido de exclusión que no brinda nada para los mexicanos y las mexicanas.necesito que piensen por una vez en todos los mexicanos y mexicanas que queremos un méxico democrático",-1,0,0,0,1
3,excelsior,leojuarez3477,19/05/2024,"Los que fuman marihuana en hidalgo en el zócalo  ,chapultepec ya basta de tanta marihuana eso no se veía antes que ven nuestro niños en la calle con todo lo que vemos en la ciudad  de México.",0,"los que fuman marihuana en hidalgo en el zócalo,chapultepec ya basta de tanta marihuana eso no se veía antes que ven nuestro niños en la calle con todo lo que vemos en la ciudad de méxico.",0,0,-1,0,26
3,excelsior,olivafloresmayorga2973,19/05/2024,"Muy bien Claudia de no caer en suposiciones, es darle el.nivel al debate. No es discutir en un mercado.",60,"muy bien claudia de no caer en suposiciones,es darle el.nivel al debate.no es discutir en un mercado.",1,0,0,0,6
3,excelsior,lizual74,19/05/2024,Aqui el tema no es que gane Claudia si no por cuanta diferencia porque Claudia va a arrasar de una forma increíble,81,aqui el tema no es que gane claudia si no por cuanta diferencia porque claudia va a arrasar de una forma increíble,1,0,0,0,-1
3,excelsior,juanacruzcruz3671,19/05/2024,Quitaron las guarderías porque ellos se quedaban con el dinero,0,quitaron las guarderías porque ellos se quedaban con el dinero,0,0,0,-1,-1
3,excelsior,JosemanuelDominguezpriet-ht4oc,19/05/2024,Por un mexico mas humano justo pacifico democratico.prosperidad progreso bienestar.para los mexicanos.,1,por un mexico más humano justo pacifico democratico.prosperidad progreso bienestar.para los mexicanos.,1,0,0,0,1
3,excelsior,enedinatapia2937,19/05/2024,Ay xochitl Gálvez no te veo en la presidencia de la República mexicana pues tus propuestas no son los que se necesita México . Claudia Sheimbaum será la próxima presidenta de mi bello país MÉXICO. Viva AMLO viva morena viva la 4ta transformación. Viva el plan c apoyado por Claudia,22,ay xochitl galvez no te veo en la presidencia de la república mexicana pues tus propuestas no son los que se necesita méxico.claudia sheinbaum será la próxima presidenta de mi bello país méxico.viva amlo viva morena viva la 4ta transformación.viva el plan c apoyado por claudia,1,0,0,-1,1
3,excelsior,mariaguadalupevalerahuezo1801,19/05/2024,Votaré por Claudia.por el Proyecto y por su persona.,73,votaré por claudia.por el proyecto y por su persona.,1,0,0,0,2
3,excelsior,xeniestra,19/05/2024,"No hubo debate , MAYNEZ  hablo tranquilo diciendo lo que tenia que decir ,JOVEN , pero con mente fresca para nuevas ideas y revolucionar el pais , Xochitl actuo como si fuera AMLO y Claudia fue la edecan que mandaron a abrir la puerta .  estas dos rasguñandose todo el tiempo y a el le dieron carta abierta .   no pues viva mexico",0,"no hubo debate,maynez hablo tranquilo diciendo lo que tenia que decir,joven,pero con mente fresca para nuevas ideas y revolucionar el pais,xochitl actuo como si fuera amlo y claudia fue la edecan que mandaron a abrir la puerta.estas dos rasguñandose todo el tiempo y a el le dieron carta abierta.no pues viva mexico",-1,1,0,-1,1
3,excelsior,josebenitolopezlopez4962,19/05/2024,y que propuso xochitl al final? no entendí,0,y que propuso xochitl al final?no entendí,0,0,0,-1,0
3,excelsior,delialuria5606,19/05/2024,Esta señora no tiene más que decir que de Claudia no puede proponer nada bueno,153,esta señora no tiene más que decir que de claudia no puede proponer nada bueno,0,0,0,-1,-1
3,excelsior,LinaZamora-xs8iw,19/05/2024,Claudia me encanta su sistema emocional una mujer preparada.. inteligente  digna de llevar a México a una mejor generación nuestra nueva generación merece una México mejor que en otras años queremos un México próspero y con Claudia Sheinbaum lo vamos a lograr arriba la candidata de morena mi apoyo para ti..,27,claudia me encanta su sistema emocional una mujer preparada..inteligente digna de llevar a méxico a una mejor generación nuestra nueva generación merece una méxico mejor que en otras años queremos un méxico próspero y con claudia sheinbaum lo vamos a lograr arriba la candidata de morena mi apoyo para ti..,1,0,0,0,-1
3,excelsior,danielasjsmj,19/05/2024,No se dejen llevar solo por los programas sociales! Maynez también lo está proponiendo.,0,no se dejen llevar solo por los programas sociales!maynez también lo está proponiendo.,-1,1,0,0,-1
3,excelsior,dannamichellecesarreyes2448,19/05/2024,No nos conviene que lleguen más personas de otros países y se queden a vivir en México,0,no nos conviene que lleguen más personas de otros países y se queden a vivir en méxico,0,0,-1,0,1
3,excelsior,delialuria5606,19/05/2024,Claudia no esta pidiendo votos se lo vamos a dar  por que nos da la gana,301,claudia no esta pidiendo votos se lo vamos a dar por que nos da la gana,1,0,0,0,2
3,excelsior,carmenarmendariz7344,19/05/2024,"Definitivamente  mi voto para la Dra Sheinbaun..Xochitl no entiende que No hay atacar, los mexicanos queremos propuestas    no  dardos de   ⁰d¡⁰  a su contrincante",46,"definitivamente mi voto para la doctora sheinbaum..xochitl no entiende que no hay atacar,los mexicanos queremos propuestas no dardos de ⁰d¡odio a su contrincante",1,0,0,-1,1
3,excelsior,alejandrofigueroa4970,19/05/2024,Se puso mucho espray en el cabello pará ocultar el chicharo,44,se puso mucho espray en el cabello pará ocultar el chicharo,0,0,0,-1,0
3,excelsior,victorvera9293,19/05/2024,buenas tardes seria bueno que en la frontera se removieran a todo aquel que nos roban el dinero en la aduana y asta te quieren quitqr tu carro sino les das lo que te piden para pasar a tijuana ejemplo si yo pasp um refrigerador usado para mi familia que no tienen tengo  que pagar 3 mil pesos para poder ingresar eso es injusto por eso deberian de poner a gente,0,buenas tardes seria bueno que en la frontera se removieran a todo aquel que nos roban el dinero en la aduana y hasta te quieren quitqr tu carro sino les das lo que te piden para pasar a tijuana ejemplo si yo pasp um refrigerador usado para mi familia que no tienen tengo que pagar 3 mil pesos para poder ingresar eso es injusto por eso deberian de poner a gente,0,0,-1,0,1
3,excelsior,oliviareyesoropeza430,19/05/2024,"En mi concepto, si a esta señora le interesa realmente ganar la presidencia debe tener objetivos y metas claras, como reestructurar una sociedad que clama por por una mejor calidad de vida y una justicia social. XOCHITL  es una persona muy inculta, por ello recurre con frecuencia a la critica, mas que una propuesta.",0,"en mi concepto,si a esta señora le interesa realmente ganar la presidencia debe tener objetivos y metas claras,como reestructurar una sociedad que clama por por una mejor calidad de vida y una justicia social.xochitl es una persona muy inculta,por ello recurre con frecuencia a la critica,más que una propuesta.",0,0,0,-1,4
3,excelsior,jfranco4603,19/05/2024,Botarga permíteme decirte que tienes razón no debieron morir tantas personas si el PRI PAN PRD no hubiera n destituido el sistema de salud,98,botarga permíteme decirte que tienes razón no debieron morir tantas personas si el pri representado por xochitl PAN PRD no hubiera n destituido el sistema de salud,0,0,0,-1,-1
3,excelsior,crismarquez252,19/05/2024,NO SE TRATA DE ATACAR SI NO DE LO QUE PROPONEN ASI QUE XOCHITL POR FAVOR ALO QUE ESTÁ!!,40,no se trata de atacar si no de lo que proponen así que xochitl por favor a lo que está!!,0,0,0,-1,0
3,excelsior,208dany1,19/05/2024,La señora de en medio va a ganar. Asi es mexico. Y el nombre lo trae. Saludos de un salvadoreño desde houston tx.,0,la señora de en medio va a ganar.así es mexico.y el nombre lo trae.saludos de un salvadoreño desde houston tx.,0,0,1,0,1
3,excelsior,LuciaGonzalez-tp1cv,19/05/2024,"Me choca que Xochitl se refiera a Claudia como ""la candidata de las mentiras"" se me hace muy poco ético y se ve mal, sobre todo si aspira a la Presidencia de la República, nada profesional.",0,"me choca que xochitl se refiera a claudia como""la candidata de las mentiras""se me hace muy poco ético y se ve mal,sobre todo si aspira a la presidencia de la república,nada profesional.",0,0,0,-1,-1
3,excelsior,julyrodriguez1923,19/05/2024,xochitl no sabe pronunciar la rrrr  Like si ya diste cuenta,31,xochitl no sabe pronunciar la rrrr like si ya diste cuenta,0,0,0,-1,20
3,excelsior,user-lu2ie9kw9g,19/05/2024,La verdad Cómo tienen participando a alguien que es hermana de una secuestradora No puedo creerlo eso es una vergüenza nacional,21,la verdad cómo tienen participando a alguien que es hermana de una secuestradora no puedo creerlo eso es una vergüenza nacional,0,0,0,-1,11
3,excelsior,flyingroads3498,19/05/2024,sólo maynes por favor. No votes por nadie más. Creo fuertemente que habrá desarrollo y es lo único q necesita México para curarse de todos los males. Desarrollo,0,sólo maynez por favor.no votes por nadie más.creo fuertemente que habrá desarrollo y es lo único que necesita méxico para curarse de todos los males.desarrollo,0,1,0,0,-1
3,excelsior,kit_suki-otak4848,19/05/2024,"La Xóchil esta traumada con la mama del chapo, ahora porque wmpezo hablar como francesa ??",0,"la xochitl esta traumada con la mama del chapo,ahora porque wmpezo hablar como francesa??",0,0,0,-1,20
3,excelsior,CHEPO455,19/05/2024,Porque Maynez ya no sonrie,10,porque maynez ya no sonrie,0,-1,0,0,-1
3,excelsior,trinidadbuenrostro5473,19/05/2024,El infonavit nesesita  una auditoria e inpectores . Para que no se roven los materiales y compacten bien los terrenos y hagan mas grandes las casa no cabe una familia normal,9,el infonavit nesesita una auditoria e inpectores.para que no se roven los materiales y compacten bien los terrenos y hagan más grandes las casa no cabe una familia normal,0,0,0,0,-1
3,excelsior,jeimyperalta9246,19/05/2024,"Este fue sin duda el mejor debate hubiera estado mejor sin xochilt galves, los conductores mucho mejor que los anteriores, aunque debieron correr a xochilt a la primera que saco sus anuncios cuando no estaba hablando ella, haci quiere gobernar? Ya saben lo que nos Espera si votan por la falta de respeto de xochilt",0,"este fue sin duda el mejor debate hubiera estado mejor sin xochitl galvez,los conductores mucho mejor que los anteriores,aunque debieron correr a xochitl a la primera que saco sus anuncios cuando no estaba hablando ella,haci quiere gobernar?ya saben lo que nos espera si votan por la falta de respeto de xochitl",0,0,0,-1,-1
3,excelsior,miguelolmos5278,19/05/2024,Los mexicanos que se van a Estados Unidos buscan el dinero fácil así que no tienen que darse de tanto mérito,0,los mexicanos que se van a estados unidos buscan el dinero fácil así que no tienen que darse de tanto mérito,0,0,-1,0,1
3,excelsior,esauurojas9600,19/05/2024,Parece Que Xochitl esta leyendo teleprompter,17,parece que xochitl esta leyendo teleprompter,0,0,0,-1,-1
3,excelsior,crismarquez252,19/05/2024,JAJAJA LA CARA DE XOCHITL CUANDO mencionó A FOX JAJAJAJA,8,jajaja la cara de xochitl cuando mencionó a fox jajajaja,0,0,0,-1,0
3,excelsior,orlandoisaacmontesdeoca9528,19/05/2024,"Saludos desde Argentina, no voten feminista ni nada de izquierda socialistas , sino pobre México va caer en decadencia",0,"saludos desde argentina,no voten feminista ni nada de izquierda socialistas,sino pobre méxico va caer en decadencia",-1,0,0,0,1
3,excelsior,TheDannieloko,19/05/2024,"2 de junio, lleven sus plumas o sus marcadores, no se dejen engañar por las plumas de ""borrador"" aue tienen en las casillas o que se borran con calor",0,"2 de junio,lleven sus plumas o sus marcadores,no se dejen engañar por las plumas de""borrador""que tienen en las casillas o que se borran con calor",0,0,-1,0,0
3,excelsior,alanestrada3759,19/05/2024,Claudia es la mejor opción!!,46,claudia es la mejor opción!!,1,0,0,0,16
3,excelsior,juangrafia02,19/05/2024,"El no recibir a las mamás que buscan a sus hijos desaparecidos no me parece muy ""humanista"" que digamos Dra. Claudia",7,"el no recibir a las mamás que buscan a sus hijos desaparecidos no me parece muy""humanista""que digamos doctora.claudia",-1,0,0,0,-1
