num_debate,canal,username,fecha,comentario,num_likes,comentario_editado,Claudia,Maynez,Ninguno,Xóchitl,topic
3,nmas,JesusRodriguez-mt8ij,19/05/2024,"Puros ""Chayoteros""",7,riva palacios está orate,1,0,0,0,0
3,nmas,marianapacheco2654,19/05/2024,"xochitl no soporta que es la peor. Por eso insulta con sus graficos. Amé que cada que Maynez la ""atacaba"" ella no sabía ni que decir y mejor se quedaba callada. Qué osolad personas que voten por ella, es la nueva EPN con tanto meme que existe.",1,"me recorde a una persona mayor que conocí cuando estaba iniciando amlo de presidente y me dijo que él estaba alistando a claudia para continuar con su legado y mira,dicho y hecho parece que así será...",1,0,0,0,3
3,nmas,AlfredoLopez-zd3df,19/05/2024,"Porque silenciaron el programa, no se escuchan.",0,xochitl quedo como,0,0,0,1,0
3,nmas,tessypinelo2167,19/05/2024,"Los datos de Claudia falsos, mostró nuevamente que es una persona soberbia y autoritaria.",14,es un desperdicio estar viéndolos!que obsesión traen contra calderon!acepten por una vez la desastrosa realidad del país!,-1,-1,-1,-1,-1
3,nmas,axelamm,19/05/2024,Riva palacios está orate,3,"sigue sin cambiar mi top de mejores candidatos a la presidencia.1-claudia 2-maynez 3-xochitl los que no ven que tipo de persona seria xochitl si gobernara méxico,operense lo ojos porfavor.",1,-1,0,-1,1
3,nmas,azaharamedina7142,19/05/2024,"Me recorde a una persona mayor que conocí cuando estaba iniciando AMLO de presidente y me dijo que él estaba alistando a Claudia para continuar con su legado y mira, dicho y hecho parece que asi será...",1,si la educación no es un privilegio entonces por que mexico es número 11 en ignorancia?,-1,0,-1,0,1
3,nmas,user-ic7zx5wd1v,19/05/2024,Xòchitl quedo como,2,no sé puede escuchar completo por qué se autocensuran?,-1,-1,-1,0,-1
3,nmas,user-ej3sk1pn7e,19/05/2024,Es un desperdicio estar viéndolos! Que obsesión traen vs calderon ! Acepten por una vez la desastrosa realidad del país !,4,"maynez a este paso será el presidente,en un futuro no muy lejano",0,1,0,0,3
3,nmas,Aelirius,19/05/2024,"sigue sin cambiar mi Top de mejores candidatos a la presidencia.  1- Claudia 2- Maynez 3- Xochitl   Los que no ven que tipo de persona seria Xochitl si gobernara México, operense lo Ojos Porfavor.",8,ya díganle a xochitl que hable vien,0,0,0,-1,0
3,nmas,carlosbenavnete241,19/05/2024,Si la educación no es un privilegio entonces por que mexico es número 11 en ignorancia?,2,en la ciudad de méxico sirve de algo tener drenaje profundo si no se trabaja en la descomposición de las aguas negras???,0,0,-1,0,1
3,nmas,eliajun13,19/05/2024,No sé puede escuchar completo Por qué se autocensuran ?,0,yo quiero a alguien que tenga valores como representante de mi nación.me dueles mexico🇲🇽,0,1,0,0,1
3,nmas,laolizarraga,19/05/2024,"Maynez a este paso será el presidente, en un futuro no muy lejano",9,voto masivo a morena,1,0,0,0,-1
3,nmas,ByAntonix5021,19/05/2024,Ya díganle a xochitl que habe vien,4,"¡¡mucho más rico e imparcial el análisis de latinus!!....aquí se ve muy cargado el favoritismo hacia claudia....muuuuyyy mal....se nota que tienen línea.....que decepción,antes admiraba a los panelistas y no me perdia 3er grado,pero deje de verlos desde que se empezó a hacerse evidente que tienen línea en favor del gobierno.....",1,0,0,0,-1
3,nmas,jorgeramirezcoss,19/05/2024,En la ciudad de México sirve de algo tener drenaje profundo si no se trabaja en la descomposición de las aguas negras???,1,1:51:58 sigo muy enfadada sabiendo que nadie le dijo nada a la botarga,0,0,0,-1,-1
3,nmas,TanyaCarolinaEspinosaBecerra,19/05/2024,Yo quiero a alguien que tenga valores como representante de mi nación. ME DUELES MEXICO 🇲🇽,0,pues las respuestas en los 3 debates es más congruente a sido maynez mi votó será para el esperando se asemeje a nayib bukele,0,1,0,0,6
3,nmas,gumarovasquez,19/05/2024,Voto masivo a morena,15,claudia narcocandidata,1,0,0,0,12
3,nmas,Draliongrace,19/05/2024,"¡¡Mucho más  rico e imparcial  el análisis de  Latinus !!.... Aquí se ve muy cargado el favoritismo  hacia  Claudia....muuuuyyy mal....   Se nota que tienen línea.....que decepción, antes admiraba a los panelistas y no me perdia 3er Grado,  pero deje de verlos desde que se empezó a hacerse evidente que tienen línea en favor del  gobierno.....",5,es obvio que xochitl gano el debate aunque no les paresca,0,0,0,-1,6
3,nmas,Pastel_De_Coco11,19/05/2024,1:51:58 sigo muy enfadada sabiendo que nadie le dijo nada a la botarga,1,"que paso con esa producción,se fue el audio,se iba la imagen por un momento,terrible?",-1,-1,-1,0,27
3,nmas,FamiliaIbarraCardenas,19/05/2024,Pues las respuestas en los 3 debates es más congruente a sido maynez mi votó será para el esperando se asemeje a nayib bukele,1,xochitl caes mal mija,0,0,0,-1,0
3,nmas,sanmigel100,19/05/2024,CLAUDIA NARCOCANDIDATA,7,"yo solo veo a una buena presidente,sabe lo que hace y dice,será un verdadero honor tenerla cómo presidente...la otra es un verdadero chiste y mal contado...viva claudia,viva méxico...🇲🇽🇲🇽🇲🇽",1,0,0,0,3
3,nmas,AlejandroSanchez-fr1kv,19/05/2024,Es obvio que Xochitl gano el debate aunque no les paresca,5,xochitl presidenta y claudia ni ella se creé sus mentiras,1,0,0,-1,4
3,nmas,jairbaezcruz325,19/05/2024,"Que paso con esa producción, se fue el audio, se iba la imagen por un momento,  terrible?",0,"una burla estos famosos debates,políticos sin profesionalismo ni verdaderas ganas de sacar a este país adelante,las personas alrededor de los políticos,no son más que familiares que por interés están tras de ellos,pero ni uno solo de los políticos demuestran profesionalismo,ni ética ni mucho menos respeto a los ciudadanos,estos políticos no son más que personajes que se burlan de este país,no dan ideas claras ni concretas para sacar adelante la economía de este país en decadencia.",-1,-1,0,-1,24
3,nmas,yaritzethflores8493,19/05/2024,Chochil caes mal mija,1,xochitl no puede pronunciar la r,0,0,0,-1,20
3,nmas,emiliobatista7734,19/05/2024,"Yo solo veo a una buena presidente, sabe lo que hace y dice, será un verdadero honor tenerla cómo presidente...la otrá es un verdadero chiste y mal contado...Viva Claudia, Viva MÉXICO...🇲🇽🇲🇽🇲🇽",3,xochitl mi nahual favorito,0,0,0,1,0
3,nmas,FifamodMartes,19/05/2024,Xochil presidenta y claudia ni ella se cree sus mentiras,11,"ni a cual ir le,pero votare en contra de morena y de amloco.",-1,-1,0,-1,2
3,nmas,manueljuarez6786,19/05/2024,"Una burla estos famosos debates, políticos sin profesionalismo ni verdaderas ganas de sacar a este país adelante, las personas alrededor de los políticos, no son más que familiares que por interés están tras de ellos, pero ni uno solo de los políticos demuestran profesionalismo, ni ética ni mucho menos respeto a los ciudadanos, estos políticos no son más que personajes que se burlan de este país, no dan ideas claras ni concretas para sacar adelante la economía de este país en decadencia.",2,seles cayó el audio a partir de las hora 4 con 3 minutos,0,0,0,0,27
3,nmas,DanielRojas-yp3fe,19/05/2024,Xochitl no puede pronunciar la r,1,xochitl habla como rusa jajaj,0,0,0,-1,20
3,nmas,Hicolsanquenmedeirak,19/05/2024,Xochitl mi nahual favorito,3,xochitl vamos méxico sin miedo,0,0,0,1,8
3,nmas,luiscisneros8759,19/05/2024,"Ni a cual ir le , pero votare en contra de morena y de AMLOCO .",9,vamos todos plan c,1,0,0,0,18
3,nmas,wontolla.kc7,19/05/2024,Seles cayó el audio a partir de las hora 4 con 3 minutos,1,2:32:17 en serio?,0,0,-1,0,5
3,nmas,luisfernandogallegos4041,19/05/2024,Xochitl habla como rusa jajaj,1,2:27:42,0,0,1,0,5
3,nmas,Prendas.Divinas-Mama_Maria.,19/05/2024,Xochitl  vamos México sin miedo,7,doctora claudia🫡2 de junio presidenta,1,0,0,0,3
3,nmas,alejandracortescruz9411,19/05/2024,Vamos todos  plan c,4,plan c!️️️,1,0,0,0,18
3,nmas,Pastel_De_Coco11,19/05/2024,2:32:17 En serio?,2,no entiendo por qué sheinbaum no aprovecha la ocasión para sacarle lo de su hermana secuestradora y las influencias que la botarga ha movido para que viva como reina y hasta que salga de la cárcel en festividades.,1,0,0,-1,11
3,nmas,18Aleziita,19/05/2024,2:27:42,2,no entiendo porque los del prian representado por xochitl no pudieron poner a una persona mejor preparada para lavar el cerebro porque exta xochitl si esta con todo y ramas.,0,0,0,-1,0
3,nmas,aide8372,19/05/2024,Dra Claudia🫡2 de junio presidenta,5,ni al fraude electoral.todos con xochitl.,0,0,0,1,2
3,nmas,aracelisantana4266,19/05/2024,Plan C! ️️️,9,la soberbia de claudia ni siquiera voltea a ver a los candidatos mucho menos a los ciudadanos.......mi voto es para xochitl galvez,-1,0,0,1,39
3,nmas,mireyajuarez9985,19/05/2024,No entiendo por qué Sheimbaum no aprovecha la ocasión para sacarle lo de su hermana secuestradora y las influencias que la Botarga ha movido para que viva como reina y hasta que salga de la cárcel en festividades.,1,3:23:30 que paso aqui???!!!,0,0,-1,0,5
3,nmas,edgarmuchavz8041,19/05/2024,no entiendo porque los del prian no pudieron poner a una persona mejor preparada para lavar el cerebro porque exta xochitl si esta con todo y ramas.,1,me gustaría a un aspirante con carácter y eso no lo veo desde huuu nimodo esto es lo que hay,0,1,0,0,0
3,nmas,nataliaduarte7057,19/05/2024,Ni al fraude electoral. Todos con Xochitl.,4,xochitl xochitl xochitl vamos dios te alludaaaa,0,0,0,1,0
3,nmas,user-xi1th6gr2b,19/05/2024,La soberbia de Claudia ni siquiera voltea a ver a los candidatos mucho menos a los ciudadanos ....... Mi voto es para xochitl Gálvez,14,"no te decepciones de xochitl,mejor muestra la rabia que sentimos los mexicanos de tantas mentiras y tanta soberbia y el peligro que es claudia para méxico",1,0,0,-1,1
3,nmas,Pastel_De_Coco11,19/05/2024,3:23:30  Que paso aqui???!!!,1,los militares deben quedarse en las calles no seas wey xochitl,0,0,0,-1,7
3,nmas,gerardocastro7912,19/05/2024,Me gustaría a un aspirante con carácter y eso no lo veo desde huuu nimodo esto es lo que hay,1,"nuevamente xochitl sólo atacando,sin proponer.por eso maynez ya tambien le va ganando,trae más propuesta que xochitl.y claudia sigue ganando,mejores propuestas y resultados comprobados.claudia es la mejor opción.que siga la 4ta transformación",1,1,0,-1,16
3,nmas,blancagalicia8320,19/05/2024,Xochitl xochitl  xochitl  vamos dios te alludaaaa,4,claudia sheinbaum la mejor,1,0,0,0,12
3,nmas,roxxtellez687,19/05/2024,"No te decepciones de Xochilt, mejor muestra la rabia que sentimos los mexicanos de tantas mentiras y tanta soberbia y el peligro que es Claudia para México",4,iremos por xochitl🇲🇽es la que defiende la democracia de méxico🇲🇽.no dejaremos que nos conviertan en comunistas.corruptelas de morena.,-1,0,0,0,-1
3,nmas,LovelyDalmatian-ft6sh,19/05/2024,Los militares deben quedarse en las calles no seas wey xochilt,1,se fue el sonido al final.¿qué les pasó mis chavos?,-1,-1,0,-1,0
3,nmas,argesohe1338,19/05/2024,"Nuevamente Xochilt sólo atacando, sin proponer. Por eso Maynes ya tambien le va ganando, trae mas propuesta que Xochilt. Y Claudia sigue ganando, mejores propuestas y resultados comprobados. Claudia es la mejor opción. Que siga la 4T",1,xochitl piensa qué el debate es igual que si estuviera en un patio de besindad peleando por un lavadero jajaja,0,0,0,-1,6
3,nmas,liliacruz1885,19/05/2024,Claudia Sheinbaum la mejor,11,mi apoyo a nuestra próxima presidenta claudia shembaun,1,0,0,0,34
3,nmas,Roy-ys6jg,19/05/2024,IREMOS POR xochitl 🇲🇽ES LA QUE DEFIENDE LA DEMOCRACIA DE MÉXICO 🇲🇽. NO DEJAREMOS QUE NOS CONVIERTAN EN COMUNISTAS . CORRUPTELAS DE MORENA.,7,viva xochitl hay que salvar el país,0,0,0,1,-1
3,nmas,susanagranados588,19/05/2024,Se fue el sonido al final. ¿Qué les pasó mis chavos?,0,xochitl trae chicharito que falta de etica,0,0,0,-1,0
3,nmas,user-tb6dn7vv7i,19/05/2024,xochitl piensa qué el debate es igual que si estuviera en un patio de besindad peleando por un lavadero jajaja,0,"ya veo porque méxico nunca progresa,siempre mandan a silenciar a los que quieren hacer un cambio,y a los que van a hacer presidentes tiene que haber malicia sino no hay presidencia.terribles candidatos,ojala hubiera uno como nayib bukele",-1,-1,0,-1,1
3,nmas,user-bu6ue8eg1q,19/05/2024,Mi apoyo a nuestra próxima Presidenta Claudia Shembaun,7,xochitl galvez próxima presidenta,0,0,0,1,3
3,nmas,dianoticiastv1650,19/05/2024,Viva xochitl hay que salvar el país,7,xochitl presidenta dios nos bendiga y la gente despierte,0,0,0,1,3
3,nmas,braynnbrs2391,19/05/2024,Xochilt trae chicharito que falta de etica,1,puse la misma cara que maynez y claudia cuando xochitl saco lo de la faldase pasa de lanza está señora,-1,1,0,-1,0
3,nmas,armelandoempresario8261,19/05/2024,"Ya veo porque México nunca Progresa, siempre mandan a silenciar a los que quieren hacer un cambio, y a los que van a ser presidentes tiene que haber malicia sino no hay PRESIDENCIA. Terribles candidatos, ojala hubiera uno como Nayib Bukele",0,xochitl saludo a lo mexicanos migrantes los mismos que la corrieron de estados unidos que incluso salio burlandose de ellos de cual cueva salieron los de la marea rosa ignorancia nuevo color desbloqueado,0,0,0,-1,1
3,nmas,migueljimenez1732,19/05/2024,xochitl Gálvez próxima presidenta,13,"claudia no sabe defenderse,no sirve como presidenta..no es lo mejor para nuestra patria.",-1,0,0,0,4
3,nmas,user-tx3di2xk2w,19/05/2024,xochitl presidenta Dios nos bendiga y la gente despierte,4,voto masivo a morena!!!,1,0,0,0,2
3,nmas,aglephhernandez7806,19/05/2024,Puse la misma cara que Maynes y Claudia cuando Xochitl saco lo de la faldase pasa de lanza está señora,0,lamentable el personaje que le hicieron crear a xochitl galvez.,0,0,0,-1,0
3,nmas,jesusalbertogonzalezpizano6899,19/05/2024,Cochil saludo alos mexicanos migrantes los mismos que la corrieron de estados unidos que incluso salio burlandose de ellos DE CUAL CUEVA SALIERON LOS DE LA MAREA ROSA IGNORANCIA NUEVO COLOR DESBLOQUEADO,2,xochitl presidenta🫶,0,0,0,1,3
3,nmas,Roy-ys6jg,19/05/2024,"CLAUDIA NO SABE DEFENDERSE ,NO SIRVE COMO PRESIDENTA .. NO ES LO MEJOR PARA NUESTRA PATRIA.",7,xochitl presidenta,0,0,0,1,3
3,nmas,erikgardz9787,19/05/2024,Voto masivo a Morena!!!,4,"xochitl 2:38:07 quiere energia limpia,porque ella tiene empresas de eso 2:38:25 quiere sector privado porque su empresa es privada,solo quiere hacer presidenta para darse a si misma contratos gubernamentales y ganar millones.",0,0,0,-1,-1
3,nmas,teresarivera8405,19/05/2024,Lamentable el personaje que le hicieron crear a xochitl Gálvez.,1,"si la gente educada se ataca,prefiero hacer ignorante,pero feliz y pleno!",-1,-1,-1,0,-1
3,nmas,SALIMKURI,19/05/2024,xochitl presidenta 🫶,7,josé eduardo verástegui córdoba️,0,1,0,0,0
3,nmas,xxx-dc3lu,19/05/2024,xochitl presidenta,6,no sé logra entender como está señora xochitl pudo obtener la candidatura al alto rango de presidente de la república...su poco y nula comprensión de los problemas del país...su estúpido accionar..su nulo aliamiento a las bases del PAN o pri representado por xochitl...,0,0,0,-1,4
3,nmas,anonimotanonimo2664,19/05/2024,"xochitl 2:38:07 quiere energia limpia, porque ella tiene empresas de eso 2:38:25 quiere sector privado porque su empresa es privada, solo quiere ser presidenta para darse a si misma contratos gubernamentales y ganar millones.",1,"no confio en una persona,que tiene los recursos para arreglar su dentadura y no lo ha hecho,si no se preocupa por su persona que se puede esperar",-1,0,-1,0,-1
3,nmas,arturopolanco5117,19/05/2024,"Si la gente educada se ataca, prefiero ser ignorante, pero feliz y pleno!",0,y esos toqueteos entre acevedo y maerker?xd,0,-1,-1,0,0
3,nmas,missadrianamo5491,19/05/2024,José Eduardo VERÁSTEGUI Córdoba ️,1,esperemos que no gane xochitl,0,0,0,-1,0
3,nmas,AgustinVegaMontes,19/05/2024,No sé logra entender como está señora Xochitl pudo obtener la candidatura al alto rango de presidente de la república... Su poco y nula comprensión de los problemas del país... Su estúpido accionar.. Su nulo aliamiento a las bases del pan o pri...,1,xochitl fue a un pleito,0,0,0,-1,0
3,nmas,arsalab736,19/05/2024,"no confio en una persona , que tiene los recursos para arreglar su dentadura y no lo ha hecho ,si no se preocupa por su persona que se puede esperar",0,4:09:40 se fue el audio o soy yo.,0,0,0,0,27
3,nmas,robertobecerrabravo1448,19/05/2024,Y esos toqueteos entre Acevedo y Maerker? XD,1,"que mierda con xochitl,porque tan dolida con claudia??",0,0,0,-1,0
3,nmas,marthaalejandracortestadeo4221,19/05/2024,Esperemos que no gane Chochil,1,xochitl.frita.!,0,0,0,-1,0
3,nmas,WilliamLopez-ms9kr,19/05/2024,Xochitl fue a un pleito,1,"desde guadalajara,les deseo un buen plan c.",1,0,0,0,1
3,nmas,hugobarranco7876,19/05/2024,4:09:40  se fue el audio o soy yo.,0,"5 minutos de oír este postdebate y ya dieron flojera todos veré otros,seguro seran mejor que éste",-1,-1,0,-1,6
3,nmas,anasofiariosortuno3691,19/05/2024,"que mierda con xochitl , porque tan dolida con Claudia??",0,1:43:45 como siempre no esta respetando las reglas ay xochitl...,0,0,0,-1,5
3,nmas,user-xn1tj5zw6o,19/05/2024,Sochil. Frita. !,0,quién es el apuntador d xochitl o por dónde tiene el promter???,0,0,0,-1,0
3,nmas,karlosnoir,19/05/2024,"Desde Guadalajara, les deseo un buen Plan C.",1,"claudia siempre con las propuestas y respuestas,contestando de inmediato e inteligentemente.",1,0,0,0,-1
3,nmas,oryxyro,19/05/2024,"5 minutos de oir este postdebate y ya dieron flojera todos  vere otros, seguro seran mejor que éste",1,"porque ahora si se le da visibilidad a una gran marcha,se aprovechó totalmente xochitl claramente para favorecer ante su oposición,en otros tiempos y demás sexenios hasta los callaban,evadian y ni si quiera cobraban mayor importancia.",0,0,0,-1,-1
3,nmas,Pastel_De_Coco11,19/05/2024,1:43:45  como siempre no esta respetando las reglas Ay Xóchilt...,1,"no hay duda que la dr.claudia es la mejor opción para los hermanos mexicanos.nunca votaría por la señora xochitl si fuera mexicana,no tiene contexto en el discurso,gana el tiempo en acusación personal y datos que no tienen nada que ver con el debate.el otro se repite aunque tiene un poco más de sentido en su discurso.",1,0,0,-1,1
3,nmas,silvialira9155,19/05/2024,Quién es el apuntador d xochitl o por dónde tiene el promter???,0,"!el futurto se ve mejor;continuará muy bien,ganó claudia!",1,0,0,0,16
3,nmas,anahidalgo7219,19/05/2024,"Claudia siempre con las propuestas y respuestas, contestando de inmediato e inteligentemente.",1,maynez se lo dijo en su cara cuando dijo que ningún hombre la manda pobre xochitl,0,1,0,-1,0
3,nmas,lizmadrigaldelapena4531,19/05/2024,"Porque ahora si se le da visibilidad a una gran marcha, se aprovechó totalmente Xochitl claramente para favorecer ante su oposición, en otros tiempos y demás sexenios hasta los callaban, evadian y ni si quiera cobraban mayor importancia.",2,"1:44:37 la cara que puso claudia jajaja.""""",1,0,0,0,5
3,nmas,ceciojackson1588,19/05/2024,"No hay duda que la Dr. Claudia es la mejor opción para los hermanos Mexicanos. Nunca votaría por la señora xochitl si fuera Mexicana, no tiene contexto en el discurso, gana el tiempo en acusación personal y datos que no tienen nada que ver con el debate. El otro se repite aunque tiene un poco más de sentido en su discurso.",1,la princesa se puso bellaka,1,0,0,0,10
3,nmas,user-db7jl5nc6m,19/05/2024,"!El futurto se ve mejor; continuará muy bien, ganó Claudia!",1,claudia será la ganadora es la más capacitada para gobernar al país no me imagino a xochitl de presidenta sería una pésima representación de méxico en el extranjero no sabe ni hablar….a maynez le llegará su momento va por buen camino….,1,1,0,-1,1
3,nmas,andresarcos3077,19/05/2024,Maynes se lo dijo en su cara cuando dijo que ningún hombre la manda pobre xochil,0,candidatas puntera dice el del PRIANRD si xochitl está en tercer lugar,0,0,0,-1,-1
3,nmas,Pastel_De_Coco11,19/05/2024,"1:44:37  La cara que puso Claudia JAJAJA. """"",1,"por primera vez no estoy de acuerdo con tercer grado.empieza raymundo con su comentario y todos los demás siguieron con la misma tendencia de que xochitl estuvo perdida.yo vi otra cosa,estoy cansado de que se conformen con lo que esta pasando en el país y el partido del gobierno en turno diga que todo va muy bien.para mí eso es conformarse con lo que tenemos.y no se trata de quien se ve más o menos guapa.es ver quien realmente puede hacer un buen gobierno.",-1,-1,0,-1,-1
3,nmas,saidlara2872,19/05/2024,la princesa se puso bellaka,1,este debate comenzó dos candidatos contra xochitl,0,-1,0,-1,6
3,nmas,erickortiz1074,19/05/2024,Claudia será la ganadora es la más capacitada para gobernar al país no me imagino a xochitl de presidenta sería una pésima representación de México en el extranjero no sabe ni hablar ….a maynez le llegará su momento va por buen camino ….,1,"a quien le vas a quien te mintió setenta años,al que te mintió dice años o al que no quiso ponerse los pantalones en cinco años????",-1,-1,0,-1,9
3,nmas,fredyperezlopez9408,19/05/2024,Candidatas puntera dice el del prianrd si cochil está en tercer lugar,2,es mi imaginación o la botarga esta leyendo??????????,0,0,0,-1,-1
3,nmas,franciscojavierguerrerorom991,19/05/2024,"Por primera vez no estoy de acuerdo con tercer grado. Empieza Raymundo con su comentario y todos los demás siguieron con la misma tendencia de que Xochil estuvo perdida. Yo vi otra cosa, estoy cansado de que se conformen con lo que esta pasando en el país y el partido del gobierno en turno diga que todo va muy bien. Para mí eso es conformarse con lo que tenemos. Y no se trata de quien se ve más o menos guapa. Es ver quien realmente puede hacer un buen gobierno.",0,leo:analiza a tus compañeros sus análisis.y prepararate así como ellos.no queremos oír opiniones simples.tus compañeros son cultisimos.prepárate,0,-1,1,0,6
3,nmas,user-lv5hx3ib1h,19/05/2024,Este debate comenzó dos candidatos contra Xochitl,1,"jajjaja como le gritan a xochitl""culero!""no es para menos que pena esa mujer",0,0,0,-1,10
3,nmas,jorgeramirezcoss,19/05/2024,"A quien le vas a quien te mintió setenta años, al que te mintió dice años o al que no quiso ponerse los pantalones en cinco años????",0,que chistocita la daltónica ay xochitl ya se está abriendo tu alcantarilla,0,0,0,-1,0
3,nmas,Jessica-xl6wi,19/05/2024,Es mi imaginación o la botarga esta leyendo??????????,0,democracia en méxico es un circo,0,-1,-1,0,1
3,nmas,rodrigoquintanilla,19/05/2024,Leo: analiza a tus compañeros sus análisis. Y prepararate así como ellos.  No queremos oír opiniones simples.  Tus compañeros son CULTISIMOS.  Prepárate,1,"si no existiera democracia no habrían elecciones,por favor investiguen lo que significa antes de abrir el hocico",-1,0,-1,0,-1
3,nmas,densag9579,19/05/2024,"Jajjaja como le gritan a Xochilt ""culero!"" no es para menos que pena esa mujer",0,en este de.bastante claudia 10.gorje.7 xochitl 5 pobre.xochitl,1,0,0,-1,-1
3,nmas,user-gh5uo1ub6z,19/05/2024,Que chistocita la daltónica ay chochil ya se está abriendo tu alcantarilla,0,"jajjaja como le gritan a xochitl""culero!""no es para menos que pena esa mujer",0,0,0,-1,10
3,nmas,rodolfodominguez9476,19/05/2024,Democracia en México es un circo,2,"jajjaja como le gritan a xochitl""culero!""no es para menos que pena esa mujer",0,0,0,-1,10
3,nmas,SvenAxl,19/05/2024,"Si no existiera democracia no habrían elecciones, por favor investiguen lo que significa antes de abrir el hocico",0,"que extraño que en esta mesa de análisis se pronuncie mucho a favor de claudia,y en la mesa de análisis de latinus se pronuncie a xochitl.obviamente hay diversidad de opiniones,pero estas dos tan claras diferencias de opiniones hacen sentir,casi por el sentido común,que hay un claro favoritismo y por lo tanto imparcialidad en al menos una de las mesas.esta mesa de análisis tiene 850 mil expectadores y latinus 255 mil,por el bien de méxico sería deseable que sea esta mesa la imparcial,y no la que intente inluir en el voto del próximo 2 de junio.pero,y es mi termor y percepción,televisa no es precisamente famosa por su imparcialidad.",1,0,0,-1,-1
3,nmas,user-bv8tm1ym4b,19/05/2024,En este de. Bastante  claudia  10.  Gorje.7 xochit 5 pobre. Xochit,1,eso de que tienen una beca es un decir porque nunca les dan la cantidad que dicen se acaban el ciclo escolar y de todo ese ciclo solo les dan una mi pregunta es donde se queda lo demas,-1,0,-1,0,19
3,nmas,densag9579,19/05/2024,"Jajjaja como le gritan a Xochilt ""culero!"" no es para menos que pena esa mujer",0,"de acuerdo con maynez,de todos mis compañeros que aplicamos para una beca del bienestar para continuar nuestros estudios en pandemia y después de pandemia,a todos nos la rechazaron!",-1,1,0,0,-1
3,nmas,densag9579,19/05/2024,"Jajjaja como le gritan a Xochilt ""culero!"" no es para menos que pena esa mujer",0,son una cacacacacaca!!!y me fascinaría ver a xochitl con trump,0,0,0,-1,0
3,nmas,alejandromiranda8427,19/05/2024,"Que extraño que en esta Mesa de Análisis se pronuncie mucho a favor de Claudia, y en la Mesa de Análisis de Latinus se pronuncie a Xochitl. Obviamente hay diversidad de opiniones, pero estas dos tan claras diferencias de opiniones hacen sentir, casi por el sentido común, que hay un claro favoritismo y por lo tanto imparcialidad en al menos una de las Mesas. Esta Mesa de Análisis tiene 850 mil expectadores y Latinus 255 mil, por el bien de México sería deseable que sea esta Mesa la imparcial, y no la que intente inluir en el voto del próximo 2 de junio. Pero, y es mi termor y percepción, Televisa no es precisamente famosa por su imparcialidad.",0,quien vio el debate presidencial de los peluches,0,-1,-1,0,6
