num_debate,canal,username,fecha,comentario,num_likes,comentario_editado,Claudia,Maynez,Ninguno,Xóchitl,topic
3,unotv,aldahirvazquez2438,19/05/2024,"Maynez  aquí esta mi voto, ganes o pierdas tu concentraste en hablar y no atacar",9,"maynez aquí esta mi voto,ganes o pierdas tu concentraste en hablar y no atacar",0,1,0,0,-1
3,unotv,jorgeesquivel6474,19/05/2024,Arriba Claudia sheimbaum,3,arriba claudia sheinbaum,1,0,0,0,12
3,unotv,politica9956,19/05/2024,"MI PADRE ES PRIIISTA Y ESTABA CONVOCANDO GENTE PARA IR ALA MARCHA, PAGABAN 200 PESOS POR CABEZA, YO CHOCO MUCHO CON EL PORQUE SOY DE TENDENCIA IZQUIERDISTA Y SOY TESTIGO QUE  ESA MARCHA FUE DE ACARREADOS Y DE FIFIS.",7,"mi padre es priiista y estaba convocando gente para ir a la marcha,pagaban 200 pesos por cabeza,yo choco mucho con el porque soy de tendencia izquierdista y soy testigo que esa marcha fue de acarreados y de fifi.",1,0,0,-1,-1
3,unotv,markb.p2758,19/05/2024,Xochil se preocupa por Claudia  mientras q Mainez se  la acavo a Xochil,11,xochitl se preocupa por claudia mientras que maynez se la acavo a xochitl,1,1,0,-1,0
3,unotv,javiernoguez5519,19/05/2024,"La neta da mucha guisa (risa) su ege jajaja, ya mejor que no hable que me voy a desvivir de guisa a como habla",3,"la neta da mucha guisa(risa)su ege jajaja,ya mejor que no hable que me voy a desvivir de guisa a como habla",0,0,1,0,0
3,unotv,rocketgalactic,19/05/2024,"La claudia se ve falsa, no responde a nada, no dice nada, tapa todo lo malo.",11,"la claudia se ve falsa,no responde a nada,no dice nada,tapa todo lo malo.",-1,0,0,0,0
3,unotv,javiernoguez5519,19/05/2024,"Gio no quiego una pgesidenta qué hable así,",6,"gio no quiego una pgesidenta qué hable así,",0,0,0,-1,-1
3,unotv,jessyangeles6783,19/05/2024,Claudia x 100000000,5,claudia por 100000000,1,0,0,0,-1
3,unotv,marianamarr7780,19/05/2024,"Lo siento por los mexicanos pero van a seguir otra temporada en un pais inseguro , ese asunto no parese interesarle a nadie",8,"lo siento por los mexicanos pero van a seguir otra temporada en un pais inseguro,ese asunto no parese interesarle a nadie",-1,-1,0,-1,1
3,unotv,krystaltorres1656,19/05/2024,Ay Xochitl... 🫠🫠🫠 Hasta me haces reír 🫠,1,ay xochitl...🫠🫠🫠hasta me haces reír🫠,0,0,0,-1,0
3,unotv,kirasaiyayin,19/05/2024,​@mayamendoza352 Te calo verdad pendeja y escribe bien que no entendí ni madres de asadr o no se... Yo por lo menos le pongo un guion a las groserías para que publique mi comentario pero si se lo quitas ya sabes que va para ti ja,1,​@mayamendoza352 te calo verdad pendejo y escribe bien que no entendí ni madres de asadr o no se...yo por lo menos le pongo un guion a las groserías para que publique mi comentario pero si se lo quitas ya sabes que va para ti ja,0,0,-1,0,9
3,unotv,maresv,19/05/2024,Hay corrupción el las ayudas.  Hay abuso de gente que no necesita las ayudas y se aprovecha de ellas.  En México siguen muyy verdes con la gestión de datos en todos los sectores.,3,hay corrupción el las ayudas.hay abuso de gente que no necesita las ayudas y se aprovecha de ellas.en méxico siguen muyy verdes con la gestión de datos en todos los sectores.,-1,0,0,0,1
3,unotv,leatherface0770,19/05/2024,Fuera el PRIAND,4,fuera el PRIAN,0,0,0,-1,0
3,unotv,BrunoRodriguez-bd6df,19/05/2024,Con esto sigue siendo claro que Jorge Máynez es la mejor opción,5,con esto sigue siendo claro que jorge maynez es la mejor opción,0,1,0,0,16
3,unotv,dulcealba13,19/05/2024,Maynez la rompió ️️,11,maynez la rompió️️,0,1,0,0,0
3,unotv,lorelymarquez786,19/05/2024,Con todo respeto Pobre Xochitl no propone........ puras habladas. Es soñadora  En si que propuso?,5,con todo respeto pobre xochitl no propone........puras habladas.es soñadora en si que propuso?,0,0,0,-1,0
3,unotv,lorelymarquez786,19/05/2024,Que tristesa ver que Xochitl no propone  Es puro bla bla hablando y hablando habladas y habladas,8,que tristesa ver que xochitl no propone es puro bla bla hablando y hablando habladas y habladas,0,0,0,-1,-1
3,unotv,lizandroavila6306,19/05/2024,Ni Sele entiende a esa señora,1,ni sele entiende a esa señora,0,0,-1,0,10
3,unotv,rosaurapuente6092,19/05/2024,FUERA LOS MORENA..RCOS,6,fuera los morena..rcos,-1,0,0,0,0
3,unotv,evelynronmarin5204,19/05/2024,"Este 2 de junio va a ser historia en México en tener a la primera mujer presente, felicitaciones adelantadas, Dra. Claudia, es usted quien va a ganar.",8,"este 2 de junio va a hacer historia en méxico en tener a la primera mujer presente,felicitaciones adelantadas,doctora.claudia,es usted quien va a ganar.",1,0,0,0,1
3,unotv,LucasReyes-er3pz,19/05/2024,Mis respetos  para claudia  porque va dar casas para los mas necesitados  y tiene  mi voto,6,mis respetos para claudia porque va dar casas para los más necesitados y tiene mi voto,1,0,0,0,2
3,unotv,franciscadiazrodriguez3541,19/05/2024,Jajaja Claudia ni te pela Xochilt y tu ya no sabes cómo mostrar tu ardor pobre se vale soñar,5,jajaja claudia ni te pela xochitl y tu ya no sabes cómo mostrar tu ardor pobre se vale soñar,1,0,0,-1,0
3,unotv,LucasReyes-er3pz,19/05/2024,El señor jorge megusta lo que dijo lo de las casas para los que  no tenemos casa,3,el señor jorge megusta lo que dijo lo de las casas para los que no tenemos casa,0,1,0,0,-1
3,unotv,seli894,19/05/2024,"Quien no quiere ganar 10,000 al mes y trabajar menos, estaria superrr, pero la verdad es que siento deberían de poner u observar mejor a las empresas que hay en el pais, porque no respetan muchas veces esos salarios, ni las leyes del trabajo, te dan contrato pero no seguro social, condicionan lo poco extra que te pueden dar, dejan mucho que desear, las personas por necesidad siguen trabajando pero es una falta de respeto, a nuestro tiempo, nuestro esfuerzo, solo las empresas con más renombre un ejemplo las de fast food son las que si o si respetan ese salario pero solo ofrecen eso, y otras que esperan que trabajes mas, ganes lo mismo o menos y es una sobrecarga de trabajo, creo que ahí radica el problema, muchas veces pasar por encima de las leyes que existen",2,"quien no quiere ganar 10,000 al mes y trabajar menos,estaria superrr,pero la verdad es que siento deberían de poner u observar mejor a las empresas que hay en el pais,porque no respetan muchas veces esos salarios,ni las leyes del trabajo,te dan contrato pero no seguro social,condicionan lo poco extra que te pueden dar,dejan mucho que desear,las personas por necesidad siguen trabajando pero es una falta de respeto,a nuestro tiempo,nuestro esfuerzo,solo las empresas con más renombre un ejemplo las de fast food son las que si o si respetan ese salario pero solo ofrecen eso,y otras que esperan que trabajes más,ganes lo mismo o menos y es una sobrecarga de trabajo,creo que ahí radica el problema,muchas veces pasar por encima de las leyes que existen",-1,0,0,1,13
3,unotv,franciscadiazrodriguez3541,19/05/2024,Menos serás presidenta Xochilt por sólo estarás ocupada denunciando gente en ves de ocuparte del pueblo.Muy mala está señora si tanto le preocupa el pueblo mexicano ubiera demandado muchos años atrás tantos gentes corruptas. Mejor vallase aser gelatinas,1,menos serás presidenta xochitl por sólo estarás ocupada denunciando gente en ves de ocuparte del pueblo.muy mala está señora si tanto le preocupa el pueblo mexicano ubiera demandado muchos años atrás tantos gentes corruptas.mejor vallase hacer gelatinas,0,0,0,-1,1
3,unotv,marycanales1735,19/05/2024,Maynez te invito un blunt ️ Y asi te relajas mi presidente risueño; de todo lo q te estresan ese par. 🫶️🫶,5,maynez te invito un blunt️y así te relajas mi presidente risueño;de todo lo que te estresan ese par.🫶️🫶,0,1,0,0,3
3,unotv,marycanales1735,19/05/2024,No han venido a darme mi canasta de despensa  o mis $3000. Mi credencial ahi ta 🫶🫶🫶️🫶🫶🫶,2,no han venido a darme mi canasta de despensa o mis $3000.mi credencial ahí ta🫶🫶🫶️🫶🫶🫶,0,0,-1,0,0
3,unotv,sergiomeza,19/05/2024,"En la politica todos mienten , con echos pero mienten jajaja porquien votar esa es la pregunta hahaha",3,"en la politica todos mienten,con echos pero mienten jajaja porquien votar esa es la pregunta hahaha",-1,-1,0,-1,-1
3,unotv,MrIssues1,19/05/2024,yo quería a Ebrard pero maynes esta bien,3,yo quería a ebrard pero maynez esta bien,0,1,0,0,0
3,unotv,NxacmjJXVsjisf,19/05/2024,"Xpla xochitl quiere dejar en quiebra a México, aparte parece como si nos quisiera comprar con sus ""apoyos"" que ni si quiera dará por burra y mentirosa y porque jamás llegará a la presidencia",2,"xpla xochitl quiere dejar en quiebra a méxico,aparte parece como si nos quisiera comprar con sus""apoyos""que ni si quiera dará por burra y mentirosa y porque jamás llegará a la presidencia",0,0,0,-1,4
3,unotv,alejandralopez7784,19/05/2024,"Los apoyos sociales son esenciales. Pero, las claves a mejorar son la educación y la mejora de empleos.  Siempre quieren erradicar la pobreza extrema, pero, no solamente es dar despensas o cobijas. El tema es más profundo, es darle la oportunidad de que reciban una mejor educación y asi puedan trabajar.  Sí a una persona le enseñas a pescar y a trabajar, jamás sufrirá de hambre como tal. Hay que enseñar a aprender, no dar todo regalado.  No solamente se deben usar los impuestos de nosotros los trabajadores, sino también de los empresarios y gobernantes, para asi promover programas de mejora a las ciudades. En fin, es un tema sin fin.",2,"los apoyos sociales son esenciales.pero,las claves a mejorar son la educación y la mejora de empleos.siempre quieren erradicar la pobreza extrema,pero,no solamente es dar despensas o cobijas.el tema es más profundo,es darle la oportunidad de que reciban una mejor educación y así puedan trabajar.sí a una persona le enseñas a pescar y a trabajar,jamás sufrirá de hambre como tal.hay que enseñar a aprender,no dar todo regalado.no solamente se deben usar los impuestos de nosotros los trabajadores,sino también de los empresarios y gobernantes,para así promover programas de mejora a las ciudades.en fin,es un tema sin fin.",-1,0,0,1,-1
3,unotv,lilianapalafox4792,19/05/2024,Ya fuera el pan ojala Guanajuato tenga paz y se vaya el pan,0,ya fuera el PAN ojala guanajuato tenga paz y se vaya el PAN,0,0,0,-1,0
3,unotv,lilianapalafox4792,19/05/2024,Me cayo mal que en el debate la xochitl hizo y deshizo,0,me cayo mal que en el debate la xochitl hizo y deshizo,0,0,0,-1,0
3,unotv,lilianapalafox4792,19/05/2024,Deberian de multar a xochitl y a los encargados del debate  por permitir que saque sus carteles eso es falta de respeto sabemos que ganara Claudia,5,deberian de multar a xochitl y a los encargados del debate por permitir que saque sus carteles eso es falta de respeto sabemos que ganara claudia,0,0,0,-1,-1
3,unotv,JorgeGonzalez-le8gj,19/05/2024,El del salario de 10 mil pesos al mes,2,el del salario de 10 mil pesos al mes,0,0,0,0,13
3,unotv,jazminy6769,19/05/2024,Claudia es un orgullo!,5,claudia es un orgullo!,1,0,0,0,0
3,unotv,elgallito1100,19/05/2024,Y aquí luego luego se ve que los chayoteros apoyan al prian,2,y aquí luego luego se ve que los chayoteros apoyan al prian representado por xochitl,0,0,0,-1,0
3,unotv,azuluribe3729,19/05/2024,Mi pregunta es si la gelatinera tiene miles de años en un poder porque hasta hoy dice que va por que mexico sea mejor pues no le creo,0,mi pregunta es si la gelatinera tiene miles de años en un poder porque hasta hoy dice que va por que mexico sea mejor pues no le creo,0,0,0,-1,1
3,unotv,isabellopez7306,19/05/2024,Morena miente!!!,4,morena miente!!!,-1,0,0,0,0
3,unotv,elgallito1100,19/05/2024,"Porq yo se que hay dirigentes q obligan ala gente votar por la persona que ellos quieren, pero por favor les pido que no se dejen manipular y piensen lo mejor para los jóvenes del futuro",0,"porq yo se que hay dirigentes que obligan a la gente votar por la persona que ellos quieren,pero por favor les pido que no se dejen manipular y piensen lo mejor para los jóvenes del futuro",0,0,-1,0,39
3,unotv,elgallito1100,19/05/2024,"Yo nada más les recuerdo a todos los mexicanos trabajadores y ambulantes de la Ciudad de México y del todo país que no se dejen manipular por sus diregentes, quiero q sepan que no piensen en ustedes piensen en sus hijos sus nietos que vienen en el futuro , creo que nosotros ya hemos pasado y vivido la corrupcion ,ahora es tiempo de pensar el futuro , ya no se dejen comprar por migajas que dan los ricos con tal de tener el poder de hacer y deshacer . Porfavor quiero que lean la historia de Emiliano zapata el porque empezó la revolución mexicana",3,"yo nada más les recuerdo a todos los mexicanos trabajadores y ambulantes de la ciudad de méxico y del todo país que no se dejen manipular por sus diregentes,quiero que sepan que no piensen en ustedes piensen en sus hijos sus nietos que vienen en el futuro,creo que nosotros ya hemos pasado y vivido la corrupcion,ahora es tiempo de pensar el futuro,ya no se dejen comprar por migajas que dan los ricos con tal de tener el poder de hacer y deshacer.porfavor quiero que lean la historia de emiliano zapata el porque empezó la revolución mexicana",0,0,-1,0,1
3,unotv,jimenatrinidad8185,19/05/2024,Qui nadie me niega  1.claudia 2.maynez 3y más abajo xochitl NADIE ME LO NIEGA,7,que nadie me niega 1.claudia 2.maynez 3y más abajo xochitl nadie me lo niega,1,0,0,-1,0
3,unotv,carengarciarojas5875,19/05/2024,Claudia,0,claudia,1,0,0,0,28
3,unotv,elgallito1100,19/05/2024,"Morena mete a una mujer para presidenta y los del prian hacen lo mismo ,!! Ahí se ve que los del prian están desesperados por seguir robando jajaja",3,"morena mete a una mujer para presidenta y los del prian representado por xochitl hacen lo mismo,!!ahí se ve que los del prian representado por xochitl están desesperados por seguir robando jajaja",1,0,0,-1,4
3,unotv,TeresaValadez-xj1xd,19/05/2024,A quien votan?,0,a quien votan?,0,0,0,0,2
3,unotv,lloryllori6680,19/05/2024,"sinceramente Jorge me ha convencido más que Claudia, a Claudia le he dado el veneficio de la duda pero aun no me convence. Jorge tienes mi voto.",9,"sinceramente jorge me ha convencido más que claudia,a claudia le he dado el veneficio de la duda pero aún no me convence.jorge tienes mi voto.",0,1,0,0,2
3,unotv,user-zz9xg6vs1z,19/05/2024,Quien en su sano juicio piensa que Xochitl es alguien para gobernarestá bien matada la señora,6,quien en su sano juicio piensa que xochitl es alguien para gobernarestá bien matada la señora,0,0,0,-1,10
3,unotv,user-ug7sz6eq7b,19/05/2024,Bienvenida nuestra presidenta  claudia  claramente sea nuestra presidenta,2,bienvenida nuestra presidenta claudia claramente sea nuestra presidenta,1,0,0,0,14
3,unotv,user-ug7sz6eq7b,19/05/2024,El prian dejo el gobierno todo dañado y acabado y corrupto quiern que en 6 años se corija todo el cochinero que dejo el prian,6,el prian representado por xochitl dejo el gobierno todo dañado y acabado y corrupto quiern que en 6 años se corija todo el cochinero que dejo el prian representado por xochitl,0,0,0,-1,15
3,unotv,minuethpavon2222,19/05/2024,"El construir más viviendas menos árboles, menos vegetación y más animales sin hogar, porque ese afán de construir y contruir",5,"el construir más viviendas menos árboles,menos vegetación y más animales sin hogar,porque ese afán de construir y contruir",0,0,-1,0,-1
3,unotv,elgallito1100,19/05/2024,Aquí lo único que vi en todo momento es que xochitl atacaba a claudia y no propuso nada,13,aquí lo único que vi en todo momento es que xochitl atacaba a claudia y no propuso nada,0,0,0,-1,-1
3,unotv,humbertosolis4990,19/05/2024,Nunca había estado tan ansioso cómo hasta ahora en ir a depositar mi voto y ver nuevamente derrotado al PRIAN viva la 4T.,6,nunca había estado tan ansioso cómo hasta ahora en ir a depositar mi voto y ver nuevamente derrotado al prian representado por xochitl viva la 4ta transformación.,1,0,0,-1,2
3,unotv,humbertosolis4990,19/05/2024,Es,0,es,0,0,0,0,0
3,unotv,user-rq6ew8uy3i,19/05/2024,Hasta parece... Pero no parece casi lo confirmó llevan ya un diálogo y preparados con sus imágenes las candidatas no tienen diálogo ni propuestas propias escrito todo cualquiera se para enfrente a dar falsas promesas,3,hasta parece...pero no parece casi lo confirmó llevan ya un diálogo y preparados con sus imágenes las candidatas no tienen diálogo ni propuestas propias escrito todo cualquiera se para enfrente a dar falsas promesas,-1,0,0,-1,-1
3,unotv,johannaitzelgarciagutierrez,19/05/2024,"Que feo yo soy mujer, pero, no estoy de acuerdo para nada que estas mujeres tan inestables emocionalmente estén en dicho puesto. Y el otro con sonrisa falsa.",10,"que feo yo soy mujer,pero,no estoy de acuerdo para nada que estas mujeres tan inestables emocionalmente estén en dicho puesto.y el otro con sonrisa falsa.",-1,0,0,-1,10
3,unotv,nayelipaulino5324,19/05/2024,"Claro que Chochitl va a acabar con los pobres, exterminio total",3,"claro que xochitl va a acabar con los pobres,exterminio total",0,0,0,-1,7
3,unotv,glafypadilla8171,19/05/2024,"Yo ni católica soy, Xochilt! Queremos propuestas!",5,"yo ni católica soy,xochitl!queremos propuestas!",0,0,0,-1,-1
3,unotv,robertoescuen981,19/05/2024,No le agas caso ala vieja fransesa los que se vienen son los que tiene dinero pero como ya no les dan y les dan alos pobre ya no les llegan moches esa es la verdad,3,no le haga caso a la vieja fransesa los que se vienen son los que tiene dinero pero como ya no les dan y les dan a lo pobre ya no les llegan moches esa es la verdad,0,0,0,-1,-1
3,unotv,robertoescuen981,19/05/2024,Ustedes porque permiten que xochil que ella lleve cosas así debe de ser más profesional y ustedes también creen que nosotros queremos chistes,2,ustedes porque permiten que xochitl que ella lleve cosas así debe de hacer más profesional y ustedes también creen que nosotros queremos chistes,0,0,0,-1,10
3,unotv,lorensgoodday2029,19/05/2024,Me da ansiedad su “egre” de xochitl,5,me da ansiedad su“egre”de xochitl,0,0,0,-1,0
3,unotv,GabyMartinez-ww1nx,19/05/2024,Ay xochitl!,1,ay xochitl!,0,0,0,-1,-1
3,unotv,bet1644,19/05/2024,2:23:27 no que a xochitl ningún hombre le da órdenes?,5,2:23:27 no que a xochitl ningún hombre le da órdenes?,0,0,0,-1,5
3,unotv,nayelipaulino5324,19/05/2024,Casi no se les ve lo vendidos,4,casi no se les ve lo vendidos,0,0,-1,0,0
3,unotv,CamayaPainters,19/05/2024,Xochitl iba tomada??,5,xochitl iba tomada??,0,0,0,-1,0
3,unotv,ManuelMartinez-qg5gr,19/05/2024,38:21 inicia el debate,12,38:21 inicia el debate,0,0,0,0,-1
3,unotv,christianjesus6311,19/05/2024,Cagamos,7,cagamos,0,0,-1,0,8
3,unotv,leonelflores1831,19/05/2024,Yo gano 13794 al mes o me alcanza,1,yo gano 13794 al mes o me alcanza,0,0,-1,0,0
3,unotv,paulinapartida2577,19/05/2024,"Ósea xochitl no tiene propuestas, tiene ataques en contra de Claudia.",13,"ósea xochitl no tiene propuestas,tiene ataques en contra de claudia.",0,0,0,-1,21
3,unotv,emilioalejandro1601,19/05/2024,Como van a realizar su propuesta ?   xochitl: Claudia miente,15,como van a realizar su propuesta?xochitl:claudia miente,0,0,0,-1,33
3,unotv,Duke75666musica,19/05/2024,56:27 Adouken,2,56:27 adouken,0,0,0,0,5
3,unotv,erickaquino8576,19/05/2024,Que antipática esta xochitl que solo se dedicó a culpar de todo a morena en ves de contestar las preguntas,20,que antipática esta xochitl que solo se dedicó a culpar de todo a morena en ves de contestar las preguntas,0,0,0,-1,0
3,unotv,erickaquino8576,19/05/2024,Esque cada que escucho a xochitl proponer algo me retuerce que no dice como nadamas dice vamos a hacer esto,11,esque cada que escucho a xochitl proponer algo me retuerce que no dice como nadamas dice vamos a hacer esto,0,0,0,-1,0
3,unotv,seaf96,19/05/2024,Esta señora Claudia de donde saca que los mexicanos nos sentimos menos inseguros en este sexenio?  Ah claro ellos tienen otros datos,29,esta señora claudia de donde saca que los mexicanos nos sentimos menos inseguros en este sexenio?ah claro ellos tienen otros datos,-1,0,0,0,1
3,unotv,lissethramirez3017,19/05/2024,Hablan de una mejor educación y ganan mucho mejor los mentados tiktokers,5,hablan de una mejor educación y ganan mucho mejor los mentados tiktokers,0,0,-1,0,19
3,unotv,monhycoco,19/05/2024,Mainez me gustaría para presidente,23,maynez me gustaría para presidente,0,1,0,0,3
3,unotv,marianitaloja8919,19/05/2024,CARTONERA LA GALVES,3,cartonera la galvez,0,0,0,-1,0
3,unotv,marianitaloja8919,19/05/2024,COJJJJJJJJUPCION,8,cojjjjjjjjupcion,0,0,0,-1,0
3,unotv,marianitaloja8919,19/05/2024,PARECE BORICUA DICE ...AJJJJJOROS,2,parece boricua dice...ajjjjjoros,0,0,0,-1,0
3,unotv,marianitaloja8919,19/05/2024,Extojjjjjjcionar pajjjjjjtido acuejjjjjjdo sejjjjjjvidores,5,extojjjjjjcionar pajjjjjjtido acuejjjjjjdo sejjjjjjvidores,0,0,0,-1,0
3,unotv,marianitaloja8919,19/05/2024,Suelta la papa xochitl,3,suelta la papa xochitl,0,0,0,-1,0
3,unotv,marianitaloja8919,19/05/2024,NO HAY DIA QUE NO LE CAIGA ALGO A LA OXIL  SE LE CAYO EL PAPEL RISA DEL LIBRJJJJJO,5,no hay día que no le caiga algo a la oxil se le cayo el papel risa del librjjjjjo,0,0,0,-1,0
3,unotv,anaelizabeth.2495,19/05/2024,No le creo a ninguno.,9,no le creo a ninguno.,-1,-1,0,-1,0
3,unotv,50epilef,19/05/2024,"Dra Claudia Sheinbaum aplanadora pesan sus palabras , Vencedora de este Debate, Xochilt Galvez hueca y sin peso su palabreria por la corrupcion que representa",10,"doctora claudia sheinbaum aplanadora pesan sus palabras,vencedora de este debate,xochitl galvez hueca y sin peso su palabreria por la corrupcion que representa",1,0,0,-1,15
3,unotv,CarmenLopez-23,19/05/2024,"A xochitl siempre la apoyaron en los tres debates porque son del prian, la dejaron todo el tiempo que se portara tan bajo como ellos se portan, igual que los conductores que apoyan a xochitl, los programuchos baratos y bajos igual que ella, aferrados a sus mentiras en toda potencia",4,"a xochitl siempre la apoyaron en los tres debates porque son del prian representado por xochitl,la dejaron todo el tiempo que se portara tan bajo como ellos se portan,igual que los conductores que apoyan a xochitl,los programuchos baratos y bajos igual que ella,aferrados a sus mentiras en toda potencia",0,0,0,-1,30
3,unotv,gabinocordobajuarez-ht4vo,19/05/2024,Todos kieren el hueso pero nadie dice ke baje la gasolina,5,todos kieren el hueso pero nadie dice que baje la gasolina,-1,-1,0,-1,-1
3,unotv,valemadres302,19/05/2024,Primera vez que Máynez sonríe de vdd en todo el debate 1:37:02 jajajajajaja,5,primera vez que maynez sonríe de vdd en todo el debate 1:37:02 jajajajajaja,0,1,0,0,-1
3,unotv,giselavillalobos1038,19/05/2024,Ayuda para Guanajuato por favor.,6,ayuda para guanajuato por favor.,0,0,-1,0,12
3,unotv,GabyRomasteriSanz,19/05/2024,"Xochitl en lugar de decir las propuestas le tira a Claudia, ya que madure la señora.",17,"xochitl en lugar de decir las propuestas le tira a claudia,ya que madure la señora.",0,0,0,-1,38
3,unotv,melanypulidobojorquez8259,19/05/2024,El debate comienza en el minuto 38,14,el debate comienza en el minuto 38,0,0,0,0,-1
3,unotv,emanueloaxacaalejandro7562,19/05/2024,Chale ya se ve amlove,2,chale ya se ve amlove,1,0,0,0,0
3,unotv,Rowd-sy3kv,19/05/2024,El debate inicia en el minuto 33:00,3,el debate inicia en el minuto 33:00,0,0,0,0,-1
3,unotv,Faus_Zurfes,19/05/2024,xochitl le tira demasiado a clauida xd,12,xochitl le tira demasiado a clauida xd,0,0,0,-1,0
3,unotv,user-uv3ui2lk4f,19/05/2024,Pierde prian,8,pierde prian representado por xochitl,0,0,0,-1,0
3,unotv,user-uv3ui2lk4f,19/05/2024,Bsmps. S gsnar. Claudia,2,bsmps.s gsnar.claudia,1,0,0,0,12
3,unotv,renegonzalez2978,19/05/2024,Xochitl es una señora muy infantil con sus letreritos,19,xochitl es una señora muy infantil con sus letreritos,0,0,0,-1,10
3,unotv,alejandrolozano9272,19/05/2024,"Que bueno es Sebastian Ramirez en las mesas, no lo habia escuchado, se cotorreó toda la noche al representante del PRIAN",3,"que bueno es sebastian ramirez en las mesas,no lo habia escuchado,se cotorreó toda la noche al representante del prian representado por xochitl",0,0,0,-1,-1
3,unotv,Chemstaktico,19/05/2024,Solo saben leer,4,solo saben leer,-1,-1,0,-1,31
3,unotv,emiliacorrales7216,19/05/2024,pero a mí jamás me ha llegado una encuesta telefónica jajajajajajja,6,pero a mí jamás me ha llegado una encuesta telefónica jajajajajajja,0,0,-1,0,-1
3,unotv,LuisRivera-ev1dk,19/05/2024,Yo propongo dejar de llamar narcos y se les llame agricultores,4,yo propongo dejar de llamar narcotraficantes y se les llame agricultores,0,0,-1,0,26
3,unotv,christiancruz9770,19/05/2024,Que gueva da la cochilt .,8,que gueva da la xochitl.,0,0,0,-1,0
3,unotv,valerializethe3732,19/05/2024,VIVAAAA MAYNEZ,13,vivaaaa maynez,0,-1,0,0,17
3,unotv,arturochavez6321,19/05/2024,Qué madrina le pusieron a la innombrable,8,qué madrina le pusieron a la innombrable,0,0,-1,0,0
