num_debate,canal,username,fecha,comentario,num_likes,comentario_editado,Claudia,Maynez,Ninguno,Xóchitl,topic
3,heraldoDeMexico,marinamerino5905,19/05/2024,"Ay xochitl,  que si Claudia bailaba ballet y ella trabajaba, eso que !!!  la señora pelea como la vecina envidiosa....por favor, que pobreza y falta de argumentos",85,"ay xochitl,que si claudia bailaba ballet y ella trabajaba,eso que!!!la señora pelea como la vecina envidiosa....por favor,que pobreza y falta de argumentos",0,0,0,-1,10
3,heraldoDeMexico,bimexlandia4752,19/05/2024,xochitl no sabe de política cuando es su turno habla y dice lo que yo diría nada espera hasta que claudia hable para entender mejor el tema   Y así otra vez tirarle veneno  esa señora es de risa,30,xochitl no sabe de política cuando es su turno habla y dice lo que yo diría nada espera hasta que claudia hable para entender mejor el tema y así otra vez tirarle veneno esa señora es de risa,1,0,0,-1,-1
3,heraldoDeMexico,bimexlandia4752,19/05/2024,xochitl no escucha bien con el chicharo  o está lejos la pantalla donde se dictan se lo escriben habla nerviosa no sabe ni qué dice,22,xochitl no escucha bien con el chicharo o está lejos la pantalla donde se dictan se lo escriben habla nerviosa no sabe ni qué dice,0,0,0,-1,-1
3,heraldoDeMexico,CarlosGarcia-sx9sm,19/05/2024,"Pobre del Partido al que pertenece la señora. xochitl, sólo los está dejando ver en ridículo con su falta de conocimiento y  diplomacia al hablar. No soy partidista, soy mas de irme por quien hace las cosas bien. De verdad tendrían que ser muy huecos de su cabeza para votar por esta señora, no se sabe ni la historia del partido al que pertenece, que les hace pensar que conoce las necesidades del pueblo Mexicano.",13,"pobre del partido al que pertenece la señora.xochitl,sólo los está dejando ver en ridículo con su falta de conocimiento y diplomacia al hablar.no soy partidista,soy más de irme por quien hace las cosas bien.de verdad tendrían que hacer muy huecos de su cabeza para votar por esta señora,no se sabe ni la historia del partido al que pertenece,que les hace pensar que conoce las necesidades del pueblo mexicano.",0,0,0,-1,1
3,heraldoDeMexico,imar6911,19/05/2024,"Miro a mi alrededor mirando objetivamente que ha mejorado realmente, se que no puede cambiar en un abrir y cerrar de ojos. Pero recordemos que se nos prometió. Me preguntó cómo vemos nuestras calles las banquetas y toda la infraestructura urbana de la ciudad de México. Ahora estoy en los 30 y no me alcanza mi salario ni imaginar cómo voy a comprar una casa.  Otra cosa se vienen las lluvias para que sirve tanta propaganda ojalá recojan tanta basura. Porque eso hará que se inunde nuestra ciudad.",13,"miro a mi alrededor mirando objetivamente que ha mejorado realmente,se que no puede cambiar en un abrir y cerrar de ojos.pero recordemos que se nos prometió.me preguntó cómo vemos nuestras calles las banquetas y toda la infraestructura urbana de la ciudad de méxico.ahora estoy en los 30 y no me alcanza mi salario ni imaginar cómo voy a comprar una casa.otra cosa se vienen las lluvias para que sirve tanta propaganda ojalá recojan tanta basura.porque eso hará que se inunde nuestra ciudad.",-1,-1,-1,0,-1
3,heraldoDeMexico,marthadamianamores3540,19/05/2024,Estpy segura que la botarga lleva  chicharo,39,estpy segura que la botarga lleva chicharo,0,0,0,-1,0
3,heraldoDeMexico,whojahbless1560,19/05/2024,Xochitl apuntando dedos sin pruebas y todas las pruebas en contra de Ella por favor Dos de junio llega ya ya no aguanto escuchagg a egsa señoga. Y para celebrar el triunfo de Claudia...,46,xochitl apuntando dedos sin pruebas y todas las pruebas en contra de ella por favor dos de junio llega ya ya no aguanto escuchagg a egsa señoga.y para celebrar el triunfo de claudia...,1,0,0,-1,-1
3,heraldoDeMexico,lety2522,19/05/2024,Chochil cuando daras propuestas?????  Tu prian da pena por 70 años robaron y squearon al país,48,xochitl cuando daras propuestas?????tu prian representado por xochitl da pena por 70 años robaron y squearon al país,0,0,0,-1,-1
3,heraldoDeMexico,victorhugocastillofuentes4620,19/05/2024,Está señora Xochitl está mal en todas sus encuestas y la verdad tener un presidente así de ignorante no porque en todo lo que dice está mal,36,está señora xochitl está mal en todas sus encuestas y la verdad tener un presidente así de ignorante no porque en todo lo que dice está mal,0,0,0,-1,4
3,heraldoDeMexico,mariaisabelsanchezrosado2409,19/05/2024,Ni loca votaré x la botarga,52,ni loca votaré por la botarga,0,0,0,-1,2
3,heraldoDeMexico,guadalupecastro1140,19/05/2024,Ya por favor que xochitl se dedique con todo respeto a su persona a su salud es joven para lucir tan descuidada ️,26,ya por favor que xochitl se dedique con todo respeto a su persona a su salud es joven para lucir tan descuidada️,0,0,0,-1,0
3,heraldoDeMexico,lety2522,19/05/2024,"El prian firmo un contrato de Bucareli, afortunadamente terminó este año y no se volvera a firmar gracias a AMLO que si tuvo los pantalones puestos para rechazar su actualización contra EU y Canadá",14,"el prian representado por xochitl firmo un contrato de bucareli,afortunadamente terminó este año y no se volvera a firmar gracias a amlo que si tuvo los pantalones puestos para rechazar su actualización contra Estados Unidos y canadá",1,0,0,-1,-1
3,heraldoDeMexico,almacatolica5304,19/05/2024,“Fuimos los únicos que hicimos los programas sociales.” JAJAJA sí como no!  era mejor el seguro popular.,19,“fuimos los únicos que hicimos los programas sociales.”jajaja sí como no!era mejor el seguro popular.,-1,0,-1,0,-1
3,heraldoDeMexico,gerardosancheztoriz9800,19/05/2024,Cochil Gálvez no dio propuestas solo hizo lo mismo de los anteriores debates atacar a Claudia,32,xochitl galvez no dio propuestas solo hizo lo mismo de los anteriores debates atacar a claudia,0,0,0,-1,-1
3,heraldoDeMexico,malenaorozcogonzalez3368,19/05/2024,"Pues yo no se de que habla xochitl. Yo tengo cuatro hijos .las más grande nació con discapacidad, Hora tiene 27 años y el apoyo económico lo acaba de recibir  en abril de este año  ya que el otro gobierno nunca , nunca volteo a verla apesar de que iban a mi casa a verla muchas personas que según hacen el socio económico para dar la ayuda la segunda de mis hijas tubo que trabajar y pagar su universidad par poder seguir estudiando.  Ya por último mi hija más pequeña ahora tiene 12 años pero que paso? Tube que trabajar más  de lo normal par poder pagar las vacunas por que nunca había .y esto fue en el gobierno del prian  Ahora morena mi madre tiene una pensión mi hija xon discapacidad  tiene su pensión  A mi hijo de prepa le ayudan xon una beca para xomprar sus libros  VAMOS MORENA",23,"pues yo no se de que habla xochitl.yo tengo cuatro hijos.las más grande nació con discapacidad,hora tiene 27 años y el apoyo económico lo acaba de recibir en abril de este año ya que el otro gobierno nunca,nunca volteo a verla apesar de que iban a mi casa a verla muchas personas que según hacen el socio económico para dar la ayuda la segunda de mis hijas tuvo que trabajar y pagar su universidad par poder seguir estudiando.ya por último mi hija más pequeña ahora tiene 12 años pero que paso?tuve que trabajar más de lo normal par poder pagar las vacunas por que nunca había.y esto fue en el gobierno del prian representado por xochitl ahora morena mi madre tiene una pensión mi hija son discapacidad tiene su pensión a mi hijo de prepa le ayudan son una beca para xomprar sus libros vamos morena",1,0,0,-1,35
3,heraldoDeMexico,luisagarcia416,19/05/2024,FUERA PRIANGANOS,26,fuera prianganos,0,0,0,-1,0
3,heraldoDeMexico,lomejordetokiohotel7054,19/05/2024,Y donde estan esas escuelas interculturales yo no las veo,10,y donde estan esas escuelas interculturales yo no las veo,0,0,-1,0,19
3,heraldoDeMexico,Jess-nt5bq,19/05/2024,"xochitl,  eres literalmente un show, hablas muchas cosas sin sentido, eres todo lo que ya no queremos como represente, ya fueron muchos años que estuvieron en el poder y solo se han dedicado a llevarnos entre las patas, por qué los únicos que ganan son sus bolsillos, ya deja de ser el títerete",11,"xochitl,eres literalmente un show,hablas muchas cosas sin sentido,eres todo lo que ya no queremos como represente,ya fueron muchos años que estuvieron en el poder y solo se han dedicado a llevarnos entre las patas,por qué los únicos que ganan son sus bolsillos,ya deja de hacer el títerete",0,0,0,-1,-1
3,heraldoDeMexico,florvelazques6696,19/05/2024,Pero yo no entiendo por qué dicen que México está mejor en todos los sentidos si lo estamos viviendo Claudia está proponiendo muchas cosas pero no entiendo si está en el actual gobierno por qué no lo puso en práctica,8,pero yo no entiendo por qué dicen que méxico está mejor en todos los sentidos si lo estamos viviendo claudia está proponiendo muchas cosas pero no entiendo si está en el actual gobierno por qué no lo puso en práctica,1,0,0,0,1
3,heraldoDeMexico,jesusgarciapatistan1976,19/05/2024,Cuál programa social si al contrario les quitaron y disminuyendo las becas. A apoyaron más a los que no estudian ni trabajan.,12,cuál programa social si al contrario les quitaron y disminuyendo las becas.a apoyaron más a los que no estudian ni trabajan.,-1,0,0,0,-1
3,heraldoDeMexico,eddlaloramgood8555,19/05/2024,Claudia No necesita debate voy a votar por ella y el partido morena,55,claudia no necesita debate voy a votar por ella y el partido morena,1,0,0,0,-1
3,heraldoDeMexico,user-dg6qo8rm9h,19/05/2024,"pregunta: Porqué al mensaje primero de maynez le cortan cuando habla de morena y dejan lo del prian? Oigan, no soy partidario de MC pero que mal dejan a Morena como si ellos sensuraran cuando hablan mal de ellos, hayan sido o no. hay que ser parejos. no a la guerra sucia",3,"pregunta:porqué al mensaje primero de maynez le cortan cuando habla de morena y dejan lo del prian representado por xochitl?oigan,no soy partidario de Movimiento Ciudadano pero que mal dejan a morena como si ellos sensuraran cuando hablan mal de ellos,hayan sido o no.hay que hacer parejos.no a la guerra sucia",-1,-1,0,-1,-1
3,heraldoDeMexico,mariaisabelsanchezrosado2409,19/05/2024,Se la pasa tirandole a Claudia d.la abundancia d su corazón habla su bocota,24,se la pasa tirandole a claudia d.la abundancia d su corazón habla su bocota,1,0,0,0,-1
3,heraldoDeMexico,mildrethdegollado826,19/05/2024,Muuuuuyy bien maynez ..eso es algo que ayude a esas personas trastornadas ... Que están mal para solucionar un poco el femenicidio las violacoones y mas,11,muuuuuyy bien maynez..eso es algo que ayude a esas personas trastornadas...que están mal para solucionar un poco el femenicidio las violacoones y más,0,1,0,0,0
3,heraldoDeMexico,almacatolica5304,19/05/2024,"El salario mínimo actual no alcanza, pero no bajan los precios, y suben más rápido que nunca.",16,"el salario mínimo actual no alcanza,pero no bajan los precios,y suben más rápido que nunca.",-1,0,0,0,13
3,heraldoDeMexico,user-lw5rh9vp1u,19/05/2024,"Porque el ine le permite a la señora xochitl poner ese letrero??? Si esta libre de culpa, que arroje la primera piedra! Arriba morena Claudia para presidenta",7,"porque el ine le permite a la señora xochitl poner ese letrero???si esta libre de culpa,que arroje la primera piedra!arriba morena claudia para presidenta",1,0,0,-1,4
3,heraldoDeMexico,nereydalopez6332,19/05/2024,"Jajajajjajaja se mamo la Xóchilt se colgó del mitin marea rosa del INE jajajjaj y dice que es el movimiento de ella el de fuerza rosa....se mamo no manches el desespero político de la señora Xóchilt jajjajajjaja se pasó de lanza y ese movimiento lo registro ella el año pasado, y dice que es el movimiento de ella pobrecita mi vidaaaaa.",3,"jajajajjajaja se mama la xochitl se colgó del mitin marea rosa del ine jajajjaj y dice que es el movimiento de ella el de fuerza rosa....se mama no manches el desespero político de la señora xochitl jajjajajjaja se pasó de lanza y ese movimiento lo registro ella el año pasado,y dice que es el movimiento de ella pobrecita mi vidaaaaa.",0,0,0,-1,0
3,heraldoDeMexico,marinamerino5905,19/05/2024,"Que ha hecho xochitl a favor del pueblo, antes de pararse ahí, sólo para señalar.....ya siéntese señora y al otro que lo avala ???   par de improvisados",4,"que ha hecho xochitl a favor del pueblo,antes de pararse ahí,sólo para señalar.....ya siéntese señora y al otro que lo avala???par de improvisados",0,0,0,-1,0
3,heraldoDeMexico,AngelGabriel-my7pt,19/05/2024,,1,tira tus cartonsitos,0,-1,-1,0,0
3,heraldoDeMexico,user-yo5nf4vt7t,19/05/2024,Tira tus cartonsitos,0,"el PRIANRD representado por xochitl escogió a la más brutal para representarlos,ni un vota para usted para que desaparezcan de la política,a vender gelatinas",0,0,0,-1,2
3,heraldoDeMexico,franciscocmartinez8025,19/05/2024,"El pripanprd escogió a la más brutal para representarlos,  ni un vota para ud para que desaparezcan de la política, a vender gelatinas",2,como se pelean por los programas sociales el maynez y la xochitl.cuando sus partidos siempre criticaron todo de amlo incluido los programas sociales.,-1,-1,0,-1,-1
3,heraldoDeMexico,mariapolett5077,19/05/2024,Como se pelean  por los programas sociales el Maynez y la xochitl. Cuando sus partidos siempre criticaron todo de AMLO incluido los programas sociales.,4,los programas sociales los puso morena,-1,0,0,0,-1
3,heraldoDeMexico,lety2522,19/05/2024,Los programas sociales los puso MORENA,15,"duplicaron el número de médicos especialistas preparándolos en hospitales que no tienen el nivel de pacientes y equipo necesario para entrenar de manera óptima a esos médicos,hay 8 residentes de anestesia en clínicas que sólo tienen 2 quirófanos,solo buscan colapsar el sistema de salud para disminuir salarios por exceso de médicos sin trabajo y mal preparados",-1,0,-1,0,25
3,heraldoDeMexico,GeekssTV,19/05/2024,"Duplicaron el número de médicos especialistas preparándolos en hospitales que no tienen el nivel de pacientes y equipo necesario para entrenar de manera óptima a esos médicos, hay 8 residentes de anestesia en clínicas que sólo tienen 2 quirófanos, solo buscan colapsar el sistema de salud para disminuir salarios por exceso de médicos sin trabajo y mal preparados",2,"a lo mejor anabel hernández es una periodista seria,la conocemos como novelista,cuando haga un trabajo periodístico serio podremos evaluarla todos.",1,1,0,0,29
3,heraldoDeMexico,adrianalinares7042,19/05/2024,"A lo mejor Anabel Hernández es una periodista seria, la conocemos como novelista, cuando haga un trabajo periodístico serio podremos evaluarla todos.",2,"13:53 no hace falta más viviendas,sigue habiendo demasiadas vacías.no hace falta regalar más dinero a la industria inmobiliaria para que siga construyendo y quitando espacio.hace falta meter presión a la industria para cumplir con una vivienda digna y alcanzable para los jóvenes y los mayores,porque la vivienda no es un negocio;es un derecho.me niego rotundamente a que el dinero que trabajamos se vaya a los bolsillos de aquellos que rebosan en fortuna.",-1,0,-1,0,-1
3,heraldoDeMexico,abrilreyesnicolas9688,19/05/2024,"13:53  no hace falta más viviendas, sigue habiendo demasiadas vacías. No hace falta regalar más dinero a la industria inmobiliaria para que siga construyendo y quitando espacio. Hace falta meter presión a la industria para cumplir con una vivienda digna y alcanzable para los jóvenes y los mayores, porque la vivienda no es un negocio; es un derecho.  Me niego rotundamente a que el dinero que trabajamos se vaya a los bolsillos de aquellos que rebosan en fortuna.",5,xochitl ya no sabes ni que decir sigue de cínica y traicionera a nuestra patria de méxico lindo y querido.que siga morena porque es la única que a ayudado a el pueblo,1,0,0,-1,-1
3,heraldoDeMexico,jesusgabrielguadarramaroci9672,19/05/2024,Xochil ya no sabes ni que decir sigue de cínica y traicionera a nuestra patria de México lindo y querido. Que siga morena porque es la única que a ayudado a el pueblo,14,"yo no soy de méxico,apenas entré a ver por curiosidad pero en serio la señora galvez solo se dedica a atacar en lugar de ganar tiempo explicando sus propuestas,que mala estrategia la que tiene",0,0,0,-1,38
3,heraldoDeMexico,gabrieladelgado2923,19/05/2024,"Yo no soy de México,apenas entré a ver por curiosidad pero en serio la señora Galvez solo se dedica a atacar en lugar de ganar tiempo explicando sus propuestas, que mala estrategia la que tiene",0,pobre xochitl cada vez que miente se ahorca más no tiene autoridad moral en lo más mínimo que se creen que la gente que si está recibiendo esos apoyos simplemente no les va a creer esta señora es muy buena para mentir pero que bueno que eres candidata por que no eres competencia,0,0,0,-1,30
3,heraldoDeMexico,Cronox37,19/05/2024,Pobre xochilt cada vez que miente se ahorca más no tiene autoridad moral en lo más mínimo que se creen que la gente que si está recibiendo esos apoyos simplemente no les va a creer esta señora es muy buena para mentir pero que bueno que eres candidata por que no eres competencia,3,"siempre le voté al PAN,sin embargo esta vez voy a darle mi voto a claudia;me parece más preparada e inteligente.",1,0,0,-1,2
3,heraldoDeMexico,LuisPaz-xv2ky,19/05/2024,"Siempre le voté al PAN, sin embargo esta vez voy a darle mi voto a Claudia; me parece más preparada e inteligente.",2,me da tanto coraje ver como los 3 hacen promesas tratando de pretender que somos unos idiotas cuando la verdad es que estamos viendo la realidad de todo lo que esta pasando en todo mexico y nadie a hecho no tienen los huevos para pararce y hacer el trabajo que se debe hacer,-1,-1,0,-1,1
3,heraldoDeMexico,AngelJimenez-jr7gs,19/05/2024,Me da tanto coraje ver como los 3 hacen promesas tratando de pretender que somos unos idiotas cuando la verdad esque estamos viendo la realidad de todo lo que esta pasando en todo mexico y nadie a hecho no tienen los huevos para pararce y hacer el trabajo que se debe hacer,2,maynez se desenvuelve mucho mejor que xochitl.xochitl con sus actitudes tan nefastas,0,1,0,-1,-1
3,heraldoDeMexico,per-futuraproximalider5785,19/05/2024,Maynez se desenvuelve mucho mejor que Xochitl. Xochitl con sus actitudes tan nefastas,9,pobre xochitl dice que no va quitar los programas sociales si ella misma lo dijo y luego vio o escucho su error de estrategia y cambio jajajajaa nadie te creé xochitl,0,0,0,-1,38
3,heraldoDeMexico,Cronox37,19/05/2024,Pobre xochilt dice que no va quitar los programas sociales si ella misma lo dijo y luego vio o escucho su error de estrategia y cambio JAJAJAJAA nadie te cree xochilt,2,hay choxitl como crees que en 6años andres manuel iba a limpiar el mierdero que dejaron los presidentes que defiendes estas frita con morena reyna,-1,0,0,-1,4
3,heraldoDeMexico,nenymoral9367,19/05/2024,Hay choxitl como cres que en 6años andres manuel  iba a limpiar el mierdero que dejaron los presidentes que defiendes estas frita con morena reyna,1,esa xochitl lugar que hable lo que ah hecho de sus proyectos solo habla de sus hijos del presidente y solo sabe atacar y cuando le dicen sus a xochitl y solo sabe atacar y dice mentiras esa xochitl,0,0,0,-1,3
3,heraldoDeMexico,edgardaniel3426,19/05/2024,Esa xochitl lugar que hable lo que ah hecho de sus proyectos solo habla de sus hijos del presidente y solo sabe atacar y cuando le dicen sus a xochitl y solo sabe atacar y dice mentiras esa xochitl,3,"“la economía está mejor hoy que nunca.”jajajaja ay ajá,pues de la clase media hacia abajo no se ve.",-1,0,0,0,-1
3,heraldoDeMexico,almacatolica5304,19/05/2024,"“La economía está mejor hoy que nunca.” JAJAJAJA ay ajá, pues de la clase media hacia abajo no se ve.",10,es verdad morena anda comprando votos,-1,0,0,0,2
3,heraldoDeMexico,user-hh1ze5hn4q,19/05/2024,,1,mi voto para maynez️,1,0,0,0,2
3,heraldoDeMexico,DavidMagana-es4zx,19/05/2024,,9,déjense de quien miente pero el pri representado por xochitl y el PAN ya se dieron a conocer se paro la privatización.porq terminaban con todo el país.,0,0,0,-1,15
3,heraldoDeMexico,nayelizamora3903,19/05/2024,Es verdad morena   anda comprando votos,2,"maynez wow muy buenas propuestas""estoy entre maynez y sheinbaum""porque xochitl nada de propuestas en sus tres debates""",0,1,0,0,-1
3,heraldoDeMexico,alfonsodiaz789,19/05/2024,Mi voto para maynez ️,31,"dice pura babosada la xochitl,ni una idea clara en todo el debate,increíble:(",0,0,0,-1,6
3,heraldoDeMexico,Cronox37,19/05/2024,Déjense de quien miente pero el PRI y el PAN ya se dieron a conocer se paro la privatización. porque terminaban con todo el país.,3,viva morena xochitl,1,0,0,0,0
3,heraldoDeMexico,lordmix788,19/05/2024,"Maynez wow muy buenas propuestas"" estoy entre maynez y sheinbaum"" porque Xochitl nada de propuestas en sus tres debates""",1,"los que dicen que ella es judía,que la religión,etcétera sólo les recuerdo que la religión y él estado son cosas aparte,en méxico hay una libertad de credo,libertad de culto,no todos somos católicos no todos somos cristianos,no todos somos judíos,mormones,budistas,etcétera,a dios lo que es de dios al césar lo que es del césar,la religión es cosa aparte",-1,0,-1,0,-1
3,heraldoDeMexico,RDanielEstradaR,19/05/2024,"Dice pura babosada la Chochil, ni una idea clara en todo el debate, increíble :(",5,"xochitl queremos más propuestas,no la historia de tus competidores.",0,0,0,-1,33
3,heraldoDeMexico,angelicaescamilla9814,19/05/2024,Viva morena cochitl,7,xochitl la senora de las mentiras,0,0,0,-1,9
3,heraldoDeMexico,MariaElenaMorenoVenegas,19/05/2024,"Los que dicen que ella es judía, que la religión, etcétera sólo les recuerdo que la religión y él estado son cosas aparte, en México hay una libertad de credo, libertad de culto, no todos somos católicos no todos somos cristianos, no todos somos judíos, mormones, budistas, etcétera, a Dios lo que es de Dios al César lo que es del César, la religión rs cosa aparte",4,"no tiene propuestas xochitl,nada más ataca,es desde ninos ponerles más atencion",0,0,0,-1,21
3,heraldoDeMexico,alejandramejia743,19/05/2024,"Xochitl queremos más propuestas, no la historia de tus competidores.",4,"si lo que dice xochitl es que con morena estamos mal,con el gobierno pasado estaríamos un 70%peor y si nos gobernará ella estaríamos un 80%peor o más",1,0,0,-1,23
3,heraldoDeMexico,patriciamartinez6257,19/05/2024,Xochitl la senora de las mentiras,6,a ver maynez es xochitl no es felipe calderón no enrique peña,0,-1,0,-1,-1
3,heraldoDeMexico,patriciamartinez6257,19/05/2024,"No tiene propuestas Xochitl, nada mas ataca , es desde ninos ponerles mas atencion",7,de que sirve que aumente el salario si los precios de la canasta básica se fue al doble.,-1,0,0,0,13
3,heraldoDeMexico,AlfonsoRangel-pv4vj,19/05/2024,"Si lo que dice xochitl es que con morena estamos mal, con el gobierno pasado estaríamos un 70% peor y si nos gobernará ella estaríamos un 80% peor o más",1,"garcia luna esta en la carcel dice la botarga!!pero su hermana tambien x secuestradora que no se le olvide a xochitl botarga,cómo va a combatir a la delincuencia si vive con ella",0,0,0,-1,11
3,heraldoDeMexico,rosamarquez8502,19/05/2024,Aver Maynez es xochitl no es Felipe Calderón no Enrique Peña,0,edta señora solo ataca a claudia por que sabe que ella va a ganar,1,0,0,0,10
3,heraldoDeMexico,jesusgarciapatistan1976,19/05/2024,De que sirve que aumente el salario si los precios de la canasta básica se fue al doble.,7,"médicos especialistas,pero cubanos",0,0,-1,0,25
3,heraldoDeMexico,noramena8287,19/05/2024,"Garcia luna esta en la carcel dice ka botarga !! Pero su hermana tambien x secuestradora q no se le olvide a Chochil botarga , cómo va a combatir a la delincuencia si vive con ella",0,con morena,1,0,0,0,-1
3,heraldoDeMexico,angelicaescamilla9814,19/05/2024,Edta señora solo ataca a Claudia por que sabe que ella va a ganar,13,porque clauda como que quiere reirse jaja,-1,0,0,0,0
3,heraldoDeMexico,almacatolica5304,19/05/2024,"Médicos especialistas, pero CUBANOS",3,"doña xochitl sueña con claudia,no propone nada,pero como sale a doña xochitl denostar y a sacar sus acusaciones sin pruebas...morena va a la presidencia",1,0,0,-1,4
3,heraldoDeMexico,rosamarialeijagarcia530,19/05/2024,Con morena,6,"esa señora xochitl solo se dedica hablando puras in coherencias y atacando a diestra y siniestra.parece que está en el mercado.todos atacando a claudia,gracias a esta candidata estan consiguiendo su porcentaje de votantes.",1,0,0,-1,-1
3,heraldoDeMexico,-AnaXd,19/05/2024,porque clauda como que quiere reirse jaja,1,xochitl el seguro popular solo servia para llenar papeles y que las personas que nos atendieron en el archivo.fueran déspotas,0,0,0,-1,-1
3,heraldoDeMexico,DIZZY1993TJS,19/05/2024,,4,pues sé que muchos de las ciudades grandes no han visto mejora.pero estoy tan orgullosa de lo mucho que se ha ayudado a las comunidades más pobres y pequeñas.gente que trabaja duro bajo el sol por poquititas monedas.estoy feliz de ver que el dinero circula cuando fuera del país la inflación acabó con muchos.hay cosas que mejorar pero agradezco lo que morena hizo por la gente fuera de las grandes ciudades.,-1,0,0,0,-1
3,heraldoDeMexico,migdaliapena2457,19/05/2024,"doña xochitlsueña con Claudia, no propone nada, pero como sale a doña xochitldenostar y a sacar sus acusaciones sin pruebas...MORENA VA A LA PRESIDENCIA",2,esta muy mal el audio de este video les recomiendo verlo en otro canal,-1,-1,-1,0,27
